[
  {
    "title": "BEI Tegaskan Investasi Saham Bukan Judi, Pasar Modal Syariah Jadi Bukti",
    "url": "https://www.idxchannel.com/market-news/bei-tegaskan-investasi-saham-bukan-judi-pasar-modal-syariah-jadi-bukti",
    "date_display": "24/01/2026 08:15 WIB",
    "date": "2026-01-24",
    "image_url": "https://img.idxchannel.com/media/439/images/idx/2025/12/18/BEI_IOSCO.jpg",
    "category": "MARKET NEWS",
    "batch": 0,
    "source": "IDX Channel",
    "scraped_at": "2026-01-24T16:06:40.807461"
  },
  {
    "title": "DEWA Realisasikan Buyback 1,04 Miliar Saham, Sisa Dana Rp360 Miliar",
    "url": "https://www.idxchannel.com/market-news/dewa-realisasikan-buyback-104-miliar-saham-sisa-dana-rp360-miliar",
    "date_display": "24/01/2026 06:15 WIB",
    "date": "2026-01-24",
    "image_url": "https://img.idxchannel.com/media/439/images/idx/2024/03/22/Indikator_yang_Digunakan_Ketika_Pasar_Sedang_Sideways.jpg",
    "category": "MARKET NEWS",
    "batch": 0,
    "source": "IDX Channel",
    "scraped_at": "2026-01-24T16:06:40.808283"
  },
  {
    "title": "Unilever (UNVR) Gelar RUPSLB Pertengahan Februari 2026, Ini Agenda yang Dibahas",
    "url": "https://www.idxchannel.com/market-news/unilever-unvr-gelar-rupslb-pertengahan-februari-2026-ini-agenda-yang-dibahas",
    "date_display": "23/01/2026 10:26 WIB",
    "date": "2026-01-23",
    "image_url": "https://img.idxchannel.com/media/439/images/idx/2025/01/14/unilever_unvr.jpg",
    "category": "MARKET NEWS",
    "batch": 0,
    "source": "IDX Channel",
    "scraped_at": "2026-01-24T16:06:40.809050"
  },
  {
    "title": "Saham Konglomerat BUMI, DEWA, hingga PTRO Jatuh, Antisipasi MSCI?",
    "url": "https://www.idxchannel.com/market-news/saham-konglomerat-bumi-dewa-hingga-ptro-jatuh-antisipasi-msci",
    "date_display": "23/01/2026 07:06 WIB",
    "date": "2026-01-23",
    "image_url": "https://img.idxchannel.com/media/439/images/idx/2026/01/23/Saham_turun_-_Freepik_-_22_Jan_26.jpeg",
    "category": "MARKET NEWS",
    "batch": 0,
    "source": "IDX Channel",
    "scraped_at": "2026-01-24T16:06:40.809810"
  },
  {
    "title": "Emiten Baja (GDST) Cairkan Dividen Interim Hari Ini, Segini Nilainya",
    "url": "https://www.idxchannel.com/market-news/emiten-baja-gdst-cairkan-dividen-interim-hari-ini-segini-nilainya",
    "date_display": "23/01/2026 05:02 WIB",
    "date": "2026-01-23",
    "image_url": "https://img.idxchannel.com/media/439/images/idx/2023/12/18/Saham_yang_20_Tahun_Konsisten_Bagi_Dividen.jpg",
    "category": "MARKET NEWS",
    "batch": 0,
    "source": "IDX Channel",
    "scraped_at": "2026-01-24T16:06:40.810563"
  },
  {
    "title": "KRYA Berhentikan An Shaohong Sebagai Komut, Ini Penggantinya",
    "url": "https://www.idxchannel.com/market-news/krya-berhentikan-an-shaohong-sebagai-komut-ini-penggantinya",
    "date_display": "22/01/2026 14:51 WIB",
    "date": "2026-01-22",
    "image_url": "https://img.idxchannel.com/media/439/images/idx/2025/08/28/krya_ecgo_ist.jpeg",
    "category": "MARKET NEWS",
    "batch": 0,
    "source": "IDX Channel",
    "scraped_at": "2026-01-24T16:06:40.811333"
  },
  {
    "title": "Nusantara Sawit (NSSS) Tunjuk Dudung Abdurachman Jadi Komisaris Independen",
    "url": "https://www.idxchannel.com/market-news/nusantara-sawit-nsss-tunjuk-dudung-abdurachman-jadi-komisaris-independen",
    "date_display": "22/01/2026 11:39 WIB",
    "date": "2026-01-22",
    "image_url": "https://img.idxchannel.com/media/439/images/idx/2025/11/13/CPO_sawit_-_freepik_-_13_Nov_25.jpg",
    "category": "MARKET NEWS",
    "batch": 0,
    "source": "IDX Channel",
    "scraped_at": "2026-01-24T16:06:40.812105"
  },
  {
    "title": "Pengetatan Rokok Ilegal dan Stabilitas Cukai Jadi Katalis Saham Rokok",
    "url": "https://www.idxchannel.com/market-news/pengetatan-rokok-ilegal-dan-stabilitas-cukai-jadi-katalis-saham-rokok",
    "date_display": "22/01/2026 07:09 WIB",
    "date": "2026-01-22",
    "image_url": "https://img.idxchannel.com/media/439/images/idx/2025/09/23/rokok_-_freepik_-_8_-_23_Sept_25.jpg",
    "category": "MARKET NEWS",
    "batch": 0,
    "source": "IDX Channel",
    "scraped_at": "2026-01-24T16:06:40.812860"
  },
  {
    "title": "Terungkap Sosok yang Menjual 18,19 Miliar Saham BUMI Senilai Rp6,91 Triliun",
    "url": "https://www.idxchannel.com/market-news/terungkap-sosok-yang-menjual-1819-miliar-saham-bumi-senilai-rp691-triliun",
    "date_display": "21/01/2026 17:08 WIB",
    "date": "2026-01-21",
    "image_url": "https://img.idxchannel.com/media/439/images/idx/2023/07/03/PT_Bumi_Resources_Tbk__BUMI_.jpg",
    "category": "MARKET NEWS",
    "batch": 0,
    "source": "IDX Channel",
    "scraped_at": "2026-01-24T16:06:40.813619"
  },
  {
    "title": "Saham Bank BBCA-BMRI Cs Kompak Merah saat BI Kembali Tahan Suku Bunga",
    "url": "https://www.idxchannel.com/market-news/saham-bank-bbca-bmri-cs-kompak-merah-saat-bi-kembali-tahan-suku-bunga",
    "date_display": "21/01/2026 14:58 WIB",
    "date": "2026-01-21",
    "image_url": "https://img.idxchannel.com/media/439/images/idx/2025/08/18/gedung__bank_-_freepik_18_agust_25.jpg",
    "category": "MARKET NEWS",
    "batch": 1,
    "source": "IDX Channel",
    "scraped_at": "2026-01-24T16:06:41.941684"
  },
  {
    "title": "Cek Rekening, Dividen Interim RDTX Rp53,76 Miliar Cair Hari Ini",
    "url": "https://www.idxchannel.com/market-news/cek-rekening-dividen-interim-rdtx-rp5376-miliar-cair-hari-ini",
    "date_display": "21/01/2026 13:15 WIB",
    "date": "2026-01-21",
    "image_url": "https://img.idxchannel.com/media/439/images/idx/2025/05/08/dividen.jpg",
    "category": "MARKET NEWS",
    "batch": 1,
    "source": "IDX Channel",
    "scraped_at": "2026-01-24T16:06:41.942305"
  },
  {
    "title": "IHSG Turun Lebih 1 Persen saat Pasar Menanti RDG BI, UNTR-ASII Cs Jadi Beban",
    "url": "https://www.idxchannel.com/market-news/ihsg-turun-lebih-1-persen-saat-pasar-menanti-rdg-bi-untr-asii-cs-jadi-beban",
    "date_display": "21/01/2026 12:49 WIB",
    "date": "2026-01-21",
    "image_url": "https://img.idxchannel.com/media/439/images/idx/2023/08/12/Saham_Turun_-_Freepik.jpeg",
    "category": "MARKET NEWS",
    "batch": 1,
    "source": "IDX Channel",
    "scraped_at": "2026-01-24T16:06:41.942922"
  },
  {
    "title": "Presiden Komisaris Lippo Insurance (LPGI) Mengundurkan Diri, Ini Penggantinya",
    "url": "https://www.idxchannel.com/market-news/presiden-komisaris-lippo-insurance-lpgi-mengundurkan-diri-ini-penggantinya",
    "date_display": "21/01/2026 04:10 WIB",
    "date": "2026-01-21",
    "image_url": "https://img.idxchannel.com/media/439/images/idx/2026/01/20/LPGI_dok_LPGI.JPG",
    "category": "MARKET NEWS",
    "batch": 1,
    "source": "IDX Channel",
    "scraped_at": "2026-01-24T16:06:41.943543"
  },
  {
    "title": "Ganti Nahkoda, PGEO Tunjuk Ahmad Yani Jadi Dirut Utama",
    "url": "https://www.idxchannel.com/market-news/ganti-nahkoda-pgeo-tunjuk-ahmad-yani-jadi-dirut-utama",
    "date_display": "20/01/2026 21:23 WIB",
    "date": "2026-01-20",
    "image_url": "https://img.idxchannel.com/media/439/images/idx/2026/01/20/Foto_1a.jpeg",
    "category": "MARKET NEWS",
    "batch": 1,
    "source": "IDX Channel",
    "scraped_at": "2026-01-24T16:06:41.944169"
  },
  {
    "title": "50 Emiten Belum Sampaikan Lapkeu per September 2025, BEI Berikan SP dan Denda Rp150 Juta",
    "url": "https://www.idxchannel.com/market-news/50-emiten-belum-sampaikan-lapkeu-per-september-2025-bei-berikan-sp-dan-denda-rp150-juta",
    "date_display": "20/01/2026 16:36 WIB",
    "date": "2026-01-20",
    "image_url": "https://img.idxchannel.com/media/439/images/idx/2019/06/27/Bursa_Efek_Indonesia.jpg",
    "category": "MARKET NEWS",
    "batch": 1,
    "source": "IDX Channel",
    "scraped_at": "2026-01-24T16:06:41.944779"
  },
  {
    "title": "Sederet Sektor Saham Pilihan di Tengah Rekor IHSG",
    "url": "https://www.idxchannel.com/market-news/sederet-sektor-saham-pilihan-di-tengah-rekor-ihsg",
    "date_display": "20/01/2026 11:29 WIB",
    "date": "2026-01-20",
    "image_url": "https://img.idxchannel.com/media/439/images/idx/2026/01/20/IHSG_-_19_Jan_26_-_background.jpeg",
    "category": "MARKET NEWS",
    "batch": 2,
    "source": "IDX Channel",
    "scraped_at": "2026-01-24T16:06:43.066449"
  },
  {
    "title": "IHSG Rajin Rekor saat Rupiah di Level Terendah, Analis Soroti Sentimen Ini",
    "url": "https://www.idxchannel.com/market-news/ihsg-rajin-rekor-saat-rupiah-di-level-terendah-analis-soroti-sentimen-ini",
    "date_display": "20/01/2026 10:47 WIB",
    "date": "2026-01-20",
    "image_url": "https://img.idxchannel.com/media/439/images/idx/2026/01/20/IHSG_rekor_-_19_Jan_26.jpeg",
    "category": "MARKET NEWS",
    "batch": 2,
    "source": "IDX Channel",
    "scraped_at": "2026-01-24T16:06:43.067112"
  },
  {
    "title": "Transaksi Nego Jumbo Rp6,9 Triliun di Saham BUMI, Aksi Grup Salim?",
    "url": "https://www.idxchannel.com/market-news/transaksi-nego-jumbo-rp69-triliun-di-saham-bumi-aksi-grup-salim",
    "date_display": "20/01/2026 07:47 WIB",
    "date": "2026-01-20",
    "image_url": "https://img.idxchannel.com/media/439/images/idx/2025/05/16/bumi_resources.jpeg",
    "category": "MARKET NEWS",
    "batch": 2,
    "source": "IDX Channel",
    "scraped_at": "2026-01-24T16:06:43.067824"
  },
  {
    "title": "DEWA Kantongi Perpanjangan Kontrak Dua Proyek Tambang Arutmin Senilai Rp10,5 Triliun",
    "url": "https://www.idxchannel.com/market-news/dewa-kantongi-perpanjangan-kontrak-dua-proyek-tambang-arutmin-senilai-rp105-triliun",
    "date_display": "19/01/2026 20:37 WIB",
    "date": "2026-01-19",
    "image_url": "https://img.idxchannel.com/media/439/images/idx/2023/06/15/coalmining_servies_darma_henwa-.jpg",
    "category": "MARKET NEWS",
    "batch": 2,
    "source": "IDX Channel",
    "scraped_at": "2026-01-24T16:06:43.068535"
  },
  {
    "title": "Rupiah Dekati Rp17.000 Saat IHSG Cetak Rekor, Ini Kata Purbaya",
    "url": "https://www.idxchannel.com/market-news/rupiah-dekati-rp17000-saat-ihsg-cetak-rekor-ini-kata-purbaya",
    "date_display": "19/01/2026 20:05 WIB",
    "date": "2026-01-19",
    "image_url": "https://img.idxchannel.com/media/439/images/idx/2025/10/10/Purbaya_-_BEI_-_9_Okt_25_-_2.jpg",
    "category": "MARKET NEWS",
    "batch": 2,
    "source": "IDX Channel",
    "scraped_at": "2026-01-24T16:06:43.069160"
  },
  {
    "title": "IHSG Hari Ini Berpotensi Sideways, Cermati ASII, CUAN, hingga BUVA",
    "url": "https://www.idxchannel.com/market-news/ihsg-hari-ini-berpotensi-sideways-cermati-asii-cuan-hingga-buva",
    "date_display": "19/01/2026 09:15 WIB",
    "date": "2026-01-19",
    "image_url": "https://img.idxchannel.com/media/439/images/idx/2026/01/06/IHSG_hijau.JPG",
    "category": "MARKET NEWS",
    "batch": 2,
    "source": "IDX Channel",
    "scraped_at": "2026-01-24T16:06:43.069790"
  },
  {
    "title": "Emiten Grup Bakrie Pimpin Daftar 10 Saham Paling Sering Ditransaksikan Sepekan",
    "url": "https://www.idxchannel.com/market-news/emiten-grup-bakrie-pimpin-daftar-10-saham-paling-sering-ditransaksikan-sepekan",
    "date_display": "17/01/2026 15:00 WIB",
    "date": "2026-01-17",
    "image_url": "https://img.idxchannel.com/media/439/images/idx/2025/04/23/Jika_Saham_Profit_Taking_dan_UMA.jpg",
    "category": "MARKET NEWS",
    "batch": 3,
    "source": "IDX Channel",
    "scraped_at": "2026-01-24T16:06:44.190932"
  },
  {
    "title": "Trinland (TRIN) Berencana Tambah Komisaris Independen",
    "url": "https://www.idxchannel.com/market-news/trinland-trin-berencana-tambah-komisaris-independen",
    "date_display": "17/01/2026 08:30 WIB",
    "date": "2026-01-17",
    "image_url": "https://img.idxchannel.com/media/439/images/idx/2025/12/04/trinland.jpg",
    "category": "MARKET NEWS",
    "batch": 3,
    "source": "IDX Channel",
    "scraped_at": "2026-01-24T16:06:44.191562"
  },
  {
    "title": "RMKE Ganti Direksi, Volume Jasa Logistik Ditarget 12,7 Juta Ton di 2026",
    "url": "https://www.idxchannel.com/market-news/rmke-ganti-direksi-volume-jasa-logistik-ditarget-127-juta-ton-di-2026",
    "date_display": "15/01/2026 15:30 WIB",
    "date": "2026-01-15",
    "image_url": "https://img.idxchannel.com/media/439/images/idx/2026/01/15/1001115512.jpg",
    "category": "MARKET NEWS",
    "batch": 3,
    "source": "IDX Channel",
    "scraped_at": "2026-01-24T16:06:44.192188"
  },
  {
    "title": "Merdeka Copper Gold (MDKA) Realisasikan Pengalihan 5,38 Juta Saham Buyback",
    "url": "https://www.idxchannel.com/market-news/merdeka-copper-gold-mdka-realisasikan-pengalihan-538-juta-saham-buyback",
    "date_display": "15/01/2026 13:30 WIB",
    "date": "2026-01-15",
    "image_url": "https://img.idxchannel.com/media/439/images/idx/2022/07/19/Sejarah_Saham_MDKA.jpeg",
    "category": "MARKET NEWS",
    "batch": 3,
    "source": "IDX Channel",
    "scraped_at": "2026-01-24T16:06:44.192817"
  },
  {
    "title": "Rupiah Sore Ini Ditutup Menguat ke Rp16.865 per Dolar AS",
    "url": "https://www.idxchannel.com/market-news/rupiah-sore-ini-ditutup-menguat-ke-rp16865-per-dolar-as",
    "date_display": "14/01/2026 15:43 WIB",
    "date": "2026-01-14",
    "image_url": "https://img.idxchannel.com/media/439/images/idx/2025/04/24/rupiah_freepik_2.jpg",
    "category": "MARKET NEWS",
    "batch": 3,
    "source": "IDX Channel",
    "scraped_at": "2026-01-24T16:06:44.193426"
  },
  {
    "title": "Optimisme Pasar Menguat, IHSG Bisa Tembus 10.500 di Akhir 2026",
    "url": "https://www.idxchannel.com/market-news/optimisme-pasar-menguat-ihsg-bisa-tembus-10500-di-akhir-2026",
    "date_display": "14/01/2026 14:59 WIB",
    "date": "2026-01-14",
    "image_url": "https://img.idxchannel.com/media/439/images/idx/2026/01/06/IHSG_freepik.jpg",
    "category": "MARKET NEWS",
    "batch": 3,
    "source": "IDX Channel",
    "scraped_at": "2026-01-24T16:06:44.194042"
  },
  {
    "title": "Purbaya Optimistis Rupiah Kembali Menguat dalam 2 Minggu, Ungkap Indikatornya",
    "url": "https://www.idxchannel.com/market-news/purbaya-optimistis-rupiah-kembali-menguat-dalam-2-minggu-ungkap-indikatornya",
    "date_display": "14/01/2026 11:19 WIB",
    "date": "2026-01-14",
    "image_url": "https://img.idxchannel.com/media/439/images/idx/2025/12/11/purbaya_tkd_pemda_foto_tangguh_img.jpg",
    "category": "MARKET NEWS",
    "batch": 4,
    "source": "IDX Channel",
    "scraped_at": "2026-01-24T16:06:45.311288"
  },
  {
    "title": "Dua Komisaris Mitra Komunikasi (MKNT) Mundur di Tengah Rencana Pemulihan Bisnis",
    "url": "https://www.idxchannel.com/market-news/dua-komisaris-mitra-komunikasi-mknt-mundur-di-tengah-rencana-pemulihan-bisnis",
    "date_display": "14/01/2026 04:00 WIB",
    "date": "2026-01-14",
    "image_url": "https://img.idxchannel.com/media/439/images/idx/2024/11/29/bei_idx.jpg",
    "category": "MARKET NEWS",
    "batch": 4,
    "source": "IDX Channel",
    "scraped_at": "2026-01-24T16:06:45.311914"
  },
  {
    "title": "Siap-Siap Bank Mandiri (BMRI) Bagikan Dividen Interim Rp9,3 Triliun Besok",
    "url": "https://www.idxchannel.com/market-news/siap-siap-bank-mandiri-bmri-bagikan-dividen-interim-rp93-triliun-besok",
    "date_display": "13/01/2026 20:50 WIB",
    "date": "2026-01-13",
    "image_url": "https://img.idxchannel.com/media/439/images/idx/2025/02/21/BMRI.JPG",
    "category": "MARKET NEWS",
    "batch": 4,
    "source": "IDX Channel",
    "scraped_at": "2026-01-24T16:06:45.312531"
  },
  {
    "title": "Rupiah Ditutup Melemah ke Rp16.877 per USD, Ini Sederet Sentimennya",
    "url": "https://www.idxchannel.com/market-news/rupiah-ditutup-melemah-ke-rp16877-per-usd-ini-sederet-sentimennya",
    "date_display": "13/01/2026 16:07 WIB",
    "date": "2026-01-13",
    "image_url": "https://img.idxchannel.com/media/439/images/idx/2025/10/22/Rupiah_sindonews.JPG",
    "category": "MARKET NEWS",
    "batch": 4,
    "source": "IDX Channel",
    "scraped_at": "2026-01-24T16:06:45.313149"
  },
  {
    "title": "Saham Konglomerat Grup Bakrie hingga Hapsoro Tumbang Lagi",
    "url": "https://www.idxchannel.com/market-news/saham-konglomerat-grup-bakrie-hingga-hapsoro-tumbang-lagi",
    "date_display": "13/01/2026 12:07 WIB",
    "date": "2026-01-13",
    "image_url": "https://img.idxchannel.com/media/439/images/idx/2024/03/27/saham_turun_-_freepik_-_7.jpg",
    "category": "MARKET NEWS",
    "batch": 4,
    "source": "IDX Channel",
    "scraped_at": "2026-01-24T16:06:45.313953"
  },
  {
    "title": "Saham Agung Podomoro (APLN) Terbang 3 Hari di Tengah Aksi Divestasi",
    "url": "https://www.idxchannel.com/market-news/saham-agung-podomoro-apln-terbang-3-hari-di-tengah-aksi-divestasi",
    "date_display": "13/01/2026 11:15 WIB",
    "date": "2026-01-13",
    "image_url": "https://img.idxchannel.com/media/439/images/idx/2026/01/13/APLN_Agung_Podomoro_Land.jpg",
    "category": "MARKET NEWS",
    "batch": 4,
    "source": "IDX Channel",
    "scraped_at": "2026-01-24T16:06:45.314610"
  },
  {
    "title": "BRI (BBRI) Terbitkan Surat Berharga Komersial Senilai Rp500 Miliar",
    "url": "https://www.idxchannel.com/market-news/bri-bbri-terbitkan-surat-berharga-komersial-senilai-rp500-miliar",
    "date_display": "13/01/2026 02:00 WIB",
    "date": "2026-01-13",
    "image_url": "https://img.idxchannel.com/media/439/images/idx/2026/01/12/sbk_bri.jpg",
    "category": "MARKET NEWS",
    "batch": 5,
    "source": "IDX Channel",
    "scraped_at": "2026-01-24T16:06:46.420950"
  },
  {
    "title": "Komisaris Utama Envy Technologies (ENVY) Meninggal Dunia",
    "url": "https://www.idxchannel.com/market-news/komisaris-utama-envy-technologies-envy-meninggal-dunia",
    "date_display": "12/01/2026 19:24 WIB",
    "date": "2026-01-12",
    "image_url": "https://img.idxchannel.com/media/439/images/idx/2026/01/12/1632374956339.jpg",
    "category": "MARKET NEWS",
    "batch": 5,
    "source": "IDX Channel",
    "scraped_at": "2026-01-24T16:06:46.421697"
  },
  {
    "title": "IHSG Sempat Terguncang hingga Turun 2 Persen, Simak Penyebabnya",
    "url": "https://www.idxchannel.com/market-news/ihsg-sempat-terguncang-hingga-turun-2-persen-simak-penyebabnya",
    "date_display": "12/01/2026 16:56 WIB",
    "date": "2026-01-12",
    "image_url": "https://img.idxchannel.com/media/439/images/idx/2023/10/27/saham_turun_-_asing_-_freepik.jpg",
    "category": "MARKET NEWS",
    "batch": 5,
    "source": "IDX Channel",
    "scraped_at": "2026-01-24T16:06:46.422334"
  },
  {
    "title": "Rupiah Melemah ke Rp16.855 di Awal Pekan, Pasar Cermati Gejolak Iran",
    "url": "https://www.idxchannel.com/market-news/rupiah-melemah-ke-rp16855-di-awal-pekan-pasar-cermati-gejolak-iran",
    "date_display": "12/01/2026 16:31 WIB",
    "date": "2026-01-12",
    "image_url": "https://img.idxchannel.com/media/439/images/idx/2026/01/12/Rupiah_sindonews.JPG",
    "category": "MARKET NEWS",
    "batch": 5,
    "source": "IDX Channel",
    "scraped_at": "2026-01-24T16:06:46.422971"
  },
  {
    "title": "IHSG Sempat Jatuh Lebih dari 2 Persen di Tengah Rontoknya Saham Konglo, Ada Apa?",
    "url": "https://www.idxchannel.com/market-news/ihsg-sempat-jatuh-lebih-dari-2-persen-di-tengah-rontoknya-saham-konglo-ada-apa",
    "date_display": "12/01/2026 15:15 WIB",
    "date": "2026-01-12",
    "image_url": "https://img.idxchannel.com/media/439/images/idx/2024/04/01/saham_turun_-_12_-_freepik.jpg",
    "category": "MARKET NEWS",
    "batch": 5,
    "source": "IDX Channel",
    "scraped_at": "2026-01-24T16:06:46.423586"
  },
  {
    "title": "Saham Pakuwon (PWON) Terbang usai Komentar Yudo Sadewa, Simak Kata Analis",
    "url": "https://www.idxchannel.com/market-news/saham-pakuwon-pwon-terbang-usai-komentar-yudo-sadewa-simak-kata-analis",
    "date_display": "12/01/2026 12:13 WIB",
    "date": "2026-01-12",
    "image_url": "https://img.idxchannel.com/media/439/images/idx/2026/01/12/Tunjungan_Pakuwon_PWON.jpg",
    "category": "MARKET NEWS",
    "batch": 5,
    "source": "IDX Channel",
    "scraped_at": "2026-01-24T16:06:46.424202"
  },
  {
    "title": "148 Ribu Investor Baru Serbu Saham BUMI di Tengah Reli",
    "url": "https://www.idxchannel.com/market-news/148-ribu-investor-baru-serbu-saham-bumi-di-tengah-reli",
    "date_display": "12/01/2026 07:07 WIB",
    "date": "2026-01-12",
    "image_url": "https://img.idxchannel.com/media/439/images/idx/2025/11/22/Bumi_Resources_-_BUMI_-_22_Nov_25.jpg",
    "category": "MARKET NEWS",
    "batch": 6,
    "source": "IDX Channel",
    "scraped_at": "2026-01-24T16:06:47.535772"
  },
  {
    "title": "Asing Lepas Saham Konglo Ini, Bakrie hingga Salim Masuk Daftar Jual",
    "url": "https://www.idxchannel.com/market-news/asing-lepas-saham-konglo-ini-bakrie-hingga-salim-masuk-daftar-jual",
    "date_display": "11/01/2026 11:10 WIB",
    "date": "2026-01-11",
    "image_url": "https://img.idxchannel.com/media/439/images/idx/2024/04/02/saham_turun_-_freepik_-_14.jpg",
    "category": "MARKET NEWS",
    "batch": 6,
    "source": "IDX Channel",
    "scraped_at": "2026-01-24T16:06:47.536402"
  },
  {
    "title": "OJK Sebut IHSG Bisa Tembus Level 10.000 di 2026, Ini Syaratnya",
    "url": "https://www.idxchannel.com/market-news/ojk-sebut-ihsg-bisa-tembus-level-10000-di-2026-ini-syaratnya",
    "date_display": "10/01/2026 14:22 WIB",
    "date": "2026-01-10",
    "image_url": "https://img.idxchannel.com/media/439/images/idx/2026/01/05/IHSG_freepik.jpg",
    "category": "MARKET NEWS",
    "batch": 6,
    "source": "IDX Channel",
    "scraped_at": "2026-01-24T16:06:47.537023"
  },
  {
    "title": "Siapa Kandidat Kuat Penghuni MSCI 2026? Ini Proyeksi Analis",
    "url": "https://www.idxchannel.com/market-news/siapa-kandidat-kuat-penghuni-msci-2026-ini-proyeksi-analis",
    "date_display": "10/01/2026 07:30 WIB",
    "date": "2026-01-10",
    "image_url": "https://img.idxchannel.com/media/439/images/idx/2025/11/06/MSCI_-_6_Nov_25.jpg",
    "category": "MARKET NEWS",
    "batch": 6,
    "source": "IDX Channel",
    "scraped_at": "2026-01-24T16:06:47.537638"
  },
  {
    "title": "Rahayu Saraswati Resmi Kuasai 5 Persen Saham Trinland (TRIN)",
    "url": "https://www.idxchannel.com/market-news/rahayu-saraswati-resmi-kuasai-5-persen-saham-trinland-trin",
    "date_display": "09/01/2026 14:42 WIB",
    "date": "2026-01-09",
    "image_url": "https://img.idxchannel.com/media/439/images/idx/2025/12/22/trinland.jpeg",
    "category": "MARKET NEWS",
    "batch": 6,
    "source": "IDX Channel",
    "scraped_at": "2026-01-24T16:06:47.538373"
  },
  {
    "title": "Aksi Lego CGS, Andhesti, dan Chengdong di Tengah Reli BRMS, BUMI, DEWA",
    "url": "https://www.idxchannel.com/market-news/aksi-lego-cgs-andhesti-dan-chengdong-di-tengah-reli-brms-bumi-dewa",
    "date_display": "09/01/2026 14:30 WIB",
    "date": "2026-01-09",
    "image_url": "https://img.idxchannel.com/media/439/images/idx/2025/08/30/brms_bumi_resources_minerals.jpeg",
    "category": "MARKET NEWS",
    "batch": 6,
    "source": "IDX Channel",
    "scraped_at": "2026-01-24T16:06:47.539009"
  },
  {
    "title": "Saham RLCO ARA 17 Kali: Viral di Kalangan Ritel di Media Sosial, Inilah Pemiliknya",
    "url": "https://www.idxchannel.com/market-news/saham-rlco-ara-17-kali-viral-di-kalangan-ritel-di-media-sosial-inilah-pemiliknya",
    "date_display": "09/01/2026 13:25 WIB",
    "date": "2026-01-09",
    "image_url": "https://img.idxchannel.com/media/439/images/idx/2026/01/09/RLCO.jpg",
    "category": "MARKET NEWS",
    "batch": 7,
    "source": "IDX Channel",
    "scraped_at": "2026-01-24T16:06:48.663180"
  },
  {
    "title": "Jumlah Investor Pasar Modal Indonesia Tembus 20,36 Juta Orang di Akhir 2025",
    "url": "https://www.idxchannel.com/market-news/jumlah-investor-pasar-modal-indonesia-tembus-2036-juta-orang-di-akhir-2025",
    "date_display": "09/01/2026 10:58 WIB",
    "date": "2026-01-09",
    "image_url": "https://img.idxchannel.com/media/439/images/idx/2024/07/22/Investor_dan_Pemegang_Saham_Apa_Bedanya.jpeg",
    "category": "MARKET NEWS",
    "batch": 7,
    "source": "IDX Channel",
    "scraped_at": "2026-01-24T16:06:48.663835"
  },
  {
    "title": "Profit Taking Mereda, Tekanan Rupiah Bayangi IHSG",
    "url": "https://www.idxchannel.com/market-news/profit-taking-mereda-tekanan-rupiah-bayangi-ihsg",
    "date_display": "09/01/2026 09:56 WIB",
    "date": "2026-01-09",
    "image_url": "https://img.idxchannel.com/media/439/images/idx/2025/10/11/IHSG_-_Papan_-_10_Okt_25.jpg",
    "category": "MARKET NEWS",
    "batch": 7,
    "source": "IDX Channel",
    "scraped_at": "2026-01-24T16:06:48.664483"
  },
  {
    "title": "Kepercayaan Investor ke Ekonomi RI Tinggi, Purbaya Pede IHSG Tembus 10.000",
    "url": "https://www.idxchannel.com/market-news/kepercayaan-investor-ke-ekonomi-ri-tinggi-purbaya-pede-ihsg-tembus-10000",
    "date_display": "08/01/2026 20:33 WIB",
    "date": "2026-01-08",
    "image_url": "https://img.idxchannel.com/media/439/images/idx/2026/01/08/purbaya_ihsg_10_000_foto_anggie_img.jpg",
    "category": "MARKET NEWS",
    "batch": 7,
    "source": "IDX Channel",
    "scraped_at": "2026-01-24T16:06:48.665090"
  },
  {
    "title": "IHSG Sempat Tembus 9.000, Purbaya: Sinyal Kepercayaan Investor Terhadap Ekonomi RI",
    "url": "https://www.idxchannel.com/market-news/ihsg-sempat-tembus-9000-purbaya-sinyal-kepercayaan-investor-terhadap-ekonomi-ri",
    "date_display": "08/01/2026 14:49 WIB",
    "date": "2026-01-08",
    "image_url": "https://img.idxchannel.com/media/439/images/idx/2026/01/08/1000904877.jpg",
    "category": "MARKET NEWS",
    "batch": 7,
    "source": "IDX Channel",
    "scraped_at": "2026-01-24T16:06:48.665695"
  },
  {
    "title": "Deretan Saham yang Bagikan Dividen Januari 2026, Ada yang Belum Cum Date",
    "url": "https://www.idxchannel.com/market-news/deretan-saham-yang-bagikan-dividen-januari-2026-ada-yang-belum-cum-date",
    "date_display": "08/01/2026 11:37 WIB",
    "date": "2026-01-08",
    "image_url": "https://img.idxchannel.com/media/439/images/idx/2023/05/08/Emiten_yang_Bagi_Dividen_Terbesar_Mei.jpg",
    "category": "MARKET NEWS",
    "batch": 7,
    "source": "IDX Channel",
    "scraped_at": "2026-01-24T16:06:48.666303"
  },
  {
    "title": "Tembus Level 9.000, IHSG Cetak Rekor Tertinggi Baru di Sesi Pagi Hari Ini",
    "url": "https://www.idxchannel.com/market-news/tembus-level-9000-ihsg-cetak-rekor-tertinggi-baru-di-sesi-pagi-hari-ini",
    "date_display": "08/01/2026 10:41 WIB",
    "date": "2026-01-08",
    "image_url": "https://img.idxchannel.com/media/439/images/idx/2026/01/08/ihsg_9000.jpg",
    "category": "MARKET NEWS",
    "batch": 8,
    "source": "IDX Channel",
    "scraped_at": "2026-01-24T16:06:49.781098"
  },
  {
    "title": "Saham Prajogo Menghijau, Petrosea (PTRO) Sentuh Rekor Tertinggi Baru",
    "url": "https://www.idxchannel.com/market-news/saham-prajogo-menghijau-petrosea-ptro-sentuh-rekor-tertinggi-baru",
    "date_display": "08/01/2026 10:39 WIB",
    "date": "2026-01-08",
    "image_url": "https://img.idxchannel.com/media/439/images/idx/2025/10/23/PTRO_Petrosea_-_23_Okt_25_-.jpg",
    "category": "MARKET NEWS",
    "batch": 8,
    "source": "IDX Channel",
    "scraped_at": "2026-01-24T16:06:49.781756"
  },
  {
    "title": "Komisaris Utama Darbe Wood (KAYU) Meninggal Dunia",
    "url": "https://www.idxchannel.com/market-news/komisaris-utama-darbe-wood-kayu-meninggal-dunia",
    "date_display": "07/01/2026 15:49 WIB",
    "date": "2026-01-07",
    "image_url": "https://img.idxchannel.com/media/439/images/idx/2026/01/07/darbe_wood_kayu.jpeg",
    "category": "MARKET NEWS",
    "batch": 8,
    "source": "IDX Channel",
    "scraped_at": "2026-01-24T16:06:49.782400"
  },
  {
    "title": "Rupiah Ditutup Melemah ke Level Rp16.780 per USD, Ini Sederet Sentimennya",
    "url": "https://www.idxchannel.com/market-news/rupiah-ditutup-melemah-ke-level-rp16780-per-usd-ini-sederet-sentimennya",
    "date_display": "07/01/2026 15:45 WIB",
    "date": "2026-01-07",
    "image_url": "https://img.idxchannel.com/media/439/images/idx/2025/06/22/rupiah_dolar_sin.jpeg",
    "category": "MARKET NEWS",
    "batch": 8,
    "source": "IDX Channel",
    "scraped_at": "2026-01-24T16:06:49.783022"
  },
  {
    "title": "Andhesti Tungkas Pratama Lepas Saham DEWA Senilai Rp232 Miliar",
    "url": "https://www.idxchannel.com/market-news/andhesti-tungkas-pratama-lepas-saham-dewa-senilai-rp232-miliar",
    "date_display": "07/01/2026 14:01 WIB",
    "date": "2026-01-07",
    "image_url": "https://img.idxchannel.com/media/439/images/idx/2026/01/07/darma_henwa_dewa.jpg",
    "category": "MARKET NEWS",
    "batch": 8,
    "source": "IDX Channel",
    "scraped_at": "2026-01-24T16:06:49.783648"
  },
  {
    "title": "WSBP Suplai Beton Readymix untuk Struktur Jembatan Musi V",
    "url": "https://www.idxchannel.com/market-news/wsbp-suplai-beton-readymix-untuk-struktur-jembatan-musi-v",
    "date_display": "07/01/2026 13:27 WIB",
    "date": "2026-01-07",
    "image_url": "https://img.idxchannel.com/media/439/images/idx/2026/01/07/jembatan_musi_v_wsbp.jpg",
    "category": "MARKET NEWS",
    "batch": 8,
    "source": "IDX Channel",
    "scraped_at": "2026-01-24T16:06:49.784268"
  },
  {
    "title": "IHSG Rekor di Awal 2026, Analis Soroti Deretan Saham Potensial",
    "url": "https://www.idxchannel.com/market-news/ihsg-rekor-di-awal-2026-analis-soroti-deretan-saham-potensial",
    "date_display": "07/01/2026 12:18 WIB",
    "date": "2026-01-07",
    "image_url": "https://img.idxchannel.com/media/439/images/idx/2024/02/15/saham_naik_-_-_freepik_35.jpg",
    "category": "MARKET NEWS",
    "batch": 9,
    "source": "IDX Channel",
    "scraped_at": "2026-01-24T16:06:50.965344"
  },
  {
    "title": "Berburu Saham Konglomerat, Dua Nama Besar Ini Jadi Sorotan",
    "url": "https://www.idxchannel.com/market-news/berburu-saham-konglomerat-dua-nama-besar-ini-jadi-sorotan",
    "date_display": "07/01/2026 11:24 WIB",
    "date": "2026-01-07",
    "image_url": "https://img.idxchannel.com/media/439/images/idx/2023/12/04/saham_naik_-_asing_freepik.jpg",
    "category": "MARKET NEWS",
    "batch": 9,
    "source": "IDX Channel",
    "scraped_at": "2026-01-24T16:06:50.965964"
  },
  {
    "title": "IHSG Bergerak Menuju 9.000, Analis Cermati Saham AMRT-RATU",
    "url": "https://www.idxchannel.com/market-news/ihsg-bergerak-menuju-9000-analis-cermati-saham-amrt-ratu",
    "date_display": "07/01/2026 10:05 WIB",
    "date": "2026-01-07",
    "image_url": "https://img.idxchannel.com/media/439/images/idx/2024/03/08/IHSG_hijau.JPG",
    "category": "MARKET NEWS",
    "batch": 9,
    "source": "IDX Channel",
    "scraped_at": "2026-01-24T16:06:50.966582"
  },
  {
    "title": "Pinago Utama (PNGO) Kembali Bagikan Dividen Interim Sebesar Rp70,3 Miliar",
    "url": "https://www.idxchannel.com/market-news/pinago-utama-pngo-kembali-bagikan-dividen-interim-sebesar-rp703-miliar",
    "date_display": "06/01/2026 17:35 WIB",
    "date": "2026-01-06",
    "image_url": "https://img.idxchannel.com/media/439/images/idx/2025/05/08/dividen.jpg",
    "category": "MARKET NEWS",
    "batch": 9,
    "source": "IDX Channel",
    "scraped_at": "2026-01-24T16:06:50.967186"
  },
  {
    "title": "IHSG Rawan Profit Taking usai Cetak Rekor Tertinggi, Analis Soroti UNVR-MBMA",
    "url": "https://www.idxchannel.com/market-news/ihsg-rawan-profit-taking-usai-cetak-rekor-tertinggi-analis-soroti-unvr-mbma",
    "date_display": "06/01/2026 09:43 WIB",
    "date": "2026-01-06",
    "image_url": "https://img.idxchannel.com/media/439/images/idx/2025/06/19/IHSG_turun_-_19_june.jpg",
    "category": "MARKET NEWS",
    "batch": 9,
    "source": "IDX Channel",
    "scraped_at": "2026-01-24T16:06:50.967801"
  },
  {
    "title": "Saham Grup Bakrie Melesat Lagi, BUMI-BRMS Pimpin Kenaikan",
    "url": "https://www.idxchannel.com/market-news/saham-grup-bakrie-melesat-lagi-bumi-brms-pimpin-kenaikan",
    "date_display": "05/01/2026 11:01 WIB",
    "date": "2026-01-05",
    "image_url": "https://img.idxchannel.com/media/439/images/idx/2024/01/19/saham_naik_-_freepik_304.jpg",
    "category": "MARKET NEWS",
    "batch": 9,
    "source": "IDX Channel",
    "scraped_at": "2026-01-24T16:06:50.968409"
  },
  {
    "title": "IHSG Diproyeksi Fluktuatif, Pasar Cermati Saham Konglomerasi",
    "url": "https://www.idxchannel.com/market-news/ihsg-diproyeksi-fluktuatif-pasar-cermati-saham-konglomerasi",
    "date_display": "05/01/2026 10:44 WIB",
    "date": "2026-01-05",
    "image_url": "https://img.idxchannel.com/media/439/images/idx/2025/09/12/IHSG.jpg",
    "category": "MARKET NEWS",
    "batch": 10,
    "source": "IDX Channel",
    "scraped_at": "2026-01-24T16:06:52.078952"
  },
  {
    "title": "January Effect Buka Peluang IHSG Pecah Rekor Pekan Ini",
    "url": "https://www.idxchannel.com/market-news/january-effect-buka-peluang-ihsg-pecah-rekor-pekan-ini",
    "date_display": "05/01/2026 09:59 WIB",
    "date": "2026-01-05",
    "image_url": "https://img.idxchannel.com/media/439/images/idx/2025/12/03/IHSG_ATH.jpg",
    "category": "MARKET NEWS",
    "batch": 10,
    "source": "IDX Channel",
    "scraped_at": "2026-01-24T16:06:52.079566"
  },
  {
    "title": "Pergerakan Mata Uang Terbatas Usai Penangkapan Maduro, Dolar AS Menguat",
    "url": "https://www.idxchannel.com/market-news/pergerakan-mata-uang-terbatas-usai-penangkapan-maduro-dolar-as-menguat",
    "date_display": "05/01/2026 09:25 WIB",
    "date": "2026-01-05",
    "image_url": "https://img.idxchannel.com/media/439/images/idx/2025/05/19/dolar_freepik.jpg",
    "category": "MARKET NEWS",
    "batch": 10,
    "source": "IDX Channel",
    "scraped_at": "2026-01-24T16:06:52.080190"
  },
  {
    "title": "10 Saham Paling Ramai Ditransaksikan Sepekan: BUMI, INET, hingga LEAD",
    "url": "https://www.idxchannel.com/market-news/10-saham-paling-ramai-ditransaksikan-sepekan-bumi-inet-hingga-lead",
    "date_display": "04/01/2026 19:40 WIB",
    "date": "2026-01-04",
    "image_url": "https://img.idxchannel.com/media/439/images/idx/2025/11/03/saham_naik_-_freepik_-_3_Nov_25.jpg",
    "category": "MARKET NEWS",
    "batch": 10,
    "source": "IDX Channel",
    "scraped_at": "2026-01-24T16:06:52.080834"
  },
  {
    "title": "Asing Borong Saham Konglo dan Perkapalan di Hari Pertama Perdagangan 2026",
    "url": "https://www.idxchannel.com/market-news/asing-borong-saham-konglo-dan-perkapalan-di-hari-pertama-perdagangan-2026",
    "date_display": "03/01/2026 10:28 WIB",
    "date": "2026-01-03",
    "image_url": "https://img.idxchannel.com/media/439/images/idx/2025/04/14/saham_naik_-_freepik_14_apr_25_-.jpg",
    "category": "MARKET NEWS",
    "batch": 10,
    "source": "IDX Channel",
    "scraped_at": "2026-01-24T16:06:52.081453"
  },
  {
    "title": "Geliat Saham Grup Bakrie di Awal 2026, DEWA dan VKTR Sentuh Rekor Tertinggi",
    "url": "https://www.idxchannel.com/market-news/geliat-saham-grup-bakrie-di-awal-2026-dewa-dan-vktr-sentuh-rekor-tertinggi",
    "date_display": "03/01/2026 09:15 WIB",
    "date": "2026-01-03",
    "image_url": "https://img.idxchannel.com/media/439/images/idx/2023/02/17/Tanjung_Bara_Port-Batu_Bara-KPC-Bumi-Aldo-1.jpeg",
    "category": "MARKET NEWS",
    "batch": 10,
    "source": "IDX Channel",
    "scraped_at": "2026-01-24T16:06:52.082060"
  },
  {
    "title": "Dolar AS Menguat di Awal 2026, Akhiri Penurunan Tahunan Terbesar dalam Delapan Tahun",
    "url": "https://www.idxchannel.com/market-news/dolar-as-menguat-di-awal-2026-akhiri-penurunan-tahunan-terbesar-dalam-delapan-tahun",
    "date_display": "03/01/2026 07:37 WIB",
    "date": "2026-01-03",
    "image_url": "https://img.idxchannel.com/media/439/images/idx/2022/08/15/Apakah_Dolar_Bisa_Kedaluwarsa.jpg",
    "category": "MARKET NEWS",
    "batch": 11,
    "source": "IDX Channel",
    "scraped_at": "2026-01-24T16:06:53.204922"
  },
  {
    "title": "ADRO Tetapkan Kurs Dividen Interim, Ini Besarannya",
    "url": "https://www.idxchannel.com/market-news/adro-tetapkan-kurs-dividen-interim-ini-besarannya",
    "date_display": "02/01/2026 17:28 WIB",
    "date": "2026-01-02",
    "image_url": "https://img.idxchannel.com/media/439/images/idx/2024/09/27/adaro_adro_energy.jpg",
    "category": "MARKET NEWS",
    "batch": 11,
    "source": "IDX Channel",
    "scraped_at": "2026-01-24T16:06:53.205585"
  },
  {
    "title": "Pemerintah Kaji Bea Ekspor Batu Bara 5-11 Persen, Simak Dampak ke Emiten",
    "url": "https://www.idxchannel.com/market-news/pemerintah-kaji-bea-ekspor-batu-bara-5-11-persen-simak-dampak-ke-emiten",
    "date_display": "02/01/2026 15:46 WIB",
    "date": "2026-01-02",
    "image_url": "https://img.idxchannel.com/media/439/images/idx/2024/06/14/batu_bara_-_unsplash-.jpg",
    "category": "MARKET NEWS",
    "batch": 11,
    "source": "IDX Channel",
    "scraped_at": "2026-01-24T16:06:53.206517"
  },
  {
    "title": "IHSG Semakin Kuat, OJK Optimistis Pasar Modal Jadi Pendorong Ekonomi 2026",
    "url": "https://www.idxchannel.com/market-news/ihsg-semakin-kuat-ojk-optimistis-pasar-modal-jadi-pendorong-ekonomi-2026",
    "date_display": "02/01/2026 15:35 WIB",
    "date": "2026-01-02",
    "image_url": "https://img.idxchannel.com/media/439/images/idx/2026/01/02/OJK_BEI.jpeg",
    "category": "MARKET NEWS",
    "batch": 11,
    "source": "IDX Channel",
    "scraped_at": "2026-01-24T16:06:53.207368"
  },
  {
    "title": "Ini Arah Kebijakan Pasar Modal Indonesia Tahun 2026",
    "url": "https://www.idxchannel.com/market-news/ini-arah-kebijakan-pasar-modal-indonesia-tahun-2026",
    "date_display": "02/01/2026 13:07 WIB",
    "date": "2026-01-02",
    "image_url": "https://img.idxchannel.com/media/439/images/idx/2026/01/02/1000897404.jpg",
    "category": "MARKET NEWS",
    "batch": 11,
    "source": "IDX Channel",
    "scraped_at": "2026-01-24T16:06:53.208660"
  },
  {
    "title": "Jelang Pergantian Direksi BEI, Purbaya Ungkap Kriteria Idamannya",
    "url": "https://www.idxchannel.com/market-news/jelang-pergantian-direksi-bei-purbaya-ungkap-kriteria-idamannya",
    "date_display": "02/01/2026 13:00 WIB",
    "date": "2026-01-02",
    "image_url": "https://img.idxchannel.com/media/439/images/idx/2026/01/02/purbaya_bei_2026.jpeg",
    "category": "MARKET NEWS",
    "batch": 11,
    "source": "IDX Channel",
    "scraped_at": "2026-01-24T16:06:53.209801"
  },
  {
    "title": "Purbaya Sebut IHSG Bakal Tembus 10.000 pada 2026, Ini Alasannya",
    "url": "https://www.idxchannel.com/market-news/purbaya-sebut-ihsg-bakal-tembus-10000-pada-2026-ini-alasannya",
    "date_display": "02/01/2026 11:20 WIB",
    "date": "2026-01-02",
    "image_url": "https://img.idxchannel.com/media/439/images/idx/2026/01/02/purbaya_anggie.jpeg",
    "category": "MARKET NEWS",
    "batch": 12,
    "source": "IDX Channel",
    "scraped_at": "2026-01-24T16:06:54.354002"
  },
  {
    "title": "Porsi Investor Ritel Naik Tajam, OJK Tekankan Pentingnya Aspek Perlindungan",
    "url": "https://www.idxchannel.com/market-news/porsi-investor-ritel-naik-tajam-ojk-tekankan-pentingnya-aspek-perlindungan",
    "date_display": "02/01/2026 11:02 WIB",
    "date": "2026-01-02",
    "image_url": "https://img.idxchannel.com/media/439/images/idx/2026/01/02/mahendra_ojk_anggie.jpeg",
    "category": "MARKET NEWS",
    "batch": 12,
    "source": "IDX Channel",
    "scraped_at": "2026-01-24T16:06:54.354615"
  },
  {
    "title": "Saham Grup Bakrie BUMI-VTKR Cs Curi Panggung di Perdagangan Perdana 2026",
    "url": "https://www.idxchannel.com/market-news/saham-grup-bakrie-bumi-vtkr-cs-curi-panggung-di-perdagangan-perdana-2026",
    "date_display": "02/01/2026 10:48 WIB",
    "date": "2026-01-02",
    "image_url": "https://img.idxchannel.com/media/439/images/idx/2025/07/30/VKTR.jpeg",
    "category": "MARKET NEWS",
    "batch": 12,
    "source": "IDX Channel",
    "scraped_at": "2026-01-24T16:06:54.355309"
  },
  {
    "title": "Anak Usaha DOID Ini Punya Direktur Utama Baru, Berikut Sosoknya",
    "url": "https://www.idxchannel.com/market-news/anak-usaha-doid-ini-punya-direktur-utama-baru-berikut-sosoknya",
    "date_display": "02/01/2026 10:18 WIB",
    "date": "2026-01-02",
    "image_url": "https://img.idxchannel.com/media/439/images/idx/2025/10/20/DOID_BUMA_Internasional_Grup.jpeg",
    "category": "MARKET NEWS",
    "batch": 12,
    "source": "IDX Channel",
    "scraped_at": "2026-01-24T16:06:54.355946"
  },
  {
    "title": "BEI Pagi Ini Buka Perdagangan Perdana 2026, Purbaya Pede IHSG Tembus 10.000",
    "url": "https://www.idxchannel.com/market-news/bei-pagi-ini-buka-perdagangan-perdana-2026-purbaya-pede-ihsg-tembus-10000",
    "date_display": "02/01/2026 07:45 WIB",
    "date": "2026-01-02",
    "image_url": "https://img.idxchannel.com/media/439/images/idx/2026/01/02/IHSG_penutupan_2025__1_.jpeg",
    "category": "MARKET NEWS",
    "batch": 12,
    "source": "IDX Channel",
    "scraped_at": "2026-01-24T16:06:54.356560"
  },
  {
    "title": "Waskita Karya (WSKT) Tuntaskan Pembangunan Puluhan Huntara di Aceh Tamiang Hanya dalam 6 Hari",
    "url": "https://www.idxchannel.com/market-news/waskita-karya-wskt-tuntaskan-pembangunan-puluhan-huntara-di-aceh-tamiang-hanya-dalam-6-hari",
    "date_display": "31/12/2025 12:46 WIB",
    "date": "2025-12-31",
    "image_url": "https://img.idxchannel.com/media/439/images/idx/2025/12/31/wskt_huntara2.jpg",
    "category": "MARKET NEWS",
    "batch": 12,
    "source": "IDX Channel",
    "scraped_at": "2026-01-24T16:06:54.357168"
  },
  {
    "title": "Saham-Saham Konglomerat Jadi Motor Reli IHSG 2025",
    "url": "https://www.idxchannel.com/market-news/saham-saham-konglomerat-jadi-motor-reli-ihsg-2025",
    "date_display": "31/12/2025 11:35 WIB",
    "date": "2025-12-31",
    "image_url": "https://img.idxchannel.com/media/439/images/idx/2024/01/19/saham_naik_-_freepik_304.jpg",
    "category": "MARKET NEWS",
    "batch": 13,
    "source": "IDX Channel",
    "scraped_at": "2026-01-24T16:06:55.475643"
  },
  {
    "title": "Bursa Asia Lesu di Akhir Tahun, Banyak Pasar Libur",
    "url": "https://www.idxchannel.com/market-news/bursa-asia-lesu-di-akhir-tahun-banyak-pasar-libur",
    "date_display": "31/12/2025 09:54 WIB",
    "date": "2025-12-31",
    "image_url": "https://img.idxchannel.com/media/439/images/idx/2023/12/05/bursa_asia_-_reuters.jpg",
    "category": "MARKET NEWS",
    "batch": 13,
    "source": "IDX Channel",
    "scraped_at": "2026-01-24T16:06:55.476265"
  },
  {
    "title": "DEWA Raih Kredit Sindikasi Rp5 Triliun dari BMRI-BBCA",
    "url": "https://www.idxchannel.com/market-news/dewa-raih-kredit-sindikasi-rp5-triliun-dari-bmri-bbca",
    "date_display": "31/12/2025 08:20 WIB",
    "date": "2025-12-31",
    "image_url": "https://img.idxchannel.com/media/439/images/idx/2025/11/19/Darma_Henwa_-_DEWA_19_Nov_25.jpg",
    "category": "MARKET NEWS",
    "batch": 13,
    "source": "IDX Channel",
    "scraped_at": "2026-01-24T16:06:55.476878"
  },
  {
    "title": "Dari Happy Hapsoro hingga Haji Isam, Reli Saham Konglomerasi Warnai Bursa 2025",
    "url": "https://www.idxchannel.com/market-news/dari-happy-hapsoro-hingga-haji-isam-reli-saham-konglomerasi-warnai-bursa-2025",
    "date_display": "31/12/2025 07:45 WIB",
    "date": "2025-12-31",
    "image_url": "https://img.idxchannel.com/media/439/images/idx/2025/05/13/Nasib_Saham_Saat_Perusahaan_Merger.jpg",
    "category": "MARKET NEWS",
    "batch": 13,
    "source": "IDX Channel",
    "scraped_at": "2026-01-24T16:06:55.477489"
  },
  {
    "title": "70 Emiten Terancam Delisting Akhir 2025, Ada WIKA-TGUK",
    "url": "https://www.idxchannel.com/market-news/70-emiten-terancam-delisting-akhir-2025-ada-wika-tguk",
    "date_display": "31/12/2025 06:51 WIB",
    "date": "2025-12-31",
    "image_url": "https://img.idxchannel.com/media/439/images/idx/2025/04/25/bei.jpg",
    "category": "MARKET NEWS",
    "batch": 13,
    "source": "IDX Channel",
    "scraped_at": "2026-01-24T16:06:55.478099"
  },
  {
    "title": "Imbal Hasil Obligasi Jepang Lanjutkan Lonjakan, Tertinggi Sejak 1994",
    "url": "https://www.idxchannel.com/market-news/imbal-hasil-obligasi-jepang-lanjutkan-lonjakan-tertinggi-sejak-1994",
    "date_display": "30/12/2025 21:33 WIB",
    "date": "2025-12-30",
    "image_url": "https://img.idxchannel.com/media/439/images/idx/2024/03/27/yen_jepang_-_freepik.jpg",
    "category": "MARKET NEWS",
    "batch": 13,
    "source": "IDX Channel",
    "scraped_at": "2026-01-24T16:06:55.478706"
  },
  {
    "title": "CDIA Bagikan Dividen Interim Perdana, Disalurkan Akhir Januari 2026",
    "url": "https://www.idxchannel.com/market-news/cdia-bagikan-dividen-interim-perdana-disalurkan-akhir-januari-2026",
    "date_display": "30/12/2025 17:30 WIB",
    "date": "2025-12-30",
    "image_url": "https://img.idxchannel.com/media/439/images/idx/2025/12/10/cdia_ist.jpg",
    "category": "MARKET NEWS",
    "batch": 14,
    "source": "IDX Channel",
    "scraped_at": "2026-01-24T16:06:56.589768"
  },
  {
    "title": "Tutup Perdagangan di 2025, IHSG Menguat ke Level 8.646",
    "url": "https://www.idxchannel.com/market-news/tutup-perdagangan-di-2025-ihsg-menguat-ke-level-8646",
    "date_display": "30/12/2025 17:20 WIB",
    "date": "2025-12-30",
    "image_url": "https://img.idxchannel.com/media/439/images/idx/2025/12/30/1000102011.jpg",
    "category": "MARKET NEWS",
    "batch": 14,
    "source": "IDX Channel",
    "scraped_at": "2026-01-24T16:06:56.591298"
  },
  {
    "title": "IHSG Pecahkan Rekor Sepanjang 2025, ATH 24 Kali",
    "url": "https://www.idxchannel.com/market-news/ihsg-pecahkan-rekor-sepanjang-2025-ath-24-kali",
    "date_display": "30/12/2025 13:23 WIB",
    "date": "2025-12-30",
    "image_url": "https://img.idxchannel.com/media/439/images/idx/2025/12/30/IMG_2846.jpeg",
    "category": "MARKET NEWS",
    "batch": 14,
    "source": "IDX Channel",
    "scraped_at": "2026-01-24T16:06:56.591979"
  },
  {
    "title": "Saham Alamtri (ADRO) Anjlok Lebih dari 6 Persen saat Ex Dividen",
    "url": "https://www.idxchannel.com/market-news/saham-alamtri-adro-anjlok-lebih-dari-6-persen-saat-ex-dividen",
    "date_display": "30/12/2025 10:49 WIB",
    "date": "2025-12-30",
    "image_url": "https://img.idxchannel.com/media/439/images/idx/2025/05/05/saham_turun_-_freepik_-_5_Mei_25.jpg",
    "category": "MARKET NEWS",
    "batch": 14,
    "source": "IDX Channel",
    "scraped_at": "2026-01-24T16:06:56.592612"
  },
  {
    "title": "Rukun Raharja (RAJA) Tebar Dividen Interim, Ini Jadwal Pencairannya",
    "url": "https://www.idxchannel.com/market-news/rukun-raharja-raja-tebar-dividen-interim-ini-jadwal-pencairannya",
    "date_display": "30/12/2025 10:36 WIB",
    "date": "2025-12-30",
    "image_url": "https://img.idxchannel.com/media/439/images/idx/2025/10/12/RAJA.jpg",
    "category": "MARKET NEWS",
    "batch": 14,
    "source": "IDX Channel",
    "scraped_at": "2026-01-24T16:06:56.593230"
  },
  {
    "title": "Darma Henwa (DEWA) Tunjuk Satu Direktur Baru, Ini Susunan Terbaru Manajemen",
    "url": "https://www.idxchannel.com/market-news/darma-henwa-dewa-tunjuk-satu-direktur-baru-ini-susunan-terbaru-manajemen",
    "date_display": "30/12/2025 10:07 WIB",
    "date": "2025-12-30",
    "image_url": "https://img.idxchannel.com/media/439/images/idx/2025/11/18/darma_henwa_dewa.jpg",
    "category": "MARKET NEWS",
    "batch": 14,
    "source": "IDX Channel",
    "scraped_at": "2026-01-24T16:06:56.593850"
  },
  {
    "title": "Bursa Asia Bergerak Beragam di Akhir Perdagangan 2025",
    "url": "https://www.idxchannel.com/market-news/bursa-asia-bergerak-beragam-di-akhir-perdagangan-2025",
    "date_display": "30/12/2025 09:12 WIB",
    "date": "2025-12-30",
    "image_url": "https://img.idxchannel.com/media/439/images/idx/2024/02/26/bursa_asia_-_reuters_344.jpg",
    "category": "MARKET NEWS",
    "batch": 15,
    "source": "IDX Channel",
    "scraped_at": "2026-01-24T16:06:57.713406"
  },
  {
    "title": "Harga Minyak Melonjak, Isu Ukraina dan Yaman Picu Kekhawatiran Pasokan",
    "url": "https://www.idxchannel.com/market-news/harga-minyak-melonjak-isu-ukraina-dan-yaman-picu-kekhawatiran-pasokan",
    "date_display": "30/12/2025 07:30 WIB",
    "date": "2025-12-30",
    "image_url": "https://img.idxchannel.com/media/439/images/idx/2024/01/17/kilang_minyak_rig_-_reuters.jpg",
    "category": "MARKET NEWS",
    "batch": 15,
    "source": "IDX Channel",
    "scraped_at": "2026-01-24T16:06:57.714028"
  },
  {
    "title": "Rukun Raharja (RAJA) Umumkan Dividen Interim Rp105,68 Miliar",
    "url": "https://www.idxchannel.com/market-news/rukun-raharja-raja-umumkan-dividen-interim-rp10568-miliar",
    "date_display": "29/12/2025 16:40 WIB",
    "date": "2025-12-29",
    "image_url": "https://img.idxchannel.com/media/439/images/idx/2025/12/03/rukun_raharja_raja.jpg",
    "category": "MARKET NEWS",
    "batch": 15,
    "source": "IDX Channel",
    "scraped_at": "2026-01-24T16:06:57.714640"
  },
  {
    "title": "Roda Vivatex (RDTX) Siap Bagikan Dividen Interim Rp53,76 Miliar",
    "url": "https://www.idxchannel.com/market-news/roda-vivatex-rdtx-siap-bagikan-dividen-interim-rp5376-miliar",
    "date_display": "29/12/2025 11:14 WIB",
    "date": "2025-12-29",
    "image_url": "https://img.idxchannel.com/media/439/images/idx/2025/12/29/danamon_bdmn_rdtx.jpg",
    "category": "MARKET NEWS",
    "batch": 15,
    "source": "IDX Channel",
    "scraped_at": "2026-01-24T16:06:57.715247"
  },
  {
    "title": "Saham DEWA Melonjak Belasan Persen, Intip Proyeksi Terbaru",
    "url": "https://www.idxchannel.com/market-news/saham-dewa-melonjak-belasan-persen-intip-proyeksi-terbaru",
    "date_display": "29/12/2025 10:28 WIB",
    "date": "2025-12-29",
    "image_url": "https://img.idxchannel.com/media/439/images/idx/2025/09/22/Darma_Henwa_-_22_Sept_25.jpg",
    "category": "MARKET NEWS",
    "batch": 15,
    "source": "IDX Channel",
    "scraped_at": "2026-01-24T16:06:57.715848"
  },
  {
    "title": "IHSG Diproyeksi Menguat Jelang Tutup Tahun, Sentimen Global dan Inflow Asing Jadi Penopang",
    "url": "https://www.idxchannel.com/market-news/ihsg-diproyeksi-menguat-jelang-tutup-tahun-sentimen-global-dan-inflow-asing-jadi-penopang",
    "date_display": "29/12/2025 09:44 WIB",
    "date": "2025-12-29",
    "image_url": "https://img.idxchannel.com/media/439/images/idx/2025/11/07/ihsg_hijau.jpg",
    "category": "MARKET NEWS",
    "batch": 15,
    "source": "IDX Channel",
    "scraped_at": "2026-01-24T16:06:57.716459"
  },
  {
    "title": "Kaleidoskop IHSG 2025: Dari Trading Halt hingga Rekor demi Rekor",
    "url": "https://www.idxchannel.com/market-news/kaleidoskop-ihsg-2025-dari-trading-halt-hingga-rekor-demi-rekor",
    "date_display": "29/12/2025 07:34 WIB",
    "date": "2025-12-29",
    "image_url": "https://img.idxchannel.com/media/439/images/idx/2025/12/08/IHSG_8_700.jpg",
    "category": "MARKET NEWS",
    "batch": 16,
    "source": "IDX Channel",
    "scraped_at": "2026-01-24T16:06:58.894103"
  },
  {
    "title": "10 Saham Paling Sering Ditransaksikan Sepekan, Nomor Satu Nilainya Tembus Rp9,63 Triliun",
    "url": "https://www.idxchannel.com/market-news/10-saham-paling-sering-ditransaksikan-sepekan-nomor-satu-nilainya-tembus-rp963-triliun",
    "date_display": "27/12/2025 10:30 WIB",
    "date": "2025-12-27",
    "image_url": "https://img.idxchannel.com/media/439/images/idx/2025/12/11/3_Ciri_Saham_ARA.jpg",
    "category": "MARKET NEWS",
    "batch": 16,
    "source": "IDX Channel",
    "scraped_at": "2026-01-24T16:06:58.894722"
  },
  {
    "title": "Gunawan Dianjaya Steel (GDST) Siap Bagikan Dividen Interim Rp23,1 Miliar",
    "url": "https://www.idxchannel.com/market-news/gunawan-dianjaya-steel-gdst-siap-bagikan-dividen-interim-rp231-miliar",
    "date_display": "24/12/2025 14:44 WIB",
    "date": "2025-12-24",
    "image_url": "https://img.idxchannel.com/media/439/images/idx/2025/01/14/dividend.jpg",
    "category": "MARKET NEWS",
    "batch": 16,
    "source": "IDX Channel",
    "scraped_at": "2026-01-24T16:06:58.895329"
  },
  {
    "title": "Sektor Energi Melesat 64 Persen di 2025, Saham ENRG-DEWA Cs Meroket",
    "url": "https://www.idxchannel.com/market-news/sektor-energi-melesat-64-persen-di-2025-saham-enrg-dewa-cs-meroket",
    "date_display": "24/12/2025 07:20 WIB",
    "date": "2025-12-24",
    "image_url": "https://img.idxchannel.com/media/439/images/idx/2023/11/24/batu_bara_-_freepik-min.jpg",
    "category": "MARKET NEWS",
    "batch": 16,
    "source": "IDX Channel",
    "scraped_at": "2026-01-24T16:06:58.895935"
  },
  {
    "title": "SOHO Tebar Dividen Interim Rp420 Miliar, 95 Persen dari Laba",
    "url": "https://www.idxchannel.com/market-news/soho-tebar-dividen-interim-rp420-miliar-95-persen-dari-laba",
    "date_display": "24/12/2025 06:00 WIB",
    "date": "2025-12-24",
    "image_url": "https://img.idxchannel.com/media/439/images/idx/2023/12/18/Saham_yang_20_Tahun_Konsisten_Bagi_Dividen.jpg",
    "category": "MARKET NEWS",
    "batch": 16,
    "source": "IDX Channel",
    "scraped_at": "2026-01-24T16:06:58.896539"
  },
  {
    "title": "Tren Buyback 2025, Respons Kolektif Emiten Hadapi Gejolak Pasar",
    "url": "https://www.idxchannel.com/market-news/tren-buyback-2025-respons-kolektif-emiten-hadapi-gejolak-pasar",
    "date_display": "23/12/2025 19:08 WIB",
    "date": "2025-12-23",
    "image_url": "https://img.idxchannel.com/media/439/images/idx/2025/12/23/buyback_dok_Freepik.jpg",
    "category": "MARKET NEWS",
    "batch": 16,
    "source": "IDX Channel",
    "scraped_at": "2026-01-24T16:06:58.897150"
  },
  {
    "title": "Eastparc Hotel (EAST) Umumkan Dividen Interim Rp23 Miliar, Yield Hampir 6 Persen",
    "url": "https://www.idxchannel.com/market-news/eastparc-hotel-east-umumkan-dividen-interim-rp23-miliar-yield-hampir-6-persen",
    "date_display": "23/12/2025 09:02 WIB",
    "date": "2025-12-23",
    "image_url": "https://img.idxchannel.com/media/439/images/idx/2024/09/23/eastparc.jpg",
    "category": "MARKET NEWS",
    "batch": 17,
    "source": "IDX Channel",
    "scraped_at": "2026-01-24T16:07:00.015935"
  },
  {
    "title": "Tekanan Jual Mereda, Saham DEWA hingga PGAS Jadi Sorotan Analis",
    "url": "https://www.idxchannel.com/market-news/tekanan-jual-mereda-saham-dewa-hingga-pgas-jadi-sorotan-analis",
    "date_display": "23/12/2025 06:00 WIB",
    "date": "2025-12-23",
    "image_url": "https://img.idxchannel.com/media/439/images/idx/2024/04/19/IHSG.jpg",
    "category": "MARKET NEWS",
    "batch": 17,
    "source": "IDX Channel",
    "scraped_at": "2026-01-24T16:07:00.016561"
  },
  {
    "title": "Diberi Amanah Baru sebagai Komut Pelni, WSBP Umumkan Pengunduran Diri Komut Demi Jaga GCG yang Baik",
    "url": "https://www.idxchannel.com/market-news/diberi-amanah-baru-sebagai-komut-pelni-wsbp-umumkan-pengunduran-diri-komut-demi-jaga-gcg-yang-baik",
    "date_display": "22/12/2025 21:24 WIB",
    "date": "2025-12-22",
    "image_url": "https://img.idxchannel.com/media/439/images/idx/2025/12/22/1000884466.jpg",
    "category": "MARKET NEWS",
    "batch": 17,
    "source": "IDX Channel",
    "scraped_at": "2026-01-24T16:07:00.017177"
  },
  {
    "title": "Siapa Pemegang Saham Mayoritas DEWA? Emiten Kontraktor Tambang, Simak Daftar Pemiliknya",
    "url": "https://www.idxchannel.com/market-news/siapa-pemegang-saham-mayoritas-dewa-emiten-kontraktor-tambang-simak-daftar-pemiliknya",
    "date_display": "22/12/2025 14:20 WIB",
    "date": "2025-12-22",
    "image_url": "https://img.idxchannel.com/media/439/images/idx/2025/11/19/Darma_Henwa_-_DEWA_19_Nov_25.jpg",
    "category": "MARKET NEWS",
    "batch": 17,
    "source": "IDX Channel",
    "scraped_at": "2026-01-24T16:07:00.018125"
  },
  {
    "title": "Saham Grup Bakrie DEWA-BUMI Rebound usai Sempat Dilego Asing, Simak Target Terbaru",
    "url": "https://www.idxchannel.com/market-news/saham-grup-bakrie-dewa-bumi-rebound-usai-sempat-dilego-asing-simak-target-terbaru",
    "date_display": "22/12/2025 10:52 WIB",
    "date": "2025-12-22",
    "image_url": "https://img.idxchannel.com/media/439/images/idx/2022/09/21/Bumi_Resources_-_Tambang_-_web-min.jpg",
    "category": "MARKET NEWS",
    "batch": 17,
    "source": "IDX Channel",
    "scraped_at": "2026-01-24T16:07:00.019274"
  },
  {
    "title": "Bank Mandiri (BMRI) Rombak Dewan Komisaris, Perkuat Pengawasan di Tengah Ekspansi",
    "url": "https://www.idxchannel.com/market-news/bank-mandiri-bmri-rombak-dewan-komisaris-perkuat-pengawasan-di-tengah-ekspansi",
    "date_display": "21/12/2025 13:19 WIB",
    "date": "2025-12-21",
    "image_url": "https://img.idxchannel.com/media/439/images/idx/2025/12/21/WhatsApp_Image_2025-12-21_at_12_27_09_PM.jpeg",
    "category": "MARKET NEWS",
    "batch": 17,
    "source": "IDX Channel",
    "scraped_at": "2026-01-24T16:07:00.019940"
  },
  {
    "title": "Mencari Saham Pilihan Jelang Libur Nataru",
    "url": "https://www.idxchannel.com/market-news/mencari-saham-pilihan-jelang-libur-nataru",
    "date_display": "21/12/2025 10:25 WIB",
    "date": "2025-12-21",
    "image_url": "https://img.idxchannel.com/media/439/images/idx/2025/08/08/saham_naik_-_freepik_-_6_agust_25.jpg",
    "category": "MARKET NEWS",
    "batch": 18,
    "source": "IDX Channel",
    "scraped_at": "2026-01-24T16:07:01.146154"
  },
  {
    "title": "Saham Grup Bakrie DEWA-BUMI Jadi Sasaran Jual Asing Pekan Ini",
    "url": "https://www.idxchannel.com/market-news/saham-grup-bakrie-dewa-bumi-jadi-sasaran-jual-asing-pekan-ini",
    "date_display": "21/12/2025 09:26 WIB",
    "date": "2025-12-21",
    "image_url": "https://img.idxchannel.com/media/439/images/idx/2024/04/01/saham_turun_-_12_-_freepik.jpg",
    "category": "MARKET NEWS",
    "batch": 18,
    "source": "IDX Channel",
    "scraped_at": "2026-01-24T16:07:01.146814"
  },
  {
    "title": "GPSO Tetapkan Susunan Direksi dan Komisaris Baru Usai Masuknya Tjokro Group",
    "url": "https://www.idxchannel.com/market-news/gpso-tetapkan-susunan-direksi-dan-komisaris-baru-usai-masuknya-tjokro-group",
    "date_display": "19/12/2025 17:38 WIB",
    "date": "2025-12-19",
    "image_url": "https://img.idxchannel.com/media/439/images/idx/2025/12/19/gpso.jpg",
    "category": "MARKET NEWS",
    "batch": 18,
    "source": "IDX Channel",
    "scraped_at": "2026-01-24T16:07:01.147448"
  },
  {
    "title": "Darma Henwa (DEWA) Raih Fasilitas Kredit Modal Kerja dan Investasi Rp1 Triliun",
    "url": "https://www.idxchannel.com/market-news/darma-henwa-dewa-raih-fasilitas-kredit-modal-kerja-dan-investasi-rp1-triliun",
    "date_display": "19/12/2025 13:25 WIB",
    "date": "2025-12-19",
    "image_url": "https://img.idxchannel.com/media/439/images/idx/2025/11/19/Darma_Henwa_-_DEWA_19_Nov_25.jpg",
    "category": "MARKET NEWS",
    "batch": 18,
    "source": "IDX Channel",
    "scraped_at": "2026-01-24T16:07:01.148068"
  },
  {
    "title": "Jasa Armada (IPCM) Sebar Dividen Interim Rp23,25 Miliar, Ini Jadwalnya",
    "url": "https://www.idxchannel.com/market-news/jasa-armada-ipcm-sebar-dividen-interim-rp2325-miliar-ini-jadwalnya",
    "date_display": "19/12/2025 12:45 WIB",
    "date": "2025-12-19",
    "image_url": "https://img.idxchannel.com/media/439/images/idx/2021/07/01/ipcm.jpg",
    "category": "MARKET NEWS",
    "batch": 18,
    "source": "IDX Channel",
    "scraped_at": "2026-01-24T16:07:01.148687"
  },
  {
    "title": "BSSR Mau Sebar Dividen Interim Rp333,38 Miliar, Cek Jadwal Cairnya",
    "url": "https://www.idxchannel.com/market-news/bssr-mau-sebar-dividen-interim-rp33338-miliar-cek-jadwal-cairnya",
    "date_display": "19/12/2025 10:50 WIB",
    "date": "2025-12-19",
    "image_url": "https://img.idxchannel.com/media/439/images/idx/2023/09/27/Saham_Second_Liner_dengan_Dividen_Jumbo.jpg",
    "category": "MARKET NEWS",
    "batch": 18,
    "source": "IDX Channel",
    "scraped_at": "2026-01-24T16:07:01.149374"
  },
  {
    "title": "Saham Konglomerat Lesu Jelang Libur Akhir Tahun",
    "url": "https://www.idxchannel.com/market-news/saham-konglomerat-lesu-jelang-libur-akhir-tahun",
    "date_display": "19/12/2025 10:30 WIB",
    "date": "2025-12-19",
    "image_url": "https://img.idxchannel.com/media/439/images/idx/2024/06/07/saham_turun_-_16_-_freepik.jpg",
    "category": "MARKET NEWS",
    "batch": 19,
    "source": "IDX Channel",
    "scraped_at": "2026-01-24T16:07:02.256839"
  },
  {
    "title": "Bank Mandiri (BMRI) Siap Bagikan Dividen Interim Rp9,3 Triliun",
    "url": "https://www.idxchannel.com/market-news/bank-mandiri-bmri-siap-bagikan-dividen-interim-rp93-triliun",
    "date_display": "19/12/2025 08:52 WIB",
    "date": "2025-12-19",
    "image_url": "https://img.idxchannel.com/media/439/images/idx/2023/05/15/Daftar_Saham_IDX_High_Dividend_20_2023.jpg",
    "category": "MARKET NEWS",
    "batch": 19,
    "source": "IDX Channel",
    "scraped_at": "2026-01-24T16:07:02.257464"
  },
  {
    "title": "Semen Baturaja (SMBR) Catat Pendapatan Rp1,78 Triliun, Naik 27 Persen",
    "url": "https://www.idxchannel.com/market-news/semen-baturaja-smbr-catat-pendapatan-rp178-triliun-naik-27-persen",
    "date_display": "18/12/2025 17:35 WIB",
    "date": "2025-12-18",
    "image_url": "https://img.idxchannel.com/media/439/images/idx/2025/12/18/SMBR.jpeg",
    "category": "MARKET NEWS",
    "batch": 19,
    "source": "IDX Channel",
    "scraped_at": "2026-01-24T16:07:02.258127"
  },
  {
    "title": "Perkuat Logistik, Multi Makmur Lemindo (PIPA) Bakal Terbitkan Obligasi Rp460 Miliar",
    "url": "https://www.idxchannel.com/market-news/perkuat-logistik-multi-makmur-lemindo-pipa-bakal-terbitkan-obligasi-rp460-miliar",
    "date_display": "18/12/2025 15:51 WIB",
    "date": "2025-12-18",
    "image_url": "https://img.idxchannel.com/media/439/images/idx/2025/12/18/1000877906.jpg",
    "category": "MARKET NEWS",
    "batch": 19,
    "source": "IDX Channel",
    "scraped_at": "2026-01-24T16:07:02.258962"
  },
  {
    "title": "Alamtri Resources (ADRO) Tebar Dividen Interim USD250 Juta, Analis Soroti Hal Ini",
    "url": "https://www.idxchannel.com/market-news/alamtri-resources-adro-tebar-dividen-interim-usd250-juta-analis-soroti-hal-ini",
    "date_display": "18/12/2025 10:18 WIB",
    "date": "2025-12-18",
    "image_url": "https://img.idxchannel.com/media/439/images/idx/2025/06/04/Alamtri_ADRO_dok_ADRO.jpg",
    "category": "MARKET NEWS",
    "batch": 19,
    "source": "IDX Channel",
    "scraped_at": "2026-01-24T16:07:02.259622"
  },
  {
    "title": "Moratelindo (MORA) Umumkan Rencana Merger dengan MyRepublic Sinar Mas",
    "url": "https://www.idxchannel.com/market-news/moratelindo-mora-umumkan-rencana-merger-dengan-myrepublic-sinar-mas",
    "date_display": "18/12/2025 09:35 WIB",
    "date": "2025-12-18",
    "image_url": "https://img.idxchannel.com/media/439/images/idx/2025/11/22/deal_akuisisi_merger_-_handshake_-_Freepik_22_Nov_25.jpg",
    "category": "MARKET NEWS",
    "batch": 19,
    "source": "IDX Channel",
    "scraped_at": "2026-01-24T16:07:02.260250"
  },
  {
    "title": "AATI Hadirkan Ujian Setara Standar CFTe Internasional",
    "url": "https://www.idxchannel.com/market-news/aati-hadirkan-ujian-setara-standar-cfte-internasional",
    "date_display": "18/12/2025 08:50 WIB",
    "date": "2025-12-18",
    "image_url": "https://img.idxchannel.com/media/439/images/idx/2025/12/18/aati.jpg",
    "category": "MARKET NEWS",
    "batch": 20,
    "source": "IDX Channel",
    "scraped_at": "2026-01-24T16:07:03.381117"
  },
  {
    "title": "Alamtri (ADRO) Umumkan Dividen Interim Jumbo, Ini Jadwalnya",
    "url": "https://www.idxchannel.com/market-news/alamtri-adro-umumkan-dividen-interim-jumbo-ini-jadwalnya",
    "date_display": "17/12/2025 21:45 WIB",
    "date": "2025-12-17",
    "image_url": "https://img.idxchannel.com/media/439/images/idx/2024/11/29/adro.jpg",
    "category": "MARKET NEWS",
    "batch": 20,
    "source": "IDX Channel",
    "scraped_at": "2026-01-24T16:07:03.381744"
  },
  {
    "title": "Kurs Rupiah Terkendali, Optimalisasi DHE SDA Jadi Faktor Pendukung",
    "url": "https://www.idxchannel.com/market-news/kurs-rupiah-terkendali-optimalisasi-dhe-sda-jadi-faktor-pendukung",
    "date_display": "17/12/2025 18:20 WIB",
    "date": "2025-12-17",
    "image_url": "https://img.idxchannel.com/media/439/images/idx/2025/10/22/Rupiah_sindonews.JPG",
    "category": "MARKET NEWS",
    "batch": 20,
    "source": "IDX Channel",
    "scraped_at": "2026-01-24T16:07:03.382649"
  },
  {
    "title": "Komisaris BSDE Yoseph Franciscus Bonang Meninggal Dunia",
    "url": "https://www.idxchannel.com/market-news/komisaris-bsde-yoseph-franciscus-bonang-meninggal-dunia",
    "date_display": "17/12/2025 17:35 WIB",
    "date": "2025-12-17",
    "image_url": "https://img.idxchannel.com/media/439/images/idx/2025/12/17/yoseph_bonang_bsd.jpg",
    "category": "MARKET NEWS",
    "batch": 20,
    "source": "IDX Channel",
    "scraped_at": "2026-01-24T16:07:03.383392"
  },
  {
    "title": "Rupiah Ditutup Melemah ke Rp16.694 per USD Usai BI Tahan Suku Bunga",
    "url": "https://www.idxchannel.com/market-news/rupiah-ditutup-melemah-ke-rp16694-per-usd-usai-bi-tahan-suku-bunga",
    "date_display": "17/12/2025 15:46 WIB",
    "date": "2025-12-17",
    "image_url": "https://img.idxchannel.com/media/439/images/idx/2025/06/22/rupiah_dolar_sin.jpeg",
    "category": "MARKET NEWS",
    "batch": 20,
    "source": "IDX Channel",
    "scraped_at": "2026-01-24T16:07:03.384063"
  },
  {
    "title": "Saham Bank Besar Bergerak Variatif usai BI Kembali Tahan Suku Bunga",
    "url": "https://www.idxchannel.com/market-news/saham-bank-besar-bergerak-variatif-usai-bi-kembali-tahan-suku-bunga",
    "date_display": "17/12/2025 14:57 WIB",
    "date": "2025-12-17",
    "image_url": "https://img.idxchannel.com/media/439/images/idx/2025/04/14/aksi_beli_saham_naik_-_freepik.jpg",
    "category": "MARKET NEWS",
    "batch": 20,
    "source": "IDX Channel",
    "scraped_at": "2026-01-24T16:07:03.384696"
  },
  {
    "title": "Ini Susunan Lengkap Direksi dan Dewan Komisaris Terbaru GOTO pasca RUPSLB",
    "url": "https://www.idxchannel.com/market-news/ini-susunan-lengkap-direksi-dan-dewan-komisaris-terbaru-goto-pasca-rupslb",
    "date_display": "17/12/2025 14:35 WIB",
    "date": "2025-12-17",
    "image_url": "https://img.idxchannel.com/media/439/images/idx/2025/12/17/Suasana_RUPSLB_GOTO_17_Desember_2025__1_.jpg",
    "category": "MARKET NEWS",
    "batch": 21,
    "source": "IDX Channel",
    "scraped_at": "2026-01-24T16:07:04.510408"
  },
  {
    "title": "RUPSLB GOTO Resmi Angkat Hans Patuwo Sebagai Direktur Utama dan CEO",
    "url": "https://www.idxchannel.com/market-news/rupslb-goto-resmi-angkat-hans-patuwo-sebagai-direktur-utama-dan-ceo",
    "date_display": "17/12/2025 12:43 WIB",
    "date": "2025-12-17",
    "image_url": "https://img.idxchannel.com/media/439/images/idx/2023/08/27/Profil_Hans_Patuwo__gopay_.jpg",
    "category": "MARKET NEWS",
    "batch": 21,
    "source": "IDX Channel",
    "scraped_at": "2026-01-24T16:07:04.511167"
  },
  {
    "title": "RUPSLB Adhi Karya (ADHI) Tunjuk Direktur Utama Baru, Ini Sosoknya",
    "url": "https://www.idxchannel.com/market-news/rupslb-adhi-karya-adhi-tunjuk-direktur-utama-baru-ini-sosoknya",
    "date_display": "17/12/2025 11:47 WIB",
    "date": "2025-12-17",
    "image_url": "https://img.idxchannel.com/media/439/images/idx/2025/12/17/RUPSLB_ADHI_Karya__2_.jpg",
    "category": "MARKET NEWS",
    "batch": 21,
    "source": "IDX Channel",
    "scraped_at": "2026-01-24T16:07:04.511790"
  },
  {
    "title": "BRI (BBRI) Tebar Dividen Interim Rp137 per Saham",
    "url": "https://www.idxchannel.com/market-news/bri-bbri-tebar-dividen-interim-rp137-per-saham",
    "date_display": "17/12/2025 10:00 WIB",
    "date": "2025-12-17",
    "image_url": "https://img.idxchannel.com/media/439/images/idx/2025/07/14/bri_bbri.jpeg",
    "category": "MARKET NEWS",
    "batch": 21,
    "source": "IDX Channel",
    "scraped_at": "2026-01-24T16:07:04.512405"
  },
  {
    "title": "Menakar Peluang DEWA Tembus Indeks MSCI",
    "url": "https://www.idxchannel.com/market-news/menakar-peluang-dewa-tembus-indeks-msci",
    "date_display": "17/12/2025 07:50 WIB",
    "date": "2025-12-17",
    "image_url": "https://img.idxchannel.com/media/439/images/idx/2025/11/19/Darma_Henwa_-_DEWA_19_Nov_25.jpg",
    "category": "MARKET NEWS",
    "batch": 21,
    "source": "IDX Channel",
    "scraped_at": "2026-01-24T16:07:04.513023"
  },
  {
    "title": "PTBA Gelar RUPSLB Jelang Akhir 2025, Ini Hasilnya",
    "url": "https://www.idxchannel.com/market-news/ptba-gelar-rupslb-jelang-akhir-2025-ini-hasilnya",
    "date_display": "16/12/2025 17:40 WIB",
    "date": "2025-12-16",
    "image_url": "https://img.idxchannel.com/media/439/images/idx/2025/04/14/Arsal_Ismail_dok_PTBA.JPG",
    "category": "MARKET NEWS",
    "batch": 21,
    "source": "IDX Channel",
    "scraped_at": "2026-01-24T16:07:04.513636"
  },
  {
    "title": "Analis Soroti Rotasi dari Saham Konglomerat ke Blue Chip",
    "url": "https://www.idxchannel.com/market-news/analis-soroti-rotasi-dari-saham-konglomerat-ke-blue-chip",
    "date_display": "16/12/2025 12:17 WIB",
    "date": "2025-12-16",
    "image_url": "https://img.idxchannel.com/media/439/images/idx/2025/08/18/saham_naik_-_rotasi_sektor_-_freepik.jpg",
    "category": "MARKET NEWS",
    "batch": 22,
    "source": "IDX Channel",
    "scraped_at": "2026-01-24T16:07:05.659636"
  },
  {
    "title": "Nieko Kusuma Ditunjuk Jadi Presiden Direktur CIMB Niaga Sekuritas",
    "url": "https://www.idxchannel.com/market-news/nieko-kusuma-ditunjuk-jadi-presiden-direktur-cimb-niaga-sekuritas",
    "date_display": "16/12/2025 12:10 WIB",
    "date": "2025-12-16",
    "image_url": "https://img.idxchannel.com/media/439/images/idx/2025/12/16/nieko_kusuma_dok_cimb_sekuritas.jpg",
    "category": "MARKET NEWS",
    "batch": 22,
    "source": "IDX Channel",
    "scraped_at": "2026-01-24T16:07:05.660260"
  },
  {
    "title": "Saham Prajogo Telat Panas di Desember, Mana yang Masih Menarik?",
    "url": "https://www.idxchannel.com/market-news/saham-prajogo-telat-panas-di-desember-mana-yang-masih-menarik",
    "date_display": "16/12/2025 11:00 WIB",
    "date": "2025-12-16",
    "image_url": "https://img.idxchannel.com/media/439/images/idx/2025/03/07/prajogo_pangestu.jpg",
    "category": "MARKET NEWS",
    "batch": 22,
    "source": "IDX Channel",
    "scraped_at": "2026-01-24T16:07:05.661007"
  },
  {
    "title": "Masuki Tahap Pascatambang, Antam (ANTM) Tingkatkan Eksplorasi Tambang Emas Pongkor",
    "url": "https://www.idxchannel.com/market-news/masuki-tahap-pascatambang-antam-antm-tingkatkan-eksplorasi-tambang-emas-pongkor",
    "date_display": "16/12/2025 09:22 WIB",
    "date": "2025-12-16",
    "image_url": "https://img.idxchannel.com/media/439/images/idx/2021/02/15/antam_emas_mnc.jpg",
    "category": "MARKET NEWS",
    "batch": 22,
    "source": "IDX Channel",
    "scraped_at": "2026-01-24T16:07:05.661629"
  },
  {
    "title": "Harga Minyak Jatuh, Kekhawatiran Pasokan Redam Dampak Gangguan Venezuela",
    "url": "https://www.idxchannel.com/market-news/harga-minyak-jatuh-kekhawatiran-pasokan-redam-dampak-gangguan-venezuela",
    "date_display": "16/12/2025 07:30 WIB",
    "date": "2025-12-16",
    "image_url": "https://img.idxchannel.com/media/439/images/idx/2023/12/20/kilang_minyak_sunset_--_Freepik.jpg",
    "category": "MARKET NEWS",
    "batch": 22,
    "source": "IDX Channel",
    "scraped_at": "2026-01-24T16:07:05.662241"
  },
  {
    "title": "Untung Sugiharto Jadi Dirut, Ini Susunan Manajemen Baru Antam (ANTM)",
    "url": "https://www.idxchannel.com/market-news/untung-sugiharto-jadi-dirut-ini-susunan-manajemen-baru-antam-antm",
    "date_display": "16/12/2025 06:00 WIB",
    "date": "2025-12-16",
    "image_url": "https://img.idxchannel.com/media/439/images/idx/2025/12/15/rups_antam_anggie.jpeg",
    "category": "MARKET NEWS",
    "batch": 22,
    "source": "IDX Channel",
    "scraped_at": "2026-01-24T16:07:05.662849"
  },
  {
    "title": "Antam (ANTM) Angkat Untung Budiharto Sebagai Direktur Utama",
    "url": "https://www.idxchannel.com/market-news/antam-antm-angkat-untung-budiharto-sebagai-direktur-utama",
    "date_display": "15/12/2025 18:07 WIB",
    "date": "2025-12-15",
    "image_url": "https://img.idxchannel.com/media/439/images/idx/2025/12/15/rups_antam_anggie.jpeg",
    "category": "MARKET NEWS",
    "batch": 23,
    "source": "IDX Channel",
    "scraped_at": "2026-01-24T16:07:06.788668"
  },
  {
    "title": "RUPSLB WIKA Setujui Perubahan Anggaran dan Optimalisasi Dana PMN",
    "url": "https://www.idxchannel.com/market-news/rupslb-wika-setujui-perubahan-anggaran-dan-optimalisasi-dana-pmn",
    "date_display": "15/12/2025 17:33 WIB",
    "date": "2025-12-15",
    "image_url": "https://img.idxchannel.com/media/439/images/idx/2025/12/15/WIKA_inews.jpg",
    "category": "MARKET NEWS",
    "batch": 23,
    "source": "IDX Channel",
    "scraped_at": "2026-01-24T16:07:06.789911"
  },
  {
    "title": "KKGI Tebar Dividen Interim Rp82,84 Miliar Pertengahan Januari 2026",
    "url": "https://www.idxchannel.com/market-news/kkgi-tebar-dividen-interim-rp8284-miliar-pertengahan-januari-2026",
    "date_display": "15/12/2025 17:13 WIB",
    "date": "2025-12-15",
    "image_url": "https://img.idxchannel.com/media/439/images/idx/2024/11/28/dividen.jpg",
    "category": "MARKET NEWS",
    "batch": 23,
    "source": "IDX Channel",
    "scraped_at": "2026-01-24T16:07:06.790592"
  },
  {
    "title": "Harga CPO Stabil, Pasar Cermati Sentimen Ini",
    "url": "https://www.idxchannel.com/market-news/harga-cpo-stabil-pasar-cermati-sentimen-ini",
    "date_display": "15/12/2025 15:35 WIB",
    "date": "2025-12-15",
    "image_url": "https://img.idxchannel.com/media/439/images/idx/2024/10/20/sawit_-_cpo_-_freepik.jpg",
    "category": "MARKET NEWS",
    "batch": 23,
    "source": "IDX Channel",
    "scraped_at": "2026-01-24T16:07:06.791452"
  },
  {
    "title": "Green Power (LABA) Jadwalkan RUPSLB 20 Januari 2026, Tetapkan Dirut Baru?",
    "url": "https://www.idxchannel.com/market-news/green-power-laba-jadwalkan-rupslb-20-januari-2026-tetapkan-dirut-baru",
    "date_display": "14/12/2025 19:00 WIB",
    "date": "2025-12-14",
    "image_url": "https://img.idxchannel.com/media/439/images/idx/2024/09/20/green_power_laba.jpeg",
    "category": "MARKET NEWS",
    "batch": 23,
    "source": "IDX Channel",
    "scraped_at": "2026-01-24T16:07:06.792142"
  },
  {
    "title": "OJK Tanggapi Prediksi Purbaya soal IHSG Tembus 9.000 di Akhir 2025",
    "url": "https://www.idxchannel.com/market-news/ojk-tanggapi-prediksi-purbaya-soal-ihsg-tembus-9000-di-akhir-2025",
    "date_display": "14/12/2025 09:00 WIB",
    "date": "2025-12-14",
    "image_url": "https://img.idxchannel.com/media/439/images/idx/2025/12/03/IHSG_ATH.jpg",
    "category": "MARKET NEWS",
    "batch": 23,
    "source": "IDX Channel",
    "scraped_at": "2026-01-24T16:07:06.792774"
  },
  {
    "title": "Telkom (TLKM) Kantongi Persetujuan Spin-Off InfraNexia, Fokus Pengembangan Bisnis Fiber",
    "url": "https://www.idxchannel.com/market-news/telkom-tlkm-kantongi-persetujuan-spin-off-infranexia-fokus-pengembangan-bisnis-fiber",
    "date_display": "13/12/2025 16:27 WIB",
    "date": "2025-12-13",
    "image_url": "https://img.idxchannel.com/media/439/images/idx/2025/12/13/WhatsApp_Image_2025-12-13_at_3_30_39_PM.jpeg",
    "category": "MARKET NEWS",
    "batch": 24,
    "source": "IDX Channel",
    "scraped_at": "2026-01-24T16:07:08.629035"
  },
  {
    "title": "Pekannya Saham Grup Bakrie, DEWA-BUMI Cs Terbang Puluhan Persen",
    "url": "https://www.idxchannel.com/market-news/pekannya-saham-grup-bakrie-dewa-bumi-cs-terbang-puluhan-persen",
    "date_display": "13/12/2025 11:00 WIB",
    "date": "2025-12-13",
    "image_url": "https://img.idxchannel.com/media/439/images/idx/2025/08/30/brms_bumi_resources_minerals.jpeg",
    "category": "MARKET NEWS",
    "batch": 24,
    "source": "IDX Channel",
    "scraped_at": "2026-01-24T16:07:08.629669"
  },
  {
    "title": "Asing Buru Saham-Saham Tambang Milik Konglomerat Pekan Ini",
    "url": "https://www.idxchannel.com/market-news/asing-buru-saham-saham-tambang-milik-konglomerat-pekan-ini",
    "date_display": "13/12/2025 10:00 WIB",
    "date": "2025-12-13",
    "image_url": "https://img.idxchannel.com/media/439/images/idx/2025/08/18/saham_naik_-_rotasi_sektor_-_freepik.jpg",
    "category": "MARKET NEWS",
    "batch": 24,
    "source": "IDX Channel",
    "scraped_at": "2026-01-24T16:07:08.630297"
  },
  {
    "title": "Saham KIOS Melesat 171 Persen, Puncaki Top Gainers Pekan Ini",
    "url": "https://www.idxchannel.com/market-news/saham-kios-melesat-171-persen-puncaki-top-gainers-pekan-ini",
    "date_display": "13/12/2025 07:39 WIB",
    "date": "2025-12-13",
    "image_url": "https://img.idxchannel.com/media/439/images/idx/2023/09/08/Saham_Langganan_Top_Gainers.jpg",
    "category": "MARKET NEWS",
    "batch": 24,
    "source": "IDX Channel",
    "scraped_at": "2026-01-24T16:07:08.630916"
  },
  {
    "title": "Telkom (TLKM) Angkat Jajaran Direksi dan Komisaris Baru, Ini Susunan Teranyar",
    "url": "https://www.idxchannel.com/market-news/telkom-tlkm-angkat-jajaran-direksi-dan-komisaris-baru-ini-susunan-teranyar",
    "date_display": "12/12/2025 19:47 WIB",
    "date": "2025-12-12",
    "image_url": "https://img.idxchannel.com/media/439/images/idx/2024/07/31/telkom_ist.jpg",
    "category": "MARKET NEWS",
    "batch": 24,
    "source": "IDX Channel",
    "scraped_at": "2026-01-24T16:07:08.633830"
  },
  {
    "title": "AMAR Kembali Tebar Dividen Interim Awal Januari 2026, Nilainya Rp27,74 Miliar",
    "url": "https://www.idxchannel.com/market-news/amar-kembali-tebar-dividen-interim-awal-januari-2026-nilainya-rp2774-miliar",
    "date_display": "12/12/2025 15:55 WIB",
    "date": "2025-12-12",
    "image_url": "https://img.idxchannel.com/media/439/images/idx/2025/05/19/amar_bank.JPG",
    "category": "MARKET NEWS",
    "batch": 24,
    "source": "IDX Channel",
    "scraped_at": "2026-01-24T16:07:08.634647"
  },
  {
    "title": "DEWA Pangkas Alokasi Buyback Saham Jadi Rp950 Miliar",
    "url": "https://www.idxchannel.com/market-news/dewa-pangkas-alokasi-buyback-saham-jadi-rp950-miliar",
    "date_display": "12/12/2025 11:59 WIB",
    "date": "2025-12-12",
    "image_url": "https://img.idxchannel.com/media/439/images/idx/2025/11/18/darma_henwa_dewa.jpg",
    "category": "MARKET NEWS",
    "batch": 25,
    "source": "IDX Channel",
    "scraped_at": "2026-01-24T16:07:09.751378"
  },
  {
    "title": "IHSG Diproyeksi Menguat ke 8.700 Jelang Akhir Pekan, Rebound Pasar Global Jadi Sentimen",
    "url": "https://www.idxchannel.com/market-news/ihsg-diproyeksi-menguat-ke-8700-jelang-akhir-pekan-rebound-pasar-global-jadi-sentimen",
    "date_display": "12/12/2025 10:25 WIB",
    "date": "2025-12-12",
    "image_url": "https://img.idxchannel.com/media/439/images/idx/2024/01/20/Jenis_Pasar_Modal_di_Indonesia.jpg",
    "category": "MARKET NEWS",
    "batch": 25,
    "source": "IDX Channel",
    "scraped_at": "2026-01-24T16:07:09.752011"
  },
  {
    "title": "Sektor Jasa Keuangan Solid, IHSG Terus Cetak Rekor Sepanjang 2025",
    "url": "https://www.idxchannel.com/market-news/sektor-jasa-keuangan-solid-ihsg-terus-cetak-rekor-sepanjang-2025",
    "date_display": "11/12/2025 15:45 WIB",
    "date": "2025-12-11",
    "image_url": "https://img.idxchannel.com/media/439/images/idx/2025/12/11/IHSG_baru.jpg",
    "category": "MARKET NEWS",
    "batch": 25,
    "source": "IDX Channel",
    "scraped_at": "2026-01-24T16:07:09.752630"
  },
  {
    "title": "Menthobi Karyatama (MTKR) Jalankan Praktik Tata Kelola Berkelanjutan",
    "url": "https://www.idxchannel.com/market-news/menthobi-karyatama-mtkr-jalankan-praktik-tata-kelola-berkelanjutan",
    "date_display": "11/12/2025 15:43 WIB",
    "date": "2025-12-11",
    "image_url": "https://img.idxchannel.com/media/439/images/idx/2025/12/11/1000866323.jpg",
    "category": "MARKET NEWS",
    "batch": 25,
    "source": "IDX Channel",
    "scraped_at": "2026-01-24T16:07:09.753249"
  },
  {
    "title": "Saham Grup Bakrie Hot: DEWA-BUMI Terbang Belasan Persen, Transaksi Triliunan",
    "url": "https://www.idxchannel.com/market-news/saham-grup-bakrie-hot-dewa-bumi-terbang-belasan-persen-transaksi-triliunan",
    "date_display": "11/12/2025 11:02 WIB",
    "date": "2025-12-11",
    "image_url": "https://img.idxchannel.com/media/439/images/idx/2024/10/02/saham_naik_-_freepik_-_91.jpg",
    "category": "MARKET NEWS",
    "batch": 25,
    "source": "IDX Channel",
    "scraped_at": "2026-01-24T16:07:09.753865"
  },
  {
    "title": "IHSG Berpotensi Lanjutkan Penguatan hingga Tembus 8.700 di Sisa Pekan Ini",
    "url": "https://www.idxchannel.com/market-news/ihsg-berpotensi-lanjutkan-penguatan-hingga-tembus-8700-di-sisa-pekan-ini",
    "date_display": "11/12/2025 06:00 WIB",
    "date": "2025-12-11",
    "image_url": "https://img.idxchannel.com/media/439/images/idx/2025/12/03/IHSG_ATH.jpg",
    "category": "MARKET NEWS",
    "batch": 25,
    "source": "IDX Channel",
    "scraped_at": "2026-01-24T16:07:09.754479"
  },
  {
    "title": "Waskita Beton (WSBP) Bidik Pendapatan Rp2,1 Triliun di 2026, Intip Strateginya",
    "url": "https://www.idxchannel.com/market-news/waskita-beton-wsbp-bidik-pendapatan-rp21-triliun-di-2026-intip-strateginya",
    "date_display": "10/12/2025 20:45 WIB",
    "date": "2025-12-10",
    "image_url": "https://img.idxchannel.com/media/439/images/idx/2023/11/10/WSBP_suplai_proyek_pengaman_pantai.jpeg",
    "category": "MARKET NEWS",
    "batch": 26,
    "source": "IDX Channel",
    "scraped_at": "2026-01-24T16:07:10.872642"
  },
  {
    "title": "Pacu Restrukturisasi, WSBP Tuntaskan 91 Persen Konversi Utang Vendor Jadi Saham",
    "url": "https://www.idxchannel.com/market-news/pacu-restrukturisasi-wsbp-tuntaskan-91-persen-konversi-utang-vendor-jadi-saham",
    "date_display": "10/12/2025 20:08 WIB",
    "date": "2025-12-10",
    "image_url": "https://img.idxchannel.com/media/439/images/idx/2023/11/22/PT_Waskita_Beton_Precast_Tbk__WSBP_.jpeg",
    "category": "MARKET NEWS",
    "batch": 26,
    "source": "IDX Channel",
    "scraped_at": "2026-01-24T16:07:10.873325"
  },
  {
    "title": "Saham MAHA Bergerak di Bidang Apa? Emiten Jasa Pertambangan, Ini Wilayah Operasionalnya",
    "url": "https://www.idxchannel.com/market-news/saham-maha-bergerak-di-bidang-apa-emiten-jasa-pertambangan-ini-wilayah-operasionalnya",
    "date_display": "10/12/2025 12:52 WIB",
    "date": "2025-12-10",
    "image_url": "https://img.idxchannel.com/media/439/images/idx/2025/12/10/Screenshot_2025-12-10_125130.png",
    "category": "MARKET NEWS",
    "batch": 26,
    "source": "IDX Channel",
    "scraped_at": "2026-01-24T16:07:10.874162"
  },
  {
    "title": "WSBP Catat Kontrak Baru Rp1,36 Triliun hingga November 2025",
    "url": "https://www.idxchannel.com/market-news/wsbp-catat-kontrak-baru-rp136-triliun-hingga-november-2025",
    "date_display": "10/12/2025 12:07 WIB",
    "date": "2025-12-10",
    "image_url": "https://img.idxchannel.com/media/439/images/idx/2024/07/29/WSBP.jpg",
    "category": "MARKET NEWS",
    "batch": 26,
    "source": "IDX Channel",
    "scraped_at": "2026-01-24T16:07:10.874926"
  },
  {
    "title": "Di Balik Panasnya Grup Bakrie, Saham Konglo Lain Dinilai Menarik",
    "url": "https://www.idxchannel.com/market-news/di-balik-panasnya-grup-bakrie-saham-konglo-lain-dinilai-menarik",
    "date_display": "10/12/2025 11:25 WIB",
    "date": "2025-12-10",
    "image_url": "https://img.idxchannel.com/media/439/images/idx/2025/04/16/buyback_saham_naik_-_freepik_apr_25.jpg",
    "category": "MARKET NEWS",
    "batch": 26,
    "source": "IDX Channel",
    "scraped_at": "2026-01-24T16:07:10.876037"
  },
  {
    "title": "Saham Grup Bakrie Lanjut Reli, BUMI Terbang 20 Persen ke Atas Rp300",
    "url": "https://www.idxchannel.com/market-news/saham-grup-bakrie-lanjut-reli-bumi-terbang-20-persen-ke-atas-rp300",
    "date_display": "10/12/2025 10:28 WIB",
    "date": "2025-12-10",
    "image_url": "https://img.idxchannel.com/media/439/images/idx/2023/02/17/Tanjung_Bara_Port-Batu_Bara-KPC-Bumi-Aldo-1.jpeg",
    "category": "MARKET NEWS",
    "batch": 26,
    "source": "IDX Channel",
    "scraped_at": "2026-01-24T16:07:10.876720"
  },
  {
    "title": "Bursa Asia Melemah, Pasar Menanti Isyarat The Fed",
    "url": "https://www.idxchannel.com/market-news/bursa-asia-melemah-pasar-menanti-isyarat-the-fed",
    "date_display": "10/12/2025 10:07 WIB",
    "date": "2025-12-10",
    "image_url": "https://img.idxchannel.com/media/439/images/idx/2024/02/26/bursa_asia_-_reuters_344.jpg",
    "category": "MARKET NEWS",
    "batch": 27,
    "source": "IDX Channel",
    "scraped_at": "2026-01-24T16:07:11.986313"
  },
  {
    "title": "PBV Saham JARR dan TEBE: Harga Naik Ratusan Persen, Mana yang Masih Murah?",
    "url": "https://www.idxchannel.com/market-news/pbv-saham-jarr-dan-tebe-harga-naik-ratusan-persen-mana-yang-masih-murah",
    "date_display": "09/12/2025 18:15 WIB",
    "date": "2025-12-09",
    "image_url": "https://img.idxchannel.com/media/439/images/idx/2025/11/17/Profil_Saham_KOPI.jpg",
    "category": "MARKET NEWS",
    "batch": 27,
    "source": "IDX Channel",
    "scraped_at": "2026-01-24T16:07:11.986930"
  },
  {
    "title": "Saham BUMI Milik Siapa Saja? Inilah Daftar Pemegangnya Saat Ini",
    "url": "https://www.idxchannel.com/market-news/saham-bumi-milik-siapa-saja-inilah-daftar-pemegangnya-saat-ini",
    "date_display": "09/12/2025 14:07 WIB",
    "date": "2025-12-09",
    "image_url": "https://img.idxchannel.com/media/439/images/idx/2025/12/09/Screenshot_2025-12-09_141317.png",
    "category": "MARKET NEWS",
    "batch": 27,
    "source": "IDX Channel",
    "scraped_at": "2026-01-24T16:07:11.987553"
  },
  {
    "title": "IPCC Umumkan Dividen Interim Senilai Rp47,6 Miliar, Ini Jadwalnya",
    "url": "https://www.idxchannel.com/market-news/ipcc-umumkan-dividen-interim-senilai-rp476-miliar-ini-jadwalnya",
    "date_display": "09/12/2025 13:34 WIB",
    "date": "2025-12-09",
    "image_url": "https://img.idxchannel.com/media/439/images/idx/2024/11/05/ipcc.jpg",
    "category": "MARKET NEWS",
    "batch": 27,
    "source": "IDX Channel",
    "scraped_at": "2026-01-24T16:07:11.988237"
  },
  {
    "title": "Reli Saham Grup Bakrie, Analis Soroti DEWA, BUMI, hingga VKTR",
    "url": "https://www.idxchannel.com/market-news/reli-saham-grup-bakrie-analis-soroti-dewa-bumi-hingga-vktr",
    "date_display": "09/12/2025 12:28 WIB",
    "date": "2025-12-09",
    "image_url": "https://img.idxchannel.com/media/439/images/idx/2025/11/22/Bumi_Resources_-_BUMI_-_22_Nov_25.jpg",
    "category": "MARKET NEWS",
    "batch": 27,
    "source": "IDX Channel",
    "scraped_at": "2026-01-24T16:07:11.988862"
  },
  {
    "title": "Pemerintah Pungut Bea Ekspor Batu Bara, Laba Emiten Tambang Berpotensi Turun hingga 27 Persen",
    "url": "https://www.idxchannel.com/market-news/pemerintah-pungut-bea-ekspor-batu-bara-laba-emiten-tambang-berpotensi-turun-hingga-27-persen",
    "date_display": "09/12/2025 11:45 WIB",
    "date": "2025-12-09",
    "image_url": "https://img.idxchannel.com/media/439/images/idx/2022/06/24/Modal_Bisnis_Tambang_Batu_Bara.jpg",
    "category": "MARKET NEWS",
    "batch": 27,
    "source": "IDX Channel",
    "scraped_at": "2026-01-24T16:07:11.989471"
  },
  {
    "title": "Geliat Tiga Saham Grup Bakrie, DEWA Tembus Level Rp500",
    "url": "https://www.idxchannel.com/market-news/geliat-tiga-saham-grup-bakrie-dewa-tembus-level-rp500",
    "date_display": "09/12/2025 11:15 WIB",
    "date": "2025-12-09",
    "image_url": "https://img.idxchannel.com/media/439/images/idx/2025/09/22/Darma_Henwa_-_22_Sept_25.jpg",
    "category": "MARKET NEWS",
    "batch": 28,
    "source": "IDX Channel",
    "scraped_at": "2026-01-24T16:07:13.113033"
  },
  {
    "title": "Harga Minyak Jatuh 2 Persen setelah Irak Pulihkan Produksi",
    "url": "https://www.idxchannel.com/market-news/harga-minyak-jatuh-2-persen-setelah-irak-pulihkan-produksi",
    "date_display": "09/12/2025 07:30 WIB",
    "date": "2025-12-09",
    "image_url": "https://img.idxchannel.com/media/439/images/idx/2023/09/21/kilang_minyak_sunset_-_Freepik.jpeg",
    "category": "MARKET NEWS",
    "batch": 28,
    "source": "IDX Channel",
    "scraped_at": "2026-01-24T16:07:13.113678"
  },
  {
    "title": "Muliaman Hadad Sebut Isu Keberlanjutan Sudah Jadi Praktik Standar Global",
    "url": "https://www.idxchannel.com/market-news/muliaman-hadad-sebut-isu-keberlanjutan-sudah-jadi-praktik-standar-global",
    "date_display": "08/12/2025 23:00 WIB",
    "date": "2025-12-08",
    "image_url": "https://img.idxchannel.com/media/439/images/idx/2025/12/08/muliaman_hadad_ARA_2024.jpg",
    "category": "MARKET NEWS",
    "batch": 28,
    "source": "IDX Channel",
    "scraped_at": "2026-01-24T16:07:13.114413"
  },
  {
    "title": "Annual Report Award 2024 Sukses Digelar, Ini Daftar Pemenangnya",
    "url": "https://www.idxchannel.com/market-news/annual-report-award-2024-sukses-digelar-ini-daftar-pemenangnya",
    "date_display": "08/12/2025 22:16 WIB",
    "date": "2025-12-08",
    "image_url": "https://img.idxchannel.com/media/439/images/idx/2025/12/08/ARA_2024_foto_bersama__2_.jpeg",
    "category": "MARKET NEWS",
    "batch": 28,
    "source": "IDX Channel",
    "scraped_at": "2026-01-24T16:07:13.115056"
  },
  {
    "title": "Yang Chuan dan Huang Yeping Jadi Beneficial Owner Calon Pengendali Baru Ansa Land (ASPI)",
    "url": "https://www.idxchannel.com/market-news/yang-chuan-dan-huang-yeping-jadi-beneficial-owner-calon-pengendali-baru-ansa-land-aspi",
    "date_display": "08/12/2025 14:28 WIB",
    "date": "2025-12-08",
    "image_url": "https://img.idxchannel.com/media/439/images/idx/2025/12/04/ansa_land_aspi.jpg",
    "category": "MARKET NEWS",
    "batch": 28,
    "source": "IDX Channel",
    "scraped_at": "2026-01-24T16:07:13.115676"
  },
  {
    "title": "Siapa Pemilik Saham RLCO? Emiten Sarang Walet Baru IPO, Ini Daftar Pemiliknya",
    "url": "https://www.idxchannel.com/market-news/siapa-pemilik-saham-rlco-emiten-sarang-walet-baru-ipo-ini-daftar-pemiliknya",
    "date_display": "08/12/2025 12:32 WIB",
    "date": "2025-12-08",
    "image_url": "https://img.idxchannel.com/media/439/images/idx/2025/12/08/Realco_RLCO.jpg",
    "category": "MARKET NEWS",
    "batch": 28,
    "source": "IDX Channel",
    "scraped_at": "2026-01-24T16:07:13.116300"
  },
  {
    "title": "Saham GOTO Tiba-Tiba Melesat, Apa yang Terjadi?",
    "url": "https://www.idxchannel.com/market-news/saham-goto-tiba-tiba-melesat-apa-yang-terjadi",
    "date_display": "08/12/2025 12:17 WIB",
    "date": "2025-12-08",
    "image_url": "https://img.idxchannel.com/media/439/images/idx/2023/08/24/GOTO_-_source_foto_goto_web.jpeg",
    "category": "MARKET NEWS",
    "batch": 29,
    "source": "IDX Channel",
    "scraped_at": "2026-01-24T16:07:14.233100"
  },
  {
    "title": "IHSG Bergerak Positif, Saham CDIA-RAJA Jadi Sorotan Analis",
    "url": "https://www.idxchannel.com/market-news/ihsg-bergerak-positif-saham-cdia-raja-jadi-sorotan-analis",
    "date_display": "08/12/2025 09:56 WIB",
    "date": "2025-12-08",
    "image_url": "https://img.idxchannel.com/media/439/images/idx/2025/12/08/IHSG_8660.jpg",
    "category": "MARKET NEWS",
    "batch": 29,
    "source": "IDX Channel",
    "scraped_at": "2026-01-24T16:07:14.233725"
  },
  {
    "title": "Sentimen Pasar Pekan Ini: Beda Pendapat Anggota The Fed Jadi Sorotan",
    "url": "https://www.idxchannel.com/market-news/sentimen-pasar-pekan-ini-beda-pendapat-anggota-the-fed-jadi-sorotan",
    "date_display": "08/12/2025 06:30 WIB",
    "date": "2025-12-08",
    "image_url": "https://img.idxchannel.com/media/439/images/idx/2024/09/09/The_Fed_dok_AP.JPG",
    "category": "MARKET NEWS",
    "batch": 29,
    "source": "IDX Channel",
    "scraped_at": "2026-01-24T16:07:14.234336"
  },
  {
    "title": "Perbedaan Internal Keputusan Fed Rate Warnai Wall Street Pekan Depan",
    "url": "https://www.idxchannel.com/market-news/perbedaan-internal-keputusan-fed-rate-warnai-wall-street-pekan-depan",
    "date_display": "07/12/2025 03:03 WIB",
    "date": "2025-12-07",
    "image_url": "https://img.idxchannel.com/media/439/images/idx/2025/06/12/wall_street_dok_AP.JPG",
    "category": "MARKET NEWS",
    "batch": 29,
    "source": "IDX Channel",
    "scraped_at": "2026-01-24T16:07:14.234946"
  },
  {
    "title": "Harga Emas Diramal Naik Hingga 30 Persen pada 2026",
    "url": "https://www.idxchannel.com/market-news/harga-emas-diramal-naik-hingga-30-persen-pada-2026",
    "date_display": "05/12/2025 13:20 WIB",
    "date": "2025-12-05",
    "image_url": "https://img.idxchannel.com/media/439/images/idx/2025/05/12/emas_freepik.jpg",
    "category": "MARKET NEWS",
    "batch": 29,
    "source": "IDX Channel",
    "scraped_at": "2026-01-24T16:07:14.235553"
  },
  {
    "title": "Rahayu Saraswati Ditunjuk Jadi Komisaris Utama Trinland (TRIN)",
    "url": "https://www.idxchannel.com/market-news/rahayu-saraswati-ditunjuk-jadi-komisaris-utama-trinland-trin",
    "date_display": "04/12/2025 09:58 WIB",
    "date": "2025-12-04",
    "image_url": "https://img.idxchannel.com/media/439/images/idx/2025/12/04/trinland.jpg",
    "category": "MARKET NEWS",
    "batch": 29,
    "source": "IDX Channel",
    "scraped_at": "2026-01-24T16:07:14.236164"
  },
  {
    "title": "Pemegang Obligasi Waskita Beton (WSBP) Setujui Relaksasi Rasio Keuangan, Fokus Pulihkan Kinerja",
    "url": "https://www.idxchannel.com/market-news/pemegang-obligasi-waskita-beton-wsbp-setujui-relaksasi-rasio-keuangan-fokus-pulihkan-kinerja",
    "date_display": "03/12/2025 23:04 WIB",
    "date": "2025-12-03",
    "image_url": "https://img.idxchannel.com/media/439/images/idx/2023/11/22/PT_Waskita_Beton_Precast_Tbk__WSBP_.jpeg",
    "category": "MARKET NEWS",
    "batch": 30,
    "source": "IDX Channel",
    "scraped_at": "2026-01-24T16:07:15.349831"
  },
  {
    "title": "Pemerintah Tak Naikkan Cukai Rokok 2026, Ini Respons HM Sampoerna (HMSP)",
    "url": "https://www.idxchannel.com/market-news/pemerintah-tak-naikkan-cukai-rokok-2026-ini-respons-hm-sampoerna-hmsp",
    "date_display": "03/12/2025 20:00 WIB",
    "date": "2025-12-03",
    "image_url": "https://img.idxchannel.com/media/439/images/idx/2025/12/03/HMSP_Sampoerna_pubex_2025__3_.jpeg",
    "category": "MARKET NEWS",
    "batch": 30,
    "source": "IDX Channel",
    "scraped_at": "2026-01-24T16:07:15.350451"
  },
  {
    "title": "HM Sampoerna (HMSP) Raup Laba Bersih Rp4,5 Triliun hingga September 2025",
    "url": "https://www.idxchannel.com/market-news/hm-sampoerna-hmsp-raup-laba-bersih-rp45-triliun-hingga-september-2025",
    "date_display": "03/12/2025 18:06 WIB",
    "date": "2025-12-03",
    "image_url": "https://img.idxchannel.com/media/439/images/idx/2025/12/03/HMSP_Sampoerna_pubex_2025__2_.jpeg",
    "category": "MARKET NEWS",
    "batch": 30,
    "source": "IDX Channel",
    "scraped_at": "2026-01-24T16:07:15.351071"
  },
  {
    "title": "IHSG Diproyeksi Positif Ditopang Inflow Asing hingga Sentimen Bursa Global",
    "url": "https://www.idxchannel.com/market-news/ihsg-diproyeksi-positif-ditopang-inflow-asing-hingga-sentimen-bursa-global",
    "date_display": "03/12/2025 09:43 WIB",
    "date": "2025-12-03",
    "image_url": "https://img.idxchannel.com/media/439/images/idx/2025/12/01/Ciri-Ciri_Saham_Gorengan.jpeg",
    "category": "MARKET NEWS",
    "batch": 30,
    "source": "IDX Channel",
    "scraped_at": "2026-01-24T16:07:15.351731"
  },
  {
    "title": "Harga Emas Terimbas Profit Taking, Sorotan Beralih ke Sinyal The Fed",
    "url": "https://www.idxchannel.com/market-news/harga-emas-terimbas-profit-taking-sorotan-beralih-ke-sinyal-the-fed",
    "date_display": "03/12/2025 07:15 WIB",
    "date": "2025-12-03",
    "image_url": "https://img.idxchannel.com/media/439/images/idx/2025/03/17/Freepik_-_emas_-_34.jpg",
    "category": "MARKET NEWS",
    "batch": 30,
    "source": "IDX Channel",
    "scraped_at": "2026-01-24T16:07:15.352359"
  },
  {
    "title": "Siap-Siap, Dividen Interim ARCI Rp499,83 Miliar Cair 16 Desember 2025",
    "url": "https://www.idxchannel.com/market-news/siap-siap-dividen-interim-arci-rp49983-miliar-cair-16-desember-2025",
    "date_display": "02/12/2025 20:00 WIB",
    "date": "2025-12-02",
    "image_url": "https://img.idxchannel.com/media/439/images/idx/2023/09/05/jurnal_pembagian_dividen.jpg",
    "category": "MARKET NEWS",
    "batch": 30,
    "source": "IDX Channel",
    "scraped_at": "2026-01-24T16:07:15.353181"
  },
  {
    "title": "MSTI Siap Sebar Dividen Interim Rp50,23 Miliar, Cair Akhir Desember 2025",
    "url": "https://www.idxchannel.com/market-news/msti-siap-sebar-dividen-interim-rp5023-miliar-cair-akhir-desember-2025",
    "date_display": "02/12/2025 17:45 WIB",
    "date": "2025-12-02",
    "image_url": "https://img.idxchannel.com/media/439/images/idx/2023/11/16/Apakah_Dividen_Masuk_ke_Rekening_RDN.jpg",
    "category": "MARKET NEWS",
    "batch": 31,
    "source": "IDX Channel",
    "scraped_at": "2026-01-24T16:07:16.465903"
  },
  {
    "title": "BFIN Bagikan Dividen Tunai Interim Rp519,72 Miliar",
    "url": "https://www.idxchannel.com/market-news/bfin-bagikan-dividen-tunai-interim-rp51972-miliar",
    "date_display": "02/12/2025 14:58 WIB",
    "date": "2025-12-02",
    "image_url": "https://img.idxchannel.com/media/439/images/idx/2023/10/11/Cara_Dapat_Gaji_UMR_dari_Dividen.jpeg",
    "category": "MARKET NEWS",
    "batch": 31,
    "source": "IDX Channel",
    "scraped_at": "2026-01-24T16:07:16.466535"
  },
  {
    "title": "PPRO Sahkan Pengangkatan Dua Komisaris Independen, Ini Susunan Terbarunya",
    "url": "https://www.idxchannel.com/market-news/ppro-sahkan-pengangkatan-dua-komisaris-independen-ini-susunan-terbarunya",
    "date_display": "02/12/2025 11:53 WIB",
    "date": "2025-12-02",
    "image_url": "https://img.idxchannel.com/media/439/images/idx/2024/11/14/PT_PP_Properti_Tbk__PPRO_.jpg",
    "category": "MARKET NEWS",
    "batch": 31,
    "source": "IDX Channel",
    "scraped_at": "2026-01-24T16:07:16.467154"
  },
  {
    "title": "BRI-MI Siap Hadirkan ETF Emas Pertama di Indonesia",
    "url": "https://www.idxchannel.com/market-news/bri-mi-siap-hadirkan-etf-emas-pertama-di-indonesia",
    "date_display": "02/12/2025 11:30 WIB",
    "date": "2025-12-02",
    "image_url": "https://img.idxchannel.com/media/439/images/idx/2025/12/02/bri_etf_emas.jpg",
    "category": "MARKET NEWS",
    "batch": 31,
    "source": "IDX Channel",
    "scraped_at": "2026-01-24T16:07:16.467768"
  },
  {
    "title": "IHSG Diproyeksi Konsolidasi Ditopang Sentimen Domestik yang Solid",
    "url": "https://www.idxchannel.com/market-news/ihsg-diproyeksi-konsolidasi-ditopang-sentimen-domestik-yang-solid",
    "date_display": "02/12/2025 09:34 WIB",
    "date": "2025-12-02",
    "image_url": "https://img.idxchannel.com/media/439/images/idx/2024/07/01/IHSG_1.jpg",
    "category": "MARKET NEWS",
    "batch": 31,
    "source": "IDX Channel",
    "scraped_at": "2026-01-24T16:07:16.468378"
  },
  {
    "title": "Harga Emas Sentuh Level Tertinggi 6 Pekan di Tengah Ekspektasi Pemangkasan Suku Bunga",
    "url": "https://www.idxchannel.com/market-news/harga-emas-sentuh-level-tertinggi-6-pekan-di-tengah-ekspektasi-pemangkasan-suku-bunga",
    "date_display": "02/12/2025 07:15 WIB",
    "date": "2025-12-02",
    "image_url": "https://img.idxchannel.com/media/439/images/idx/2025/09/03/emas_-3_sept_25_freepik.jpg",
    "category": "MARKET NEWS",
    "batch": 31,
    "source": "IDX Channel",
    "scraped_at": "2026-01-24T16:07:16.468992"
  },
  {
    "title": "TOWR Umumkan Dividen Interim Akhir 2025, Simak Jadwalnya",
    "url": "https://www.idxchannel.com/market-news/towr-umumkan-dividen-interim-akhir-2025-simak-jadwalnya",
    "date_display": "01/12/2025 12:57 WIB",
    "date": "2025-12-01",
