[
  {
    "title": "Saham PTRO-BUMI Cs Jadi Beban IHSG Pekan Ini",
    "url": "https://www.idxchannel.com/market-news/saham-ptro-bumi-cs-jadi-beban-ihsg-pekan-ini",
    "date_display": "24/01/2026 11:00 WIB",
    "date": "2026-01-24",
    "image_url": "https://img.idxchannel.com/media/439/images/idx/2024/06/07/saham_turun_-_16_-_freepik.jpg",
    "category": "MARKET NEWS",
    "batch": 0,
    "source": "IDX Channel",
    "scraped_at": "2026-01-24T15:59:56.037043"
  },
  {
    "title": "Saham BBCA hingga BUMI Jadi Sasaran Jual Asing Sepekan",
    "url": "https://www.idxchannel.com/market-news/saham-bbca-hingga-bumi-jadi-sasaran-jual-asing-sepekan",
    "date_display": "24/01/2026 08:20 WIB",
    "date": "2026-01-24",
    "image_url": "https://img.idxchannel.com/media/439/images/idx/2023/09/05/Saham_turun_-_Freepik_-_5_Sept.jpeg",
    "category": "MARKET NEWS",
    "batch": 0,
    "source": "IDX Channel",
    "scraped_at": "2026-01-24T15:59:56.037565"
  },
  {
    "title": "Pertamina Geothermal (PGEO) Jadi Calon Pelaksana Survei dan Eksplorasi di Cubadak Panti",
    "url": "https://www.idxchannel.com/market-news/pertamina-geothermal-pgeo-jadi-calon-pelaksana-survei-dan-eksplorasi-di-cubadak-panti",
    "date_display": "23/01/2026 17:06 WIB",
    "date": "2026-01-23",
    "image_url": "https://img.idxchannel.com/media/439/images/idx/2026/01/23/WhatsApp_Image_2026-01-23_at_5_08_07_PM__1_.jpeg",
    "category": "MARKET NEWS",
    "batch": 0,
    "source": "IDX Channel",
    "scraped_at": "2026-01-24T15:59:56.038043"
  },
  {
    "title": "Rekor Harga Emas Dunia Dongkrak Saham ANTM-MDKA Cs di Tengah Tekanan IHSG",
    "url": "https://www.idxchannel.com/market-news/rekor-harga-emas-dunia-dongkrak-saham-antm-mdka-cs-di-tengah-tekanan-ihsg",
    "date_display": "23/01/2026 11:28 WIB",
    "date": "2026-01-23",
    "image_url": "https://img.idxchannel.com/media/439/images/idx/2025/02/15/emas_-_unsplash-Feb_2025.jpg",
    "category": "MARKET NEWS",
    "batch": 0,
    "source": "IDX Channel",
    "scraped_at": "2026-01-24T15:59:56.038512"
  },
  {
    "title": "IHSG Turun 1 Persen di Tengah Kejatuhan Saham Konglo Prajogo Pangestu Cs",
    "url": "https://www.idxchannel.com/market-news/ihsg-turun-1-persen-di-tengah-kejatuhan-saham-konglo-prajogo-pangestu-cs",
    "date_display": "23/01/2026 10:56 WIB",
    "date": "2026-01-23",
    "image_url": "https://img.idxchannel.com/media/439/images/idx/2025/10/11/IHSG_-_Papan_-_10_Okt_25.jpg",
    "category": "MARKET NEWS",
    "batch": 0,
    "source": "IDX Channel",
    "scraped_at": "2026-01-24T15:59:56.038986"
  },
  {
    "title": "Saham BUMI-PTRO Jatuh Berhari-hari, Peluang Masuk MSCI Masih Terbuka?",
    "url": "https://www.idxchannel.com/market-news/saham-bumi-ptro-jatuh-berhari-hari-peluang-masuk-msci-masih-terbuka",
    "date_display": "23/01/2026 10:38 WIB",
    "date": "2026-01-23",
    "image_url": "https://img.idxchannel.com/media/439/images/idx/2025/05/05/saham_turun_-_freepik_-_5_Mei_25.jpg",
    "category": "MARKET NEWS",
    "batch": 0,
    "source": "IDX Channel",
    "scraped_at": "2026-01-24T15:59:56.039456"
  },
  {
    "title": "Dua Kandidat Kuat MSCI Februari BUMI-PTRO Kembali Tumbang",
    "url": "https://www.idxchannel.com/market-news/dua-kandidat-kuat-msci-februari-bumi-ptro-kembali-tumbang",
    "date_display": "23/01/2026 10:13 WIB",
    "date": "2026-01-23",
    "image_url": "https://img.idxchannel.com/media/439/images/idx/2024/06/07/saham_turun_-_16_-_freepik.jpg",
    "category": "MARKET NEWS",
    "batch": 0,
    "source": "IDX Channel",
    "scraped_at": "2026-01-24T15:59:56.039926"
  },
  {
    "title": "Saham Konglomerat BUMI, DEWA, hingga PTRO Jatuh, Antisipasi MSCI?",
    "url": "https://www.idxchannel.com/market-news/saham-konglomerat-bumi-dewa-hingga-ptro-jatuh-antisipasi-msci",
    "date_display": "23/01/2026 07:06 WIB",
    "date": "2026-01-23",
    "image_url": "https://img.idxchannel.com/media/439/images/idx/2026/01/23/Saham_turun_-_Freepik_-_22_Jan_26.jpeg",
    "category": "MARKET NEWS",
    "batch": 0,
    "source": "IDX Channel",
    "scraped_at": "2026-01-24T15:59:56.040386"
  },
  {
    "title": "Sanksi Lingkungan Guncang Pasar, Kinerja Emiten Grup Astra Jadi Sorotan",
    "url": "https://www.idxchannel.com/market-news/sanksi-lingkungan-guncang-pasar-kinerja-emiten-grup-astra-jadi-sorotan",
    "date_display": "23/01/2026 05:31 WIB",
    "date": "2026-01-23",
    "image_url": "https://img.idxchannel.com/media/439/images/idx/2023/04/02/Astra.jpg",
    "category": "MARKET NEWS",
    "batch": 0,
    "source": "IDX Channel",
    "scraped_at": "2026-01-24T15:59:56.040857"
  },
  {
    "title": "Dua Kandidat Kuat MSCI Februari BUMI-PTRO Malah Loyo, Intip Analisisnya",
    "url": "https://www.idxchannel.com/market-news/dua-kandidat-kuat-msci-februari-bumi-ptro-malah-loyo-intip-analisisnya",
    "date_display": "22/01/2026 10:57 WIB",
    "date": "2026-01-22",
    "image_url": "https://img.idxchannel.com/media/439/images/idx/2024/04/01/saham_turun_-_12_-_freepik.jpg",
    "category": "MARKET NEWS",
    "batch": 1,
    "source": "IDX Channel",
    "scraped_at": "2026-01-24T15:59:57.140711"
  },
  {
    "title": "Saham Emiten Emas ANTM-HRTA Cs Dilanda Aksi Ambil Untung",
    "url": "https://www.idxchannel.com/market-news/saham-emiten-emas-antm-hrta-cs-dilanda-aksi-ambil-untung",
    "date_display": "22/01/2026 10:16 WIB",
    "date": "2026-01-22",
    "image_url": "https://img.idxchannel.com/media/439/images/idx/2025/10/22/emas_-_freepik_-_20_Okt_25.jpg",
    "category": "MARKET NEWS",
    "batch": 1,
    "source": "IDX Channel",
    "scraped_at": "2026-01-24T15:59:57.141222"
  },
  {
    "title": "Terungkap Sosok yang Menjual 18,19 Miliar Saham BUMI Senilai Rp6,91 Triliun",
    "url": "https://www.idxchannel.com/market-news/terungkap-sosok-yang-menjual-1819-miliar-saham-bumi-senilai-rp691-triliun",
    "date_display": "21/01/2026 17:08 WIB",
    "date": "2026-01-21",
    "image_url": "https://img.idxchannel.com/media/439/images/idx/2023/07/03/PT_Bumi_Resources_Tbk__BUMI_.jpg",
    "category": "MARKET NEWS",
    "batch": 1,
    "source": "IDX Channel",
    "scraped_at": "2026-01-24T15:59:57.148429"
  },
  {
    "title": "Izin Tambang Agincourt Dicabut, Laba United Tractors (UNTR) Terancam",
    "url": "https://www.idxchannel.com/market-news/izin-tambang-agincourt-dicabut-laba-united-tractors-untr-terancam",
    "date_display": "21/01/2026 13:18 WIB",
    "date": "2026-01-21",
    "image_url": "https://img.idxchannel.com/media/439/images/idx/2026/01/21/United_Tractors_-_UNTR_-.png",
    "category": "MARKET NEWS",
    "batch": 1,
    "source": "IDX Channel",
    "scraped_at": "2026-01-24T15:59:57.148976"
  },
  {
    "title": "IHSG Turun Lebih 1 Persen saat Pasar Menanti RDG BI, UNTR-ASII Cs Jadi Beban",
    "url": "https://www.idxchannel.com/market-news/ihsg-turun-lebih-1-persen-saat-pasar-menanti-rdg-bi-untr-asii-cs-jadi-beban",
    "date_display": "21/01/2026 12:49 WIB",
    "date": "2026-01-21",
    "image_url": "https://img.idxchannel.com/media/439/images/idx/2023/08/12/Saham_Turun_-_Freepik.jpeg",
    "category": "MARKET NEWS",
    "batch": 1,
    "source": "IDX Channel",
    "scraped_at": "2026-01-24T15:59:57.149481"
  },
  {
    "title": "Saham Jatuh usai Izin Agincourt Dicabut, Analis Soroti Area Kunci ASII dan UNTR",
    "url": "https://www.idxchannel.com/market-news/saham-jatuh-usai-izin-agincourt-dicabut-analis-soroti-area-kunci-asii-dan-untr",
    "date_display": "21/01/2026 12:08 WIB",
    "date": "2026-01-21",
    "image_url": "https://img.idxchannel.com/media/439/images/idx/2024/04/02/saham_turun_-_freepik_-_14.jpg",
    "category": "MARKET NEWS",
    "batch": 1,
    "source": "IDX Channel",
    "scraped_at": "2026-01-24T15:59:57.149984"
  },
  {
    "title": "Harga Emas Tembus USD4.800 Pertama Kali, Simak Gerak ARCI-MDKA Cs",
    "url": "https://www.idxchannel.com/market-news/harga-emas-tembus-usd4800-pertama-kali-simak-gerak-arci-mdka-cs",
    "date_display": "21/01/2026 11:00 WIB",
    "date": "2026-01-21",
    "image_url": "https://img.idxchannel.com/media/439/images/idx/2024/04/03/gold_emas_-_freepik_3.jpg",
    "category": "MARKET NEWS",
    "batch": 2,
    "source": "IDX Channel",
    "scraped_at": "2026-01-24T15:59:58.266763"
  },
  {
    "title": "Saham United Tractors (UNTR) dan Astra (ASII) Anjlok usai Prabowo Cabut Izin Tambang Agincourt",
    "url": "https://www.idxchannel.com/market-news/saham-united-tractors-untr-dan-astra-asii-anjlok-usai-prabowo-cabut-izin-tambang-agincourt",
    "date_display": "21/01/2026 10:14 WIB",
    "date": "2026-01-21",
    "image_url": "https://img.idxchannel.com/media/439/images/idx/2026/01/21/Agincourt_Tambang_emas_Martabe_-_UNTR.jpg",
    "category": "MARKET NEWS",
    "batch": 2,
    "source": "IDX Channel",
    "scraped_at": "2026-01-24T15:59:58.267312"
  },
  {
    "title": "Suspensi 8 Saham Dicabut Sekaligus, HUMI-RMKE Pindah ke Papan FCA",
    "url": "https://www.idxchannel.com/market-news/suspensi-8-saham-dicabut-sekaligus-humi-rmke-pindah-ke-papan-fca",
    "date_display": "21/01/2026 06:25 WIB",
    "date": "2026-01-21",
    "image_url": "https://img.idxchannel.com/media/439/images/idx/2025/04/25/bei.jpg",
    "category": "MARKET NEWS",
    "batch": 2,
    "source": "IDX Channel",
    "scraped_at": "2026-01-24T15:59:58.267844"
  },
  {
    "title": "Ganti Nahkoda, PGEO Tunjuk Ahmad Yani Jadi Dirut Utama",
    "url": "https://www.idxchannel.com/market-news/ganti-nahkoda-pgeo-tunjuk-ahmad-yani-jadi-dirut-utama",
    "date_display": "20/01/2026 21:23 WIB",
    "date": "2026-01-20",
    "image_url": "https://img.idxchannel.com/media/439/images/idx/2026/01/20/Foto_1a.jpeg",
    "category": "MARKET NEWS",
    "batch": 2,
    "source": "IDX Channel",
    "scraped_at": "2026-01-24T15:59:58.268400"
  },
  {
    "title": "Saham ANTM-BRMS Cs Melesat usai Harga Emas Tembus Rekor USD4.700",
    "url": "https://www.idxchannel.com/market-news/saham-antm-brms-cs-melesat-usai-harga-emas-tembus-rekor-usd4700",
    "date_display": "20/01/2026 16:31 WIB",
    "date": "2026-01-20",
    "image_url": "https://img.idxchannel.com/media/439/images/idx/2025/11/12/emas_-_freepik_-_12_Nov_25.jpg",
    "category": "MARKET NEWS",
    "batch": 2,
    "source": "IDX Channel",
    "scraped_at": "2026-01-24T15:59:58.269010"
  },
  {
    "title": "IHSG Berpotensi Menguat Hari Ini, Initip Analisa RATU, BUMI, hingga ADRO",
    "url": "https://www.idxchannel.com/market-news/ihsg-berpotensi-menguat-hari-ini-initip-analisa-ratu-bumi-hingga-adro",
    "date_display": "20/01/2026 09:09 WIB",
    "date": "2026-01-20",
    "image_url": "https://img.idxchannel.com/media/439/images/idx/2025/02/12/IHSG_okezone.jpg",
    "category": "MARKET NEWS",
    "batch": 2,
    "source": "IDX Channel",
    "scraped_at": "2026-01-24T15:59:58.269589"
  },
  {
    "title": "Transaksi Nego Jumbo Rp6,9 Triliun di Saham BUMI, Aksi Grup Salim?",
    "url": "https://www.idxchannel.com/market-news/transaksi-nego-jumbo-rp69-triliun-di-saham-bumi-aksi-grup-salim",
    "date_display": "20/01/2026 07:47 WIB",
    "date": "2026-01-20",
    "image_url": "https://img.idxchannel.com/media/439/images/idx/2025/05/16/bumi_resources.jpeg",
    "category": "MARKET NEWS",
    "batch": 3,
    "source": "IDX Channel",
    "scraped_at": "2026-01-24T15:59:59.366778"
  },
  {
    "title": "Saham CUAN-TPIA Cs Tersengat Aksi Akumulasi Prajogo Pangestu",
    "url": "https://www.idxchannel.com/market-news/saham-cuan-tpia-cs-tersengat-aksi-akumulasi-prajogo-pangestu",
    "date_display": "19/01/2026 11:45 WIB",
    "date": "2026-01-19",
    "image_url": "https://img.idxchannel.com/media/439/images/idx/2025/11/03/saham_naik_-_freepik_-_3_Nov_25.jpg",
    "category": "MARKET NEWS",
    "batch": 3,
    "source": "IDX Channel",
    "scraped_at": "2026-01-24T15:59:59.367162"
  },
  {
    "title": "Harga Emas Dunia Rekor Lagi, Simak Analisis Saham ANTM-ARCI Cs",
    "url": "https://www.idxchannel.com/market-news/harga-emas-dunia-rekor-lagi-simak-analisis-saham-antm-arci-cs",
    "date_display": "19/01/2026 10:32 WIB",
    "date": "2026-01-19",
    "image_url": "https://img.idxchannel.com/media/439/images/idx/2025/03/17/Freepik_-_emas_-_34.jpg",
    "category": "MARKET NEWS",
    "batch": 3,
    "source": "IDX Channel",
    "scraped_at": "2026-01-24T15:59:59.367540"
  },
  {
    "title": "IHSG Awal Pekan Diproyeksi Fluktuatif, Empat Saham Ini Jadi Sorotan Analis",
    "url": "https://www.idxchannel.com/market-news/ihsg-awal-pekan-diproyeksi-fluktuatif-empat-saham-ini-jadi-sorotan-analis",
    "date_display": "19/01/2026 06:30 WIB",
    "date": "2026-01-19",
    "image_url": "https://img.idxchannel.com/media/439/images/idx/2025/11/07/ihsg_hijau.jpg",
    "category": "MARKET NEWS",
    "batch": 3,
    "source": "IDX Channel",
    "scraped_at": "2026-01-24T15:59:59.367933"
  },
  {
    "title": "Emiten Grup Bakrie Pimpin Daftar 10 Saham Paling Sering Ditransaksikan Sepekan",
    "url": "https://www.idxchannel.com/market-news/emiten-grup-bakrie-pimpin-daftar-10-saham-paling-sering-ditransaksikan-sepekan",
    "date_display": "17/01/2026 15:00 WIB",
    "date": "2026-01-17",
    "image_url": "https://img.idxchannel.com/media/439/images/idx/2025/04/23/Jika_Saham_Profit_Taking_dan_UMA.jpg",
    "category": "MARKET NEWS",
    "batch": 3,
    "source": "IDX Channel",
    "scraped_at": "2026-01-24T15:59:59.368311"
  },
  {
    "title": "Peta Cuan 2026: Saham Kesehatan, Teknologi, hingga Perkapalan Jadi Sorotan",
    "url": "https://www.idxchannel.com/market-news/peta-cuan-2026-saham-kesehatan-teknologi-hingga-perkapalan-jadi-sorotan",
    "date_display": "16/01/2026 15:00 WIB",
    "date": "2026-01-16",
    "image_url": "https://img.idxchannel.com/media/439/images/idx/2025/08/18/saham_naik_-_rotasi_sektor_-_freepik.jpg",
    "category": "MARKET NEWS",
    "batch": 3,
    "source": "IDX Channel",
    "scraped_at": "2026-01-24T15:59:59.368690"
  },
  {
    "title": "10 Saham Catatkan Penurunan Terbesar Pekan ini, Ada BBSS, RAJA, hingga FPNI",
    "url": "https://www.idxchannel.com/market-news/10-saham-catatkan-penurunan-terbesar-pekan-ini-ada-bbss-raja-hingga-fpni",
    "date_display": "16/01/2026 11:18 WIB",
    "date": "2026-01-16",
    "image_url": "https://img.idxchannel.com/media/439/images/idx/2024/03/05/IHSG_merah.jpg",
    "category": "MARKET NEWS",
    "batch": 4,
    "source": "IDX Channel",
    "scraped_at": "2026-01-24T16:00:00.484039"
  },
  {
    "title": "Adhi Kartiko (NICE) Siap Bayar Denda usai Dipanggil Satgas PKH",
    "url": "https://www.idxchannel.com/market-news/adhi-kartiko-nice-siap-bayar-denda-usai-dipanggil-satgas-pkh",
    "date_display": "16/01/2026 05:00 WIB",
    "date": "2026-01-16",
    "image_url": "https://img.idxchannel.com/media/439/images/idx/2026/01/09/adhi_kartiko_nice.jpg",
    "category": "MARKET NEWS",
    "batch": 4,
    "source": "IDX Channel",
    "scraped_at": "2026-01-24T16:00:00.484592"
  },
  {
    "title": "Oversupply Minyak Dunia Tekan ICP Desember 2025 ke USD61,10 per Barel",
    "url": "https://www.idxchannel.com/market-news/oversupply-minyak-dunia-tekan-icp-desember-2025-ke-usd6110-per-barel",
    "date_display": "15/01/2026 16:43 WIB",
    "date": "2026-01-15",
    "image_url": "https://img.idxchannel.com/media/439/images/idx/2025/05/21/migas.jpeg",
    "category": "MARKET NEWS",
    "batch": 4,
    "source": "IDX Channel",
    "scraped_at": "2026-01-24T16:00:00.485142"
  },
  {
    "title": "Optimisme Pasar Menguat, IHSG Bisa Tembus 10.500 di Akhir 2026",
    "url": "https://www.idxchannel.com/market-news/optimisme-pasar-menguat-ihsg-bisa-tembus-10500-di-akhir-2026",
    "date_display": "14/01/2026 14:59 WIB",
    "date": "2026-01-14",
    "image_url": "https://img.idxchannel.com/media/439/images/idx/2026/01/06/IHSG_freepik.jpg",
    "category": "MARKET NEWS",
    "batch": 4,
    "source": "IDX Channel",
    "scraped_at": "2026-01-24T16:00:00.485683"
  },
  {
    "title": "Aksi Borong Prajogo Pangestu Kerek Saham BREN-BRPT Cs",
    "url": "https://www.idxchannel.com/market-news/aksi-borong-prajogo-pangestu-kerek-saham-bren-brpt-cs",
    "date_display": "14/01/2026 10:34 WIB",
    "date": "2026-01-14",
    "image_url": "https://img.idxchannel.com/media/439/images/idx/2025/03/07/prajogo_pangestu.jpg",
    "category": "MARKET NEWS",
    "batch": 4,
    "source": "IDX Channel",
    "scraped_at": "2026-01-24T16:00:00.486223"
  },
  {
    "title": "Saham Emiten Emas Berpesta Lagi, ARCI-PSAB Pimpin Reli",
    "url": "https://www.idxchannel.com/market-news/saham-emiten-emas-berpesta-lagi-arci-psab-pimpin-reli",
    "date_display": "14/01/2026 10:10 WIB",
    "date": "2026-01-14",
    "image_url": "https://img.idxchannel.com/media/439/images/idx/2025/03/28/emas_-_gold_-_freepik_28_mar_25.jpg",
    "category": "MARKET NEWS",
    "batch": 4,
    "source": "IDX Channel",
    "scraped_at": "2026-01-24T16:00:00.486819"
  },
  {
    "title": "IHSG Hari Ini Dibuka Menguat ke 9.007, Mayoritas Sektor di Zona Hijau",
    "url": "https://www.idxchannel.com/market-news/ihsg-hari-ini-dibuka-menguat-ke-9007-mayoritas-sektor-di-zona-hijau",
    "date_display": "14/01/2026 09:31 WIB",
    "date": "2026-01-14",
    "image_url": "https://img.idxchannel.com/media/439/images/idx/2025/12/03/IHSG_ATH.jpg",
    "category": "MARKET NEWS",
    "batch": 5,
    "source": "IDX Channel",
    "scraped_at": "2026-01-24T16:00:01.605051"
  },
  {
    "title": "Pasar Menanti Keputusan Metodologi Free Float MSCI",
    "url": "https://www.idxchannel.com/market-news/pasar-menanti-keputusan-metodologi-free-float-msci",
    "date_display": "14/01/2026 07:22 WIB",
    "date": "2026-01-14",
    "image_url": "https://img.idxchannel.com/media/439/images/idx/2026/01/14/Monterrey-office-_MSCI_-.jpg",
    "category": "MARKET NEWS",
    "batch": 5,
    "source": "IDX Channel",
    "scraped_at": "2026-01-24T16:00:01.605633"
  },
  {
    "title": "Saham Konglomerat Grup Bakrie hingga Hapsoro Tumbang Lagi",
    "url": "https://www.idxchannel.com/market-news/saham-konglomerat-grup-bakrie-hingga-hapsoro-tumbang-lagi",
    "date_display": "13/01/2026 12:07 WIB",
    "date": "2026-01-13",
    "image_url": "https://img.idxchannel.com/media/439/images/idx/2024/03/27/saham_turun_-_freepik_-_7.jpg",
    "category": "MARKET NEWS",
    "batch": 5,
    "source": "IDX Channel",
    "scraped_at": "2026-01-24T16:00:01.606194"
  },
  {
    "title": "IHSG Sempat Terguncang hingga Turun 2 Persen, Simak Penyebabnya",
    "url": "https://www.idxchannel.com/market-news/ihsg-sempat-terguncang-hingga-turun-2-persen-simak-penyebabnya",
    "date_display": "12/01/2026 16:56 WIB",
    "date": "2026-01-12",
    "image_url": "https://img.idxchannel.com/media/439/images/idx/2023/10/27/saham_turun_-_asing_-_freepik.jpg",
    "category": "MARKET NEWS",
    "batch": 5,
    "source": "IDX Channel",
    "scraped_at": "2026-01-24T16:00:01.606749"
  },
  {
    "title": "IHSG Ditutup Koreksi ke 8.884, Mayoritas Sektor Parkir di Zona Merah",
    "url": "https://www.idxchannel.com/market-news/ihsg-ditutup-koreksi-ke-8884-mayoritas-sektor-parkir-di-zona-merah",
    "date_display": "12/01/2026 16:20 WIB",
    "date": "2026-01-12",
    "image_url": "https://img.idxchannel.com/media/439/images/idx/2025/10/11/IHSG_-_Papan_-_10_Okt_25.jpg",
    "category": "MARKET NEWS",
    "batch": 5,
    "source": "IDX Channel",
    "scraped_at": "2026-01-24T16:00:01.607293"
  },
  {
    "title": "IHSG Sempat Jatuh Lebih dari 2 Persen di Tengah Rontoknya Saham Konglo, Ada Apa?",
    "url": "https://www.idxchannel.com/market-news/ihsg-sempat-jatuh-lebih-dari-2-persen-di-tengah-rontoknya-saham-konglo-ada-apa",
    "date_display": "12/01/2026 15:15 WIB",
    "date": "2026-01-12",
    "image_url": "https://img.idxchannel.com/media/439/images/idx/2024/04/01/saham_turun_-_12_-_freepik.jpg",
    "category": "MARKET NEWS",
    "batch": 5,
    "source": "IDX Channel",
    "scraped_at": "2026-01-24T16:00:01.607867"
  },
  {
    "title": "IHSG Sesi I Parkir ke 8.947, MSKY-SOHO Masuk Top Gainers",
    "url": "https://www.idxchannel.com/market-news/ihsg-sesi-i-parkir-ke-8947-msky-soho-masuk-top-gainers",
    "date_display": "12/01/2026 12:12 WIB",
    "date": "2026-01-12",
    "image_url": "https://img.idxchannel.com/media/439/images/idx/2025/12/03/IHSG_ATH.jpg",
    "category": "MARKET NEWS",
    "batch": 6,
    "source": "IDX Channel",
    "scraped_at": "2026-01-24T16:00:02.716455"
  },
  {
    "title": "Saham ANTM-HRTA Cs Melonjak usai Harga Emas Tembus Rekor USD4.600",
    "url": "https://www.idxchannel.com/market-news/saham-antm-hrta-cs-melonjak-usai-harga-emas-tembus-rekor-usd4600",
    "date_display": "12/01/2026 10:50 WIB",
    "date": "2026-01-12",
    "image_url": "https://img.idxchannel.com/media/439/images/idx/2025/02/15/emas_-_unsplash-Feb_2025.jpg",
    "category": "MARKET NEWS",
    "batch": 6,
    "source": "IDX Channel",
    "scraped_at": "2026-01-24T16:00:02.717004"
  },
  {
    "title": "IHSG Pagi Hari Ini Dibuka Hijau ke Level 8.991",
    "url": "https://www.idxchannel.com/market-news/ihsg-pagi-hari-ini-dibuka-hijau-ke-level-8991",
    "date_display": "12/01/2026 09:20 WIB",
    "date": "2026-01-12",
    "image_url": "https://img.idxchannel.com/media/439/images/idx/2025/09/12/IHSG.jpg",
    "category": "MARKET NEWS",
    "batch": 6,
    "source": "IDX Channel",
    "scraped_at": "2026-01-24T16:00:02.717552"
  },
  {
    "title": "IHSG Hari Ini Berpotensi Lanjutkan Penguatan Jika Support di 8.900, Intip Enam Saham Pilihan",
    "url": "https://www.idxchannel.com/market-news/ihsg-hari-ini-berpotensi-lanjutkan-penguatan-jika-support-di-8900-intip-enam-saham-pilihan",
    "date_display": "12/01/2026 09:02 WIB",
    "date": "2026-01-12",
    "image_url": "https://img.idxchannel.com/media/439/images/idx/2026/01/05/IHSG_freepik.jpg",
    "category": "MARKET NEWS",
    "batch": 6,
    "source": "IDX Channel",
    "scraped_at": "2026-01-24T16:00:02.718089"
  },
  {
    "title": "IHSG Hari Ini Diproyeksi Tembus 9.000, Simak Analisa ARCI, BBRI, BUMI, dan BUVA",
    "url": "https://www.idxchannel.com/market-news/ihsg-hari-ini-diproyeksi-tembus-9000-simak-analisa-arci-bbri-bumi-dan-buva",
    "date_display": "12/01/2026 08:28 WIB",
    "date": "2026-01-12",
    "image_url": "https://img.idxchannel.com/media/439/images/idx/2026/01/08/ihsg_9000.jpg",
    "category": "MARKET NEWS",
    "batch": 6,
    "source": "IDX Channel",
    "scraped_at": "2026-01-24T16:00:02.718624"
  },
  {
    "title": "BRMS Gelontorkan USD3,20 Juta Garap Tambang Emas hingga Tembaga per Desember 2025",
    "url": "https://www.idxchannel.com/market-news/brms-gelontorkan-usd320-juta-garap-tambang-emas-hingga-tembaga-per-desember-2025",
    "date_display": "12/01/2026 08:15 WIB",
    "date": "2026-01-12",
    "image_url": "https://img.idxchannel.com/media/439/images/idx/2023/08/25/Bumi_Resources_Minerals_BRMS.jpg",
    "category": "MARKET NEWS",
    "batch": 6,
    "source": "IDX Channel",
    "scraped_at": "2026-01-24T16:00:02.719161"
  },
  {
    "title": "148 Ribu Investor Baru Serbu Saham BUMI di Tengah Reli",
    "url": "https://www.idxchannel.com/market-news/148-ribu-investor-baru-serbu-saham-bumi-di-tengah-reli",
    "date_display": "12/01/2026 07:07 WIB",
    "date": "2026-01-12",
    "image_url": "https://img.idxchannel.com/media/439/images/idx/2025/11/22/Bumi_Resources_-_BUMI_-_22_Nov_25.jpg",
    "category": "MARKET NEWS",
    "batch": 7,
    "source": "IDX Channel",
    "scraped_at": "2026-01-24T16:00:03.857115"
  },
  {
    "title": "Asing Lepas Saham Konglo Ini, Bakrie hingga Salim Masuk Daftar Jual",
    "url": "https://www.idxchannel.com/market-news/asing-lepas-saham-konglo-ini-bakrie-hingga-salim-masuk-daftar-jual",
    "date_display": "11/01/2026 11:10 WIB",
    "date": "2026-01-11",
    "image_url": "https://img.idxchannel.com/media/439/images/idx/2024/04/02/saham_turun_-_freepik_-_14.jpg",
    "category": "MARKET NEWS",
    "batch": 7,
    "source": "IDX Channel",
    "scraped_at": "2026-01-24T16:00:03.857614"
  },
  {
    "title": "IHSG Pekan Depan Berpeluang Melaju ke 9.000, Simak Analisa 4 Saham Berikut",
    "url": "https://www.idxchannel.com/market-news/ihsg-pekan-depan-berpeluang-melaju-ke-9000-simak-analisa-4-saham-berikut",
    "date_display": "11/01/2026 06:00 WIB",
    "date": "2026-01-11",
    "image_url": "https://img.idxchannel.com/media/439/images/idx/2025/12/03/IHSG_ATH.jpg",
    "category": "MARKET NEWS",
    "batch": 7,
    "source": "IDX Channel",
    "scraped_at": "2026-01-24T16:00:03.858084"
  },
  {
    "title": "Siapa Kandidat Kuat Penghuni MSCI 2026? Ini Proyeksi Analis",
    "url": "https://www.idxchannel.com/market-news/siapa-kandidat-kuat-penghuni-msci-2026-ini-proyeksi-analis",
    "date_display": "10/01/2026 07:30 WIB",
    "date": "2026-01-10",
    "image_url": "https://img.idxchannel.com/media/439/images/idx/2025/11/06/MSCI_-_6_Nov_25.jpg",
    "category": "MARKET NEWS",
    "batch": 7,
    "source": "IDX Channel",
    "scraped_at": "2026-01-24T16:00:03.858543"
  },
  {
    "title": "IHSG Ditutup Menguat ke 8.936, Transaksi Perdagangan Sentuh Rp27,32 Triliun",
    "url": "https://www.idxchannel.com/market-news/ihsg-ditutup-menguat-ke-8936-transaksi-perdagangan-sentuh-rp2732-triliun",
    "date_display": "09/01/2026 16:25 WIB",
    "date": "2026-01-09",
    "image_url": "https://img.idxchannel.com/media/439/images/idx/2026/01/09/20260107_161546.jpg",
    "category": "MARKET NEWS",
    "batch": 7,
    "source": "IDX Channel",
    "scraped_at": "2026-01-24T16:00:03.859005"
  },
  {
    "title": "Aksi Lego CGS, Andhesti, dan Chengdong di Tengah Reli BRMS, BUMI, DEWA",
    "url": "https://www.idxchannel.com/market-news/aksi-lego-cgs-andhesti-dan-chengdong-di-tengah-reli-brms-bumi-dewa",
    "date_display": "09/01/2026 14:30 WIB",
    "date": "2026-01-09",
    "image_url": "https://img.idxchannel.com/media/439/images/idx/2025/08/30/brms_bumi_resources_minerals.jpeg",
    "category": "MARKET NEWS",
    "batch": 7,
    "source": "IDX Channel",
    "scraped_at": "2026-01-24T16:00:03.859463"
  },
  {
    "title": "IHSG Naik ke 8.960 saat Jeda Siang, 379 Saham Hijau",
    "url": "https://www.idxchannel.com/market-news/ihsg-naik-ke-8960-saat-jeda-siang-379-saham-hijau",
    "date_display": "09/01/2026 11:58 WIB",
    "date": "2026-01-09",
    "image_url": "https://img.idxchannel.com/media/439/images/idx/2024/07/19/ihsg_hijau.jpg",
    "category": "MARKET NEWS",
    "batch": 8,
    "source": "IDX Channel",
    "scraped_at": "2026-01-24T16:00:04.986268"
  },
  {
    "title": "Profit Taking Mereda, Tekanan Rupiah Bayangi IHSG",
    "url": "https://www.idxchannel.com/market-news/profit-taking-mereda-tekanan-rupiah-bayangi-ihsg",
    "date_display": "09/01/2026 09:56 WIB",
    "date": "2026-01-09",
    "image_url": "https://img.idxchannel.com/media/439/images/idx/2025/10/11/IHSG_-_Papan_-_10_Okt_25.jpg",
    "category": "MARKET NEWS",
    "batch": 8,
    "source": "IDX Channel",
    "scraped_at": "2026-01-24T16:00:04.986900"
  },
  {
    "title": "Krakatau Steel (KRAS) Bakal Pasok Baja untuk Proyek Pipa Gas Dumai-Sei Mangke",
    "url": "https://www.idxchannel.com/market-news/krakatau-steel-kras-bakal-pasok-baja-untuk-proyek-pipa-gas-dumai-sei-mangke",
    "date_display": "08/01/2026 19:08 WIB",
    "date": "2026-01-08",
    "image_url": "https://img.idxchannel.com/media/439/images/idx/2026/01/08/kras_dusem.jpg",
    "category": "MARKET NEWS",
    "batch": 8,
    "source": "IDX Channel",
    "scraped_at": "2026-01-24T16:00:04.987456"
  },
  {
    "title": "Tembus Level 9.000, IHSG Cetak Rekor Tertinggi Baru di Sesi Pagi Hari Ini",
    "url": "https://www.idxchannel.com/market-news/tembus-level-9000-ihsg-cetak-rekor-tertinggi-baru-di-sesi-pagi-hari-ini",
    "date_display": "08/01/2026 10:41 WIB",
    "date": "2026-01-08",
    "image_url": "https://img.idxchannel.com/media/439/images/idx/2026/01/08/ihsg_9000.jpg",
    "category": "MARKET NEWS",
    "batch": 8,
    "source": "IDX Channel",
    "scraped_at": "2026-01-24T16:00:04.987996"
  },
  {
    "title": "Saham Prajogo Menghijau, Petrosea (PTRO) Sentuh Rekor Tertinggi Baru",
    "url": "https://www.idxchannel.com/market-news/saham-prajogo-menghijau-petrosea-ptro-sentuh-rekor-tertinggi-baru",
    "date_display": "08/01/2026 10:39 WIB",
    "date": "2026-01-08",
    "image_url": "https://img.idxchannel.com/media/439/images/idx/2025/10/23/PTRO_Petrosea_-_23_Okt_25_-.jpg",
    "category": "MARKET NEWS",
    "batch": 8,
    "source": "IDX Channel",
    "scraped_at": "2026-01-24T16:00:04.988536"
  },
  {
    "title": "BUMI hingga PTRO Jadi Kandidat Kuat Penghuni MSCI di Februari",
    "url": "https://www.idxchannel.com/market-news/bumi-hingga-ptro-jadi-kandidat-kuat-penghuni-msci-di-februari",
    "date_display": "08/01/2026 07:18 WIB",
    "date": "2026-01-08",
    "image_url": "https://img.idxchannel.com/media/439/images/idx/2026/01/08/MSCI_-_building_-_7_Jan_26.jpeg",
    "category": "MARKET NEWS",
    "batch": 8,
    "source": "IDX Channel",
    "scraped_at": "2026-01-24T16:00:04.989068"
  },
  {
    "title": "Berburu Saham Konglomerat, Dua Nama Besar Ini Jadi Sorotan",
    "url": "https://www.idxchannel.com/market-news/berburu-saham-konglomerat-dua-nama-besar-ini-jadi-sorotan",
    "date_display": "07/01/2026 11:24 WIB",
    "date": "2026-01-07",
    "image_url": "https://img.idxchannel.com/media/439/images/idx/2023/12/04/saham_naik_-_asing_freepik.jpg",
    "category": "MARKET NEWS",
    "batch": 9,
    "source": "IDX Channel",
    "scraped_at": "2026-01-24T16:00:08.577292"
  },
  {
    "title": "Saham Logam Nikel hingga Tembaga Melaju Kencang",
    "url": "https://www.idxchannel.com/market-news/saham-logam-nikel-hingga-tembaga-melaju-kencang",
    "date_display": "07/01/2026 07:16 WIB",
    "date": "2026-01-07",
    "image_url": "https://img.idxchannel.com/media/439/images/idx/2025/07/24/pam_mineral_nicl.jpg",
    "category": "MARKET NEWS",
    "batch": 9,
    "source": "IDX Channel",
    "scraped_at": "2026-01-24T16:00:08.577833"
  },
  {
    "title": "Dukung Bisnis Empat Anak Usaha, MEDC Suntik Dana Rp2,4 Miliar",
    "url": "https://www.idxchannel.com/market-news/dukung-bisnis-empat-anak-usaha-medc-suntik-dana-rp24-miliar",
    "date_display": "06/01/2026 19:02 WIB",
    "date": "2026-01-06",
    "image_url": "https://img.idxchannel.com/media/439/images/idx/2025/05/20/medco_tangguh_inews.jpg",
    "category": "MARKET NEWS",
    "batch": 9,
    "source": "IDX Channel",
    "scraped_at": "2026-01-24T16:00:08.578396"
  },
  {
    "title": "Anak Usaha DKFT Raih Pinjaman dari Bank CCB (MCOR) Rp245 Miliar",
    "url": "https://www.idxchannel.com/market-news/anak-usaha-dkft-raih-pinjaman-dari-bank-ccb-mcor-rp245-miliar",
    "date_display": "06/01/2026 18:40 WIB",
    "date": "2026-01-06",
    "image_url": "https://img.idxchannel.com/media/439/images/idx/2026/01/06/dkft_tambang.jpg",
    "category": "MARKET NEWS",
    "batch": 9,
    "source": "IDX Channel",
    "scraped_at": "2026-01-24T16:00:08.578916"
  },
  {
    "title": "MKNT Disuntik Dana Rp823 Miliar, Akuisisi Perusahaan Baja dan Udang di Banten",
    "url": "https://www.idxchannel.com/market-news/mknt-disuntik-dana-rp823-miliar-akuisisi-perusahaan-baja-dan-udang-di-banten",
    "date_display": "05/01/2026 18:30 WIB",
    "date": "2026-01-05",
    "image_url": "https://img.idxchannel.com/media/439/images/idx/2026/01/05/baja_mep.jpg",
    "category": "MARKET NEWS",
    "batch": 9,
    "source": "IDX Channel",
    "scraped_at": "2026-01-24T16:00:08.579433"
  },
  {
    "title": "Siapa Pemilik Saham AHAP? Emiten Asuransi Umum, Inilah Konglomerat Pengendalinya",
    "url": "https://www.idxchannel.com/market-news/siapa-pemilik-saham-ahap-emiten-asuransi-umum-inilah-konglomerat-pengendalinya",
    "date_display": "05/01/2026 12:20 WIB",
    "date": "2026-01-05",
    "image_url": "https://img.idxchannel.com/media/439/images/idx/2025/08/04/Cara_Menghitung_Premi_Asuransi_Rumah.jpg",
    "category": "MARKET NEWS",
    "batch": 9,
    "source": "IDX Channel",
    "scraped_at": "2026-01-24T16:00:08.579947"
  },
  {
    "title": "January Effect Warnai IHSG di Awal 2026, Ditopang Saham Kapal dan Energi",
    "url": "https://www.idxchannel.com/market-news/january-effect-warnai-ihsg-di-awal-2026-ditopang-saham-kapal-dan-energi",
    "date_display": "05/01/2026 12:00 WIB",
    "date": "2026-01-05",
    "image_url": "https://img.idxchannel.com/media/439/images/idx/2025/08/14/saham_naik_-_freepik_14_agust_25.jpg",
    "category": "MARKET NEWS",
    "batch": 10,
    "source": "IDX Channel",
    "scraped_at": "2026-01-24T16:00:09.694261"
  },
  {
    "title": "Saham Grup Bakrie Melesat Lagi, BUMI-BRMS Pimpin Kenaikan",
    "url": "https://www.idxchannel.com/market-news/saham-grup-bakrie-melesat-lagi-bumi-brms-pimpin-kenaikan",
    "date_display": "05/01/2026 11:01 WIB",
    "date": "2026-01-05",
    "image_url": "https://img.idxchannel.com/media/439/images/idx/2024/01/19/saham_naik_-_freepik_304.jpg",
    "category": "MARKET NEWS",
    "batch": 10,
    "source": "IDX Channel",
    "scraped_at": "2026-01-24T16:00:09.694809"
  },
  {
    "title": "Saham Emas Kompak Berpesta, Analis Soroti Tiga Emiten Ini",
    "url": "https://www.idxchannel.com/market-news/saham-emas-kompak-berpesta-analis-soroti-tiga-emiten-ini",
    "date_display": "05/01/2026 10:28 WIB",
    "date": "2026-01-05",
    "image_url": "https://img.idxchannel.com/media/439/images/idx/2024/03/28/saham_naik_-_freepik_-_9.jpg",
    "category": "MARKET NEWS",
    "batch": 10,
    "source": "IDX Channel",
    "scraped_at": "2026-01-24T16:00:09.695354"
  },
  {
    "title": "Lo Kheng Hong Bocorkan Sektor Saham Jagoan di 2026",
    "url": "https://www.idxchannel.com/market-news/lo-kheng-hong-bocorkan-sektor-saham-jagoan-di-2026",
    "date_display": "05/01/2026 07:22 WIB",
    "date": "2026-01-05",
    "image_url": "https://img.idxchannel.com/media/439/images/idx/2024/05/31/Lo_Kheng_Hong_-_Aldo_Fernando_-_24.jpg",
    "category": "MARKET NEWS",
    "batch": 10,
    "source": "IDX Channel",
    "scraped_at": "2026-01-24T16:00:09.695892"
  },
  {
    "title": "10 Saham Paling Ramai Ditransaksikan Sepekan: BUMI, INET, hingga LEAD",
    "url": "https://www.idxchannel.com/market-news/10-saham-paling-ramai-ditransaksikan-sepekan-bumi-inet-hingga-lead",
    "date_display": "04/01/2026 19:40 WIB",
    "date": "2026-01-04",
    "image_url": "https://img.idxchannel.com/media/439/images/idx/2025/11/03/saham_naik_-_freepik_-_3_Nov_25.jpg",
    "category": "MARKET NEWS",
    "batch": 10,
    "source": "IDX Channel",
    "scraped_at": "2026-01-24T16:00:09.696433"
  },
  {
    "title": "Intip Kinerja Saham Sinar Mas 2025, Emiten Batu Baranya Tumbuh 170,78 Persen",
    "url": "https://www.idxchannel.com/market-news/intip-kinerja-saham-sinar-mas-2025-emiten-batu-baranya-tumbuh-17078-persen",
    "date_display": "03/01/2026 16:00 WIB",
    "date": "2026-01-03",
    "image_url": "https://img.idxchannel.com/media/439/images/idx/2023/06/07/Kisah_Sukses_Pendiri_Sinar_Mas_1.png",
    "category": "MARKET NEWS",
    "batch": 10,
    "source": "IDX Channel",
    "scraped_at": "2026-01-24T16:00:09.696970"
  },
  {
    "title": "Asing Borong Saham Konglo dan Perkapalan di Hari Pertama Perdagangan 2026",
    "url": "https://www.idxchannel.com/market-news/asing-borong-saham-konglo-dan-perkapalan-di-hari-pertama-perdagangan-2026",
    "date_display": "03/01/2026 10:28 WIB",
    "date": "2026-01-03",
    "image_url": "https://img.idxchannel.com/media/439/images/idx/2025/04/14/saham_naik_-_freepik_14_apr_25_-.jpg",
    "category": "MARKET NEWS",
    "batch": 11,
    "source": "IDX Channel",
    "scraped_at": "2026-01-24T16:00:10.895831"
  },
  {
    "title": "Geliat Saham Grup Bakrie di Awal 2026, DEWA dan VKTR Sentuh Rekor Tertinggi",
    "url": "https://www.idxchannel.com/market-news/geliat-saham-grup-bakrie-di-awal-2026-dewa-dan-vktr-sentuh-rekor-tertinggi",
    "date_display": "03/01/2026 09:15 WIB",
    "date": "2026-01-03",
    "image_url": "https://img.idxchannel.com/media/439/images/idx/2023/02/17/Tanjung_Bara_Port-Batu_Bara-KPC-Bumi-Aldo-1.jpeg",
    "category": "MARKET NEWS",
    "batch": 11,
    "source": "IDX Channel",
    "scraped_at": "2026-01-24T16:00:10.896374"
  },
  {
    "title": "Pemerintah Kaji Bea Ekspor Batu Bara 5-11 Persen, Simak Dampak ke Emiten",
    "url": "https://www.idxchannel.com/market-news/pemerintah-kaji-bea-ekspor-batu-bara-5-11-persen-simak-dampak-ke-emiten",
    "date_display": "02/01/2026 15:46 WIB",
    "date": "2026-01-02",
    "image_url": "https://img.idxchannel.com/media/439/images/idx/2024/06/14/batu_bara_-_unsplash-.jpg",
    "category": "MARKET NEWS",
    "batch": 11,
    "source": "IDX Channel",
    "scraped_at": "2026-01-24T16:00:10.896915"
  },
  {
    "title": "Saham Grup Bakrie BUMI-VTKR Cs Curi Panggung di Perdagangan Perdana 2026",
    "url": "https://www.idxchannel.com/market-news/saham-grup-bakrie-bumi-vtkr-cs-curi-panggung-di-perdagangan-perdana-2026",
    "date_display": "02/01/2026 10:48 WIB",
    "date": "2026-01-02",
    "image_url": "https://img.idxchannel.com/media/439/images/idx/2025/07/30/VKTR.jpeg",
    "category": "MARKET NEWS",
    "batch": 11,
    "source": "IDX Channel",
    "scraped_at": "2026-01-24T16:00:10.897464"
  },
  {
    "title": "Mengintip Prospek Saham Konglomerat di 2026, Masih Bakal Hot?",
    "url": "https://www.idxchannel.com/market-news/mengintip-prospek-saham-konglomerat-di-2026-masih-bakal-hot",
    "date_display": "02/01/2026 07:12 WIB",
    "date": "2026-01-02",
    "image_url": "https://img.idxchannel.com/media/439/images/idx/2025/11/03/saham_naik_-_freepik_-_3_Nov_25.jpg",
    "category": "MARKET NEWS",
    "batch": 11,
    "source": "IDX Channel",
    "scraped_at": "2026-01-24T16:00:10.897980"
  },
  {
    "title": "Saham-Saham Konglomerat Jadi Motor Reli IHSG 2025",
    "url": "https://www.idxchannel.com/market-news/saham-saham-konglomerat-jadi-motor-reli-ihsg-2025",
    "date_display": "31/12/2025 11:35 WIB",
    "date": "2025-12-31",
    "image_url": "https://img.idxchannel.com/media/439/images/idx/2024/01/19/saham_naik_-_freepik_304.jpg",
    "category": "MARKET NEWS",
    "batch": 11,
    "source": "IDX Channel",
    "scraped_at": "2026-01-24T16:00:10.898485"
  },
  {
    "title": "Asing Ramai-Ramai Lepas Saham Bank Besar sepanjang 2025",
    "url": "https://www.idxchannel.com/market-news/asing-ramai-ramai-lepas-saham-bank-besar-sepanjang-2025",
    "date_display": "31/12/2025 10:52 WIB",
    "date": "2025-12-31",
    "image_url": "https://img.idxchannel.com/media/439/images/idx/2025/04/16/buyback_saham_naik_-_freepik_apr_25.jpg",
    "category": "MARKET NEWS",
    "batch": 12,
    "source": "IDX Channel",
    "scraped_at": "2026-01-24T16:00:12.003297"
  },
  {
    "title": "Dari Happy Hapsoro hingga Haji Isam, Reli Saham Konglomerasi Warnai Bursa 2025",
    "url": "https://www.idxchannel.com/market-news/dari-happy-hapsoro-hingga-haji-isam-reli-saham-konglomerasi-warnai-bursa-2025",
    "date_display": "31/12/2025 07:45 WIB",
    "date": "2025-12-31",
    "image_url": "https://img.idxchannel.com/media/439/images/idx/2025/05/13/Nasib_Saham_Saat_Perusahaan_Merger.jpg",
    "category": "MARKET NEWS",
    "batch": 12,
    "source": "IDX Channel",
    "scraped_at": "2026-01-24T16:00:12.003821"
  },
  {
    "title": "Deretan Saham Paling Banyak Diborong Asing sepanjang 2025",
    "url": "https://www.idxchannel.com/market-news/deretan-saham-paling-banyak-diborong-asing-sepanjang-2025",
    "date_display": "31/12/2025 07:23 WIB",
    "date": "2025-12-31",
    "image_url": "https://img.idxchannel.com/media/439/images/idx/2025/08/18/saham_naik_-_rotasi_sektor_-_freepik.jpg",
    "category": "MARKET NEWS",
    "batch": 12,
    "source": "IDX Channel",
    "scraped_at": "2026-01-24T16:00:12.004291"
  },
  {
    "title": "Chengdong Jual 4,45 Miliar Saham BUMI Sepanjang Desember 2025",
    "url": "https://www.idxchannel.com/market-news/chengdong-jual-445-miliar-saham-bumi-sepanjang-desember-2025",
    "date_display": "30/12/2025 17:02 WIB",
    "date": "2025-12-30",
    "image_url": "https://img.idxchannel.com/media/439/images/idx/2025/08/02/bumi_resources_ist.jpg",
    "category": "MARKET NEWS",
    "batch": 12,
    "source": "IDX Channel",
    "scraped_at": "2026-01-24T16:00:12.004752"
  },
  {
    "title": "Saham ARCI-HRTA Cs Tumbang saat Harga Emas Tergelincir",
    "url": "https://www.idxchannel.com/market-news/saham-arci-hrta-cs-tumbang-saat-harga-emas-tergelincir",
    "date_display": "30/12/2025 09:48 WIB",
    "date": "2025-12-30",
    "image_url": "https://img.idxchannel.com/media/439/images/idx/2024/03/27/saham_turun_-_freepik_-_7.jpg",
    "category": "MARKET NEWS",
    "batch": 12,
    "source": "IDX Channel",
    "scraped_at": "2026-01-24T16:00:12.005210"
  },
  {
    "title": "Saham Emiten Emas HRTA-AMMN Cs Kompak Melesat",
    "url": "https://www.idxchannel.com/market-news/saham-emiten-emas-hrta-ammn-cs-kompak-melesat",
    "date_display": "29/12/2025 10:51 WIB",
    "date": "2025-12-29",
    "image_url": "https://img.idxchannel.com/media/439/images/idx/2025/04/16/buyback_saham_naik_-_freepik_apr_25.jpg",
    "category": "MARKET NEWS",
    "batch": 12,
    "source": "IDX Channel",
    "scraped_at": "2026-01-24T16:00:12.005771"
  },
  {
    "title": "10 Saham Paling Sering Ditransaksikan Sepekan, Nomor Satu Nilainya Tembus Rp9,63 Triliun",
    "url": "https://www.idxchannel.com/market-news/10-saham-paling-sering-ditransaksikan-sepekan-nomor-satu-nilainya-tembus-rp963-triliun",
    "date_display": "27/12/2025 10:30 WIB",
    "date": "2025-12-27",
    "image_url": "https://img.idxchannel.com/media/439/images/idx/2025/12/11/3_Ciri_Saham_ARA.jpg",
    "category": "MARKET NEWS",
    "batch": 13,
    "source": "IDX Channel",
    "scraped_at": "2026-01-24T16:00:13.107864"
  },
  {
    "title": "PGJO Bentuk Dua Anak Usaha Dagang Batu Bara dan Nikel",
    "url": "https://www.idxchannel.com/market-news/pgjo-bentuk-dua-anak-usaha-dagang-batu-bara-dan-nikel",
    "date_display": "26/12/2025 21:35 WIB",
    "date": "2025-12-26",
    "image_url": "https://img.idxchannel.com/media/439/images/idx/2025/09/02/PGJO.JPG",
    "category": "MARKET NEWS",
    "batch": 13,
    "source": "IDX Channel",
    "scraped_at": "2026-01-24T16:00:13.108410"
  },
  {
    "title": "Teken Perjanjian Jual Beli Saham, Anak Usaha RATU Siap Caplok SMS Development",
    "url": "https://www.idxchannel.com/market-news/teken-perjanjian-jual-beli-saham-anak-usaha-ratu-siap-caplok-sms-development",
    "date_display": "26/12/2025 05:05 WIB",
    "date": "2025-12-26",
    "image_url": "https://img.idxchannel.com/media/439/images/idx/2025/10/08/Raharja_Energi_Cepu_-_RATU_-_Okt_25.jpg",
    "category": "MARKET NEWS",
    "batch": 13,
    "source": "IDX Channel",
    "scraped_at": "2026-01-24T16:00:13.109045"
  },
  {
    "title": "Jajaran Saham Top Gainers Sepekan, ATAP hingga INCO Naik Dua Digit",
    "url": "https://www.idxchannel.com/market-news/jajaran-saham-top-gainers-sepekan-atap-hingga-inco-naik-dua-digit",
    "date_display": "25/12/2025 07:35 WIB",
    "date": "2025-12-25",
    "image_url": "https://img.idxchannel.com/media/439/images/idx/2025/07/20/saham_naik_freep.png",
    "category": "MARKET NEWS",
    "batch": 13,
    "source": "IDX Channel",
    "scraped_at": "2026-01-24T16:00:13.109831"
  },
  {
    "title": "Emas hingga Nikel Menguat Serempak, Reli Logam Berlanjut di Penghujung 2025",
    "url": "https://www.idxchannel.com/market-news/emas-hingga-nikel-menguat-serempak-reli-logam-berlanjut-di-penghujung-2025",
    "date_display": "25/12/2025 06:00 WIB",
    "date": "2025-12-25",
    "image_url": "https://img.idxchannel.com/media/439/images/idx/2025/12/12/emas_dok_Freepik.jpg",
    "category": "MARKET NEWS",
    "batch": 13,
    "source": "IDX Channel",
    "scraped_at": "2026-01-24T16:00:13.110408"
  },
  {
    "title": "Anak Usaha RATU Teken Perjanjian Novasi, Siap Caplok SMS Development",
    "url": "https://www.idxchannel.com/market-news/anak-usaha-ratu-teken-perjanjian-novasi-siap-caplok-sms-development",
    "date_display": "24/12/2025 22:21 WIB",
    "date": "2025-12-24",
    "image_url": "https://img.idxchannel.com/media/439/images/idx/2025/12/01/RATU_akuisisi_Blok_Madura__1_.jpeg",
    "category": "MARKET NEWS",
    "batch": 13,
    "source": "IDX Channel",
    "scraped_at": "2026-01-24T16:00:13.110953"
  },
  {
    "title": "Jelang Natal, IHSG Sore Berakhir Melemah 0,55 Persen ke 8.537",
    "url": "https://www.idxchannel.com/market-news/jelang-natal-ihsg-sore-berakhir-melemah-055-persen-ke-8537",
    "date_display": "24/12/2025 16:08 WIB",
    "date": "2025-12-24",
    "image_url": "https://img.idxchannel.com/media/439/images/idx/2024/04/19/IHSG_1.jpg",
    "category": "MARKET NEWS",
    "batch": 14,
    "source": "IDX Channel",
    "scraped_at": "2026-01-24T16:00:14.324526"
  },
  {
    "title": "Sektor Energi Positif Sepanjang 2025, Empat Saham Ini Curi Perhatian",
    "url": "https://www.idxchannel.com/market-news/sektor-energi-positif-sepanjang-2025-empat-saham-ini-curi-perhatian",
    "date_display": "24/12/2025 13:39 WIB",
    "date": "2025-12-24",
    "image_url": "https://img.idxchannel.com/media/439/images/idx/2025/10/08/Raharja_Energi_Cepu_-_RATU_-_Okt_25.jpg",
    "category": "MARKET NEWS",
    "batch": 14,
    "source": "IDX Channel",
    "scraped_at": "2026-01-24T16:00:14.325081"
  },
  {
    "title": "Siapa Pemilik Saham SOCI? Emiten Pelayan Barang Cair, Inilah Daftar Pengendalinya",
    "url": "https://www.idxchannel.com/market-news/siapa-pemilik-saham-soci-emiten-pelayan-barang-cair-inilah-daftar-pengendalinya",
    "date_display": "24/12/2025 13:24 WIB",
    "date": "2025-12-24",
    "image_url": "https://img.idxchannel.com/media/439/images/idx/2025/12/24/Screenshot_2025-12-24_131723.png",
    "category": "MARKET NEWS",
    "batch": 14,
    "source": "IDX Channel",
    "scraped_at": "2026-01-24T16:00:14.325598"
  },
  {
    "title": "IHSG Sesi I Naik Tipis 2,71 Poin ke 8.587",
    "url": "https://www.idxchannel.com/market-news/ihsg-sesi-i-naik-tipis-271-poin-ke-8587",
    "date_display": "24/12/2025 12:05 WIB",
    "date": "2025-12-24",
    "image_url": "https://img.idxchannel.com/media/439/images/idx/2025/11/12/IHSG_hijau.JPG",
    "category": "MARKET NEWS",
    "batch": 14,
    "source": "IDX Channel",
    "scraped_at": "2026-01-24T16:00:14.326117"
  },
  {
    "title": "Saham Emiten Emas Masih Melaju, Giliran HRTA Naik 9 Persen",
    "url": "https://www.idxchannel.com/market-news/saham-emiten-emas-masih-melaju-giliran-hrta-naik-9-persen",
    "date_display": "24/12/2025 10:20 WIB",
    "date": "2025-12-24",
    "image_url": "https://img.idxchannel.com/media/439/images/idx/2024/03/25/saham_naik_-_freepik_-_35.jpg",
    "category": "MARKET NEWS",
    "batch": 14,
    "source": "IDX Channel",
    "scraped_at": "2026-01-24T16:00:14.326658"
  },
  {
    "title": "Jelang Libur Natal 2025, IHSG Dibuka Hijau ke 8.597",
    "url": "https://www.idxchannel.com/market-news/jelang-libur-natal-2025-ihsg-dibuka-hijau-ke-8597",
    "date_display": "24/12/2025 09:08 WIB",
    "date": "2025-12-24",
    "image_url": "https://img.idxchannel.com/media/439/images/idx/2024/08/14/IHSG_hijau.JPG",
    "category": "MARKET NEWS",
    "batch": 14,
    "source": "IDX Channel",
    "scraped_at": "2026-01-24T16:00:14.327232"
  },
  {
    "title": "Nasib Emiten Tambang 2025, Emas vs Batu Bara Cuan Mana?",
    "url": "https://www.idxchannel.com/market-news/nasib-emiten-tambang-2025-emas-vs-batu-bara-cuan-mana",
    "date_display": "23/12/2025 17:46 WIB",
    "date": "2025-12-23",
    "image_url": "https://img.idxchannel.com/media/439/images/idx/2025/12/23/truck-is-parked-dirt-lot-with-man-working-it.jpg",
    "category": "MARKET NEWS",
    "batch": 15,
    "source": "IDX Channel",
    "scraped_at": "2026-01-24T16:00:15.432411"
  },
  {
    "title": "Saham ENRG Milik Siapa? Emiten Migas, Inilah Profil Usaha dan Daftar Pengendalinya",
    "url": "https://www.idxchannel.com/market-news/saham-enrg-milik-siapa-emiten-migas-inilah-profil-usaha-dan-daftar-pengendalinya",
    "date_display": "23/12/2025 16:20 WIB",
    "date": "2025-12-23",
    "image_url": "https://img.idxchannel.com/media/439/images/idx/2025/10/22/ENRG.JPG",
    "category": "MARKET NEWS",
    "batch": 15,
    "source": "IDX Channel",
    "scraped_at": "2026-01-24T16:00:15.433014"
  },
  {
    "title": "KDM Stop Izin Properti di Jabar, Ini Kata Trimitra Prawaraland (ATAP)",
    "url": "https://www.idxchannel.com/market-news/kdm-stop-izin-properti-di-jabar-ini-kata-trimitra-prawaraland-atap",
    "date_display": "23/12/2025 11:43 WIB",
    "date": "2025-12-23",
    "image_url": "https://img.idxchannel.com/media/439/images/idx/2025/11/20/trimitra_atap.jpg",
    "category": "MARKET NEWS",
    "batch": 15,
    "source": "IDX Channel",
    "scraped_at": "2026-01-24T16:00:15.433597"
  },
  {
    "title": "Jaga Momentum, Saham Emiten Emas HRTA-BRMS Cs Menguat Kembali",
    "url": "https://www.idxchannel.com/market-news/jaga-momentum-saham-emiten-emas-hrta-brms-cs-menguat-kembali",
    "date_display": "23/12/2025 10:21 WIB",
    "date": "2025-12-23",
    "image_url": "https://img.idxchannel.com/media/439/images/idx/2025/08/08/saham_naik_-_freepik_-_6_agust_25.jpg",
    "category": "MARKET NEWS",
    "batch": 15,
    "source": "IDX Channel",
    "scraped_at": "2026-01-24T16:00:15.434140"
  },
  {
    "title": "IHSG Dibuka Menguat ke 8.656",
    "url": "https://www.idxchannel.com/market-news/ihsg-dibuka-menguat-ke-8656",
    "date_display": "23/12/2025 09:21 WIB",
    "date": "2025-12-23",
    "image_url": "https://img.idxchannel.com/media/439/images/idx/2025/11/07/ihsg_hijau.jpg",
    "category": "MARKET NEWS",
    "batch": 15,
    "source": "IDX Channel",
    "scraped_at": "2026-01-24T16:00:15.434695"
  },
  {
    "title": "Kinerja Sektor Sepanjang 2025, Saham Teknologi Memimpin",
    "url": "https://www.idxchannel.com/market-news/kinerja-sektor-sepanjang-2025-saham-teknologi-memimpin",
    "date_display": "23/12/2025 07:27 WIB",
    "date": "2025-12-23",
    "image_url": "https://img.idxchannel.com/media/439/images/idx/2024/10/24/saham_naik_-_freepik_-_12.jpg",
    "category": "MARKET NEWS",
    "batch": 15,
    "source": "IDX Channel",
    "scraped_at": "2026-01-24T16:00:15.435182"
  },
  {
    "title": "Saham Grup Bakrie DEWA-BUMI Rebound usai Sempat Dilego Asing, Simak Target Terbaru",
    "url": "https://www.idxchannel.com/market-news/saham-grup-bakrie-dewa-bumi-rebound-usai-sempat-dilego-asing-simak-target-terbaru",
    "date_display": "22/12/2025 10:52 WIB",
    "date": "2025-12-22",
    "image_url": "https://img.idxchannel.com/media/439/images/idx/2022/09/21/Bumi_Resources_-_Tambang_-_web-min.jpg",
    "category": "MARKET NEWS",
    "batch": 16,
    "source": "IDX Channel",
    "scraped_at": "2026-01-24T16:00:16.544796"
  },
  {
    "title": "Saham ANTM-HRTA Cs Menguat di Tengah Rekor Baru Harga Emas Dunia",
    "url": "https://www.idxchannel.com/market-news/saham-antm-hrta-cs-menguat-di-tengah-rekor-baru-harga-emas-dunia",
    "date_display": "22/12/2025 09:56 WIB",
    "date": "2025-12-22",
    "image_url": "https://img.idxchannel.com/media/439/images/idx/2024/04/05/emas_-_freepik_-_6.jpg",
    "category": "MARKET NEWS",
    "batch": 16,
    "source": "IDX Channel",
    "scraped_at": "2026-01-24T16:00:16.545343"
  },
  {
    "title": "Saham Grup Bakrie DEWA-BUMI Jadi Sasaran Jual Asing Pekan Ini",
    "url": "https://www.idxchannel.com/market-news/saham-grup-bakrie-dewa-bumi-jadi-sasaran-jual-asing-pekan-ini",
    "date_display": "21/12/2025 09:26 WIB",
    "date": "2025-12-21",
    "image_url": "https://img.idxchannel.com/media/439/images/idx/2024/04/01/saham_turun_-_12_-_freepik.jpg",
    "category": "MARKET NEWS",
    "batch": 16,
    "source": "IDX Channel",
    "scraped_at": "2026-01-24T16:00:16.545880"
  },
  {
    "title": "BEI Sebut Ada Tiga Obligasi dan Satu Sukuk Tercatat di BEI Selama Sepekan",
    "url": "https://www.idxchannel.com/market-news/bei-sebut-ada-tiga-obligasi-dan-satu-sukuk-tercatat-di-bei-selama-sepekan",
    "date_display": "20/12/2025 07:46 WIB",
    "date": "2025-12-20",
    "image_url": "https://img.idxchannel.com/media/439/images/idx/2024/07/03/bursa_efek_indonesia_gedung_-_unsplash.jpg",
    "category": "MARKET NEWS",
    "batch": 16,
    "source": "IDX Channel",
    "scraped_at": "2026-01-24T16:00:16.546413"
  },
  {
    "title": "BUMI Optimistis Kinerja Makin Stabil Usai Akuisisi Tambang Emas dan Tembaga",
    "url": "https://www.idxchannel.com/market-news/bumi-optimistis-kinerja-makin-stabil-usai-akuisisi-tambang-emas-dan-tembaga",
    "date_display": "19/12/2025 17:25 WIB",
    "date": "2025-12-19",
    "image_url": "https://img.idxchannel.com/media/439/images/idx/2025/06/19/wolfram_bumi.jpg",
    "category": "MARKET NEWS",
    "batch": 16,
    "source": "IDX Channel",
    "scraped_at": "2026-01-24T16:00:16.546948"
  },
  {
    "title": "Saham Konglomerat Lesu Jelang Libur Akhir Tahun",
    "url": "https://www.idxchannel.com/market-news/saham-konglomerat-lesu-jelang-libur-akhir-tahun",
    "date_display": "19/12/2025 10:30 WIB",
    "date": "2025-12-19",
    "image_url": "https://img.idxchannel.com/media/439/images/idx/2024/06/07/saham_turun_-_16_-_freepik.jpg",
    "category": "MARKET NEWS",
    "batch": 16,
    "source": "IDX Channel",
    "scraped_at": "2026-01-24T16:00:16.547480"
  },
  {
    "title": "BUMI Resmi Caplok 64,98 Persen Saham Perusahaan Tambang Emas Australia",
    "url": "https://www.idxchannel.com/market-news/bumi-resmi-caplok-6498-persen-saham-perusahaan-tambang-emas-australia",
    "date_display": "19/12/2025 07:54 WIB",
    "date": "2025-12-19",
    "image_url": "https://img.idxchannel.com/media/439/images/idx/2025/08/02/bumi_resources_ist.jpg",
    "category": "MARKET NEWS",
    "batch": 17,
    "source": "IDX Channel",
    "scraped_at": "2026-01-24T16:00:17.656583"
  },
  {
    "title": "Saham LEAD Milik Siapa? Perusahaan Perkapalan Migas, Inilah Daftar Pemiliknya",
    "url": "https://www.idxchannel.com/market-news/saham-lead-milik-siapa-perusahaan-perkapalan-migas-inilah-daftar-pemiliknya",
    "date_display": "18/12/2025 17:09 WIB",
    "date": "2025-12-18",
    "image_url": "https://img.idxchannel.com/media/439/images/idx/2025/12/18/Screenshot_2025-12-18_170853.png",
    "category": "MARKET NEWS",
    "batch": 17,
    "source": "IDX Channel",
    "scraped_at": "2026-01-24T16:00:17.657128"
  },
  {
    "title": "WIKA Kantongi Kontrak Baru Proyek Pipa Transmisi Gas Senilai Rp1,87 Triliun",
    "url": "https://www.idxchannel.com/market-news/wika-kantongi-kontrak-baru-proyek-pipa-transmisi-gas-senilai-rp187-triliun",
    "date_display": "18/12/2025 10:58 WIB",
    "date": "2025-12-18",
    "image_url": "https://img.idxchannel.com/media/439/images/idx/2021/06/16/wika.jpg",
    "category": "MARKET NEWS",
    "batch": 17,
    "source": "IDX Channel",
    "scraped_at": "2026-01-24T16:00:17.657666"
  },
  {
    "title": "Mengintip Kinerja Saham MSCI Indonesia Big Cap dan ETF EIDO di 2025",
    "url": "https://www.idxchannel.com/market-news/mengintip-kinerja-saham-msci-indonesia-big-cap-dan-etf-eido-di-2025",
    "date_display": "18/12/2025 07:21 WIB",
    "date": "2025-12-18",
    "image_url": "https://img.idxchannel.com/media/439/images/idx/2025/11/06/MSCI_-_6_Nov_25.jpg",
    "category": "MARKET NEWS",
    "batch": 17,
    "source": "IDX Channel",
    "scraped_at": "2026-01-24T16:00:17.658210"
  },
  {
    "title": "Elnusa (ELSA) Jajaki Peluang Kerja Sama dan Proyek Migas di Irak",
    "url": "https://www.idxchannel.com/market-news/elnusa-elsa-jajaki-peluang-kerja-sama-dan-proyek-migas-di-irak",
    "date_display": "18/12/2025 04:00 WIB",
    "date": "2025-12-18",
    "image_url": "https://img.idxchannel.com/media/439/images/idx/2025/12/17/elnusa_elsa.jpg",
    "category": "MARKET NEWS",
    "batch": 17,
    "source": "IDX Channel",
    "scraped_at": "2026-01-24T16:00:17.658771"
  },
  {
    "title": "Komisaris BSDE Yoseph Franciscus Bonang Meninggal Dunia",
    "url": "https://www.idxchannel.com/market-news/komisaris-bsde-yoseph-franciscus-bonang-meninggal-dunia",
    "date_display": "17/12/2025 17:35 WIB",
    "date": "2025-12-17",
    "image_url": "https://img.idxchannel.com/media/439/images/idx/2025/12/17/yoseph_bonang_bsd.jpg",
    "category": "MARKET NEWS",
    "batch": 17,
    "source": "IDX Channel",
    "scraped_at": "2026-01-24T16:00:17.659293"
  },
  {
    "title": "Harga Emas Dunia Solid, Saham ANTM-ARCI Cs Menghijau",
    "url": "https://www.idxchannel.com/market-news/harga-emas-dunia-solid-saham-antm-arci-cs-menghijau",
    "date_display": "17/12/2025 10:20 WIB",
    "date": "2025-12-17",
    "image_url": "https://img.idxchannel.com/media/439/images/idx/2025/03/28/emas_-_gold_-_freepik_28_mar_25.jpg",
    "category": "MARKET NEWS",
    "batch": 18,
    "source": "IDX Channel",
    "scraped_at": "2026-01-24T16:00:18.758873"
  },
  {
    "title": "Analis Soroti Rotasi dari Saham Konglomerat ke Blue Chip",
    "url": "https://www.idxchannel.com/market-news/analis-soroti-rotasi-dari-saham-konglomerat-ke-blue-chip",
    "date_display": "16/12/2025 12:17 WIB",
    "date": "2025-12-16",
    "image_url": "https://img.idxchannel.com/media/439/images/idx/2025/08/18/saham_naik_-_rotasi_sektor_-_freepik.jpg",
    "category": "MARKET NEWS",
    "batch": 18,
    "source": "IDX Channel",
    "scraped_at": "2026-01-24T16:00:18.759421"
  },
  {
    "title": "Dukung Program MBG, WMUU Datangkan Indukan Ayam dari AS",
    "url": "https://www.idxchannel.com/market-news/dukung-program-mbg-wmuu-datangkan-indukan-ayam-dari-as",
    "date_display": "15/12/2025 23:00 WIB",
    "date": "2025-12-15",
    "image_url": "https://img.idxchannel.com/media/439/images/idx/2025/12/15/ayam_wmuu.jpg",
    "category": "MARKET NEWS",
    "batch": 18,
    "source": "IDX Channel",
    "scraped_at": "2026-01-24T16:00:18.759959"
  },
  {
    "title": "5 Saham BUMN dengan Kenaikan Harga Year to Date Tertinggi, Intip Perbandingan PBV-nya",
    "url": "https://www.idxchannel.com/market-news/5-saham-bumn-dengan-kenaikan-harga-year-to-date-tertinggi-intip-perbandingan-pbv-nya",
    "date_display": "15/12/2025 17:49 WIB",
    "date": "2025-12-15",
    "image_url": "https://img.idxchannel.com/media/439/images/idx/2025/05/20/kementerian_bumn.jpeg",
    "category": "MARKET NEWS",
    "batch": 18,
    "source": "IDX Channel",
    "scraped_at": "2026-01-24T16:00:18.760602"
  },
  {
    "title": "Saham ARCI-HRTA Cs Terimbas Aksi Ambil Untung, Harga Emas Masih Solid",
    "url": "https://www.idxchannel.com/market-news/saham-arci-hrta-cs-terimbas-aksi-ambil-untung-harga-emas-masih-solid",
    "date_display": "15/12/2025 10:30 WIB",
    "date": "2025-12-15",
    "image_url": "https://img.idxchannel.com/media/439/images/idx/2023/10/27/saham_turun_-_asing_-_freepik.jpg",
    "category": "MARKET NEWS",
    "batch": 18,
    "source": "IDX Channel",
    "scraped_at": "2026-01-24T16:00:18.761149"
  },
  {
    "title": "Sambut Santa Claus Rally, IHSG Pekan Ini Diprediksi Menguat",
    "url": "https://www.idxchannel.com/market-news/sambut-santa-claus-rally-ihsg-pekan-ini-diprediksi-menguat",
    "date_display": "15/12/2025 08:10 WIB",
    "date": "2025-12-15",
    "image_url": "https://img.idxchannel.com/media/439/images/idx/2025/01/02/IHSG_1.jpg",
    "category": "MARKET NEWS",
    "batch": 18,
    "source": "IDX Channel",
    "scraped_at": "2026-01-24T16:00:18.761675"
  },
  {
    "title": "Saham Emas Berkilau, ARCI-BRMS Cs Berpesta Pekan Ini",
    "url": "https://www.idxchannel.com/market-news/saham-emas-berkilau-arci-brms-cs-berpesta-pekan-ini",
    "date_display": "13/12/2025 12:02 WIB",
    "date": "2025-12-13",
    "image_url": "https://img.idxchannel.com/media/439/images/idx/2025/04/14/saham_naik_-_freepik_14_apr_25_-.jpg",
    "category": "MARKET NEWS",
    "batch": 19,
    "source": "IDX Channel",
    "scraped_at": "2026-01-24T16:00:19.865971"
  },
  {
    "title": "Pekannya Saham Grup Bakrie, DEWA-BUMI Cs Terbang Puluhan Persen",
    "url": "https://www.idxchannel.com/market-news/pekannya-saham-grup-bakrie-dewa-bumi-cs-terbang-puluhan-persen",
    "date_display": "13/12/2025 11:00 WIB",
    "date": "2025-12-13",
    "image_url": "https://img.idxchannel.com/media/439/images/idx/2025/08/30/brms_bumi_resources_minerals.jpeg",
    "category": "MARKET NEWS",
    "batch": 19,
    "source": "IDX Channel",
    "scraped_at": "2026-01-24T16:00:19.866518"
  },
  {
    "title": "Asing Buru Saham-Saham Tambang Milik Konglomerat Pekan Ini",
    "url": "https://www.idxchannel.com/market-news/asing-buru-saham-saham-tambang-milik-konglomerat-pekan-ini",
    "date_display": "13/12/2025 10:00 WIB",
    "date": "2025-12-13",
    "image_url": "https://img.idxchannel.com/media/439/images/idx/2025/08/18/saham_naik_-_rotasi_sektor_-_freepik.jpg",
    "category": "MARKET NEWS",
    "batch": 19,
    "source": "IDX Channel",
    "scraped_at": "2026-01-24T16:00:19.867058"
  },
  {
    "title": "Saham KIOS Melesat 171 Persen, Puncaki Top Gainers Pekan Ini",
    "url": "https://www.idxchannel.com/market-news/saham-kios-melesat-171-persen-puncaki-top-gainers-pekan-ini",
    "date_display": "13/12/2025 07:39 WIB",
    "date": "2025-12-13",
    "image_url": "https://img.idxchannel.com/media/439/images/idx/2023/09/08/Saham_Langganan_Top_Gainers.jpg",
    "category": "MARKET NEWS",
    "batch": 19,
    "source": "IDX Channel",
    "scraped_at": "2026-01-24T16:00:19.867594"
  },
  {
    "title": "PGEO Kaji Peluang Bangun Green Data Center Berbasis Panas Bumi Pertama di Indonesia",
    "url": "https://www.idxchannel.com/market-news/pgeo-kaji-peluang-bangun-green-data-center-berbasis-panas-bumi-pertama-di-indonesia",
    "date_display": "12/12/2025 22:00 WIB",
    "date": "2025-12-12",
    "image_url": "https://img.idxchannel.com/media/439/images/idx/2025/12/12/PGE_data_center_panas_bumi_dok_pge.jpg",
    "category": "MARKET NEWS",
    "batch": 19,
    "source": "IDX Channel",
    "scraped_at": "2026-01-24T16:00:19.868129"
  },
  {
    "title": "Elnusa (ELSA) Gandeng Ecolab Inc Kembangkan Bisnis Green Energy",
    "url": "https://www.idxchannel.com/market-news/elnusa-elsa-gandeng-ecolab-inc-kembangkan-bisnis-green-energy",
    "date_display": "12/12/2025 18:45 WIB",
    "date": "2025-12-12",
    "image_url": "https://img.idxchannel.com/media/439/images/idx/2025/12/12/Elnusa.JPG",
    "category": "MARKET NEWS",
    "batch": 19,
    "source": "IDX Channel",
    "scraped_at": "2026-01-24T16:00:19.868661"
  },
  {
    "title": "Pastikan Penerapan ESG, Merdeka Copper (MDKA) Dorong Anak Usaha Lakukan Ini",
    "url": "https://www.idxchannel.com/market-news/pastikan-penerapan-esg-merdeka-copper-mdka-dorong-anak-usaha-lakukan-ini",
    "date_display": "12/12/2025 18:44 WIB",
    "date": "2025-12-12",
    "image_url": "https://img.idxchannel.com/media/439/images/idx/2025/12/12/anak_usaha_MDKA.jpg",
    "category": "MARKET NEWS",
    "batch": 20,
    "source": "IDX Channel",
    "scraped_at": "2026-01-24T16:00:20.972179"
  },
  {
    "title": "IHSG Sesi I Menguat ke Level 8.659, CTTH Masuk Top Gainers",
    "url": "https://www.idxchannel.com/market-news/ihsg-sesi-i-menguat-ke-level-8659-ctth-masuk-top-gainers",
    "date_display": "12/12/2025 11:55 WIB",
    "date": "2025-12-12",
    "image_url": "https://img.idxchannel.com/media/439/images/idx/2021/08/05/ihsg_ijo.jpg",
    "category": "MARKET NEWS",
    "batch": 20,
    "source": "IDX Channel",
    "scraped_at": "2026-01-24T16:00:20.972738"
  },
  {
    "title": "SpaceX Dikabarkan Bakal IPO, Apa Saja Bisnis Perusahaannya?",
    "url": "https://www.idxchannel.com/market-news/spacex-dikabarkan-bakal-ipo-apa-saja-bisnis-perusahaannya",
    "date_display": "11/12/2025 17:03 WIB",
    "date": "2025-12-11",
    "image_url": "https://img.idxchannel.com/media/439/images/idx/2025/12/11/SpaceX__1_.jpg",
    "category": "MARKET NEWS",
    "batch": 20,
    "source": "IDX Channel",
    "scraped_at": "2026-01-24T16:00:20.973286"
  },
  {
    "title": "IHSG Turun ke 8.620 saat Penutupan, 524 Saham Terkoreksi",
    "url": "https://www.idxchannel.com/market-news/ihsg-turun-ke-8620-saat-penutupan-524-saham-terkoreksi",
    "date_display": "11/12/2025 16:20 WIB",
    "date": "2025-12-11",
    "image_url": "https://img.idxchannel.com/media/439/images/idx/2024/04/19/IHSG_1.jpg",
    "category": "MARKET NEWS",
    "batch": 20,
    "source": "IDX Channel",
    "scraped_at": "2026-01-24T16:00:20.973831"
  },
  {
    "title": "IHSG Jeda Siang Parkir di 8.673, Terbebani Profit Taking",
    "url": "https://www.idxchannel.com/market-news/ihsg-jeda-siang-parkir-di-8673-terbebani-profit-taking",
    "date_display": "11/12/2025 12:15 WIB",
    "date": "2025-12-11",
    "image_url": "https://img.idxchannel.com/media/439/images/idx/2025/05/21/ihsg.jpg",
    "category": "MARKET NEWS",
    "batch": 20,
    "source": "IDX Channel",
    "scraped_at": "2026-01-24T16:00:20.974376"
  },
  {
    "title": "Saham Grup Bakrie Hot: DEWA-BUMI Terbang Belasan Persen, Transaksi Triliunan",
    "url": "https://www.idxchannel.com/market-news/saham-grup-bakrie-hot-dewa-bumi-terbang-belasan-persen-transaksi-triliunan",
    "date_display": "11/12/2025 11:02 WIB",
    "date": "2025-12-11",
    "image_url": "https://img.idxchannel.com/media/439/images/idx/2024/10/02/saham_naik_-_freepik_-_91.jpg",
    "category": "MARKET NEWS",
    "batch": 20,
    "source": "IDX Channel",
    "scraped_at": "2026-01-24T16:00:20.974923"
  },
  {
    "title": "Saham-Saham Sawit (CPO) Ramai Tumbang, Analis Jelaskan Penyebabnya",
    "url": "https://www.idxchannel.com/market-news/saham-saham-sawit-cpo-ramai-tumbang-analis-jelaskan-penyebabnya",
    "date_display": "11/12/2025 10:33 WIB",
    "date": "2025-12-11",
    "image_url": "https://img.idxchannel.com/media/439/images/idx/2024/03/08/cpo_sawit_-_freepik_3-.jpg",
    "category": "MARKET NEWS",
    "batch": 21,
    "source": "IDX Channel",
    "scraped_at": "2026-01-24T16:00:22.091138"
  },
  {
    "title": "Waskita Beton (WSBP) Bidik Pendapatan Rp2,1 Triliun di 2026, Intip Strateginya",
    "url": "https://www.idxchannel.com/market-news/waskita-beton-wsbp-bidik-pendapatan-rp21-triliun-di-2026-intip-strateginya",
    "date_display": "10/12/2025 20:45 WIB",
    "date": "2025-12-10",
    "image_url": "https://img.idxchannel.com/media/439/images/idx/2023/11/10/WSBP_suplai_proyek_pengaman_pantai.jpeg",
    "category": "MARKET NEWS",
    "batch": 21,
    "source": "IDX Channel",
    "scraped_at": "2026-01-24T16:00:22.091824"
  },
  {
    "title": "Perbandingan PBV 9 Saham Emas di Bursa, Mana yang Paling Mahal?",
    "url": "https://www.idxchannel.com/market-news/perbandingan-pbv-9-saham-emas-di-bursa-mana-yang-paling-mahal",
    "date_display": "10/12/2025 17:50 WIB",
    "date": "2025-12-10",
    "image_url": "https://img.idxchannel.com/media/439/images/idx/2025/12/05/tambang_emas_freepik.jpg",
    "category": "MARKET NEWS",
    "batch": 21,
    "source": "IDX Channel",
    "scraped_at": "2026-01-24T16:00:22.092377"
  },
  {
    "title": "IHSG Ditutup Menguat ke Level 8.700 usai Bergerak Fluktuatif",
    "url": "https://www.idxchannel.com/market-news/ihsg-ditutup-menguat-ke-level-8700-usai-bergerak-fluktuatif",
    "date_display": "10/12/2025 16:15 WIB",
    "date": "2025-12-10",
    "image_url": "https://img.idxchannel.com/media/439/images/idx/2025/12/03/IHSG_8630.jpg",
    "category": "MARKET NEWS",
    "batch": 21,
    "source": "IDX Channel",
    "scraped_at": "2026-01-24T16:00:22.093088"
  },
  {
    "title": "IHSG Bertahan di 8.693 saat Sesi Siang, 274 Saham Menguat",
    "url": "https://www.idxchannel.com/market-news/ihsg-bertahan-di-8693-saat-sesi-siang-274-saham-menguat",
    "date_display": "10/12/2025 12:14 WIB",
    "date": "2025-12-10",
    "image_url": "https://img.idxchannel.com/media/439/images/idx/2024/08/14/IHSG_hijau.JPG",
    "category": "MARKET NEWS",
    "batch": 21,
    "source": "IDX Channel",
    "scraped_at": "2026-01-24T16:00:22.094027"
  },
  {
    "title": "Di Balik Panasnya Grup Bakrie, Saham Konglo Lain Dinilai Menarik",
    "url": "https://www.idxchannel.com/market-news/di-balik-panasnya-grup-bakrie-saham-konglo-lain-dinilai-menarik",
    "date_display": "10/12/2025 11:25 WIB",
    "date": "2025-12-10",
    "image_url": "https://img.idxchannel.com/media/439/images/idx/2025/04/16/buyback_saham_naik_-_freepik_apr_25.jpg",
    "category": "MARKET NEWS",
    "batch": 21,
    "source": "IDX Channel",
    "scraped_at": "2026-01-24T16:00:22.094894"
  },
  {
    "title": "Saham Grup Bakrie Lanjut Reli, BUMI Terbang 20 Persen ke Atas Rp300",
    "url": "https://www.idxchannel.com/market-news/saham-grup-bakrie-lanjut-reli-bumi-terbang-20-persen-ke-atas-rp300",
    "date_display": "10/12/2025 10:28 WIB",
    "date": "2025-12-10",
    "image_url": "https://img.idxchannel.com/media/439/images/idx/2023/02/17/Tanjung_Bara_Port-Batu_Bara-KPC-Bumi-Aldo-1.jpeg",
    "category": "MARKET NEWS",
    "batch": 22,
    "source": "IDX Channel",
    "scraped_at": "2026-01-24T16:00:23.200543"
  },
  {
    "title": "PTRO Kantongi Backlog USD4,5 Miliar, Begini Prospek Kinerja 2026",
    "url": "https://www.idxchannel.com/market-news/ptro-kantongi-backlog-usd45-miliar-begini-prospek-kinerja-2026",
    "date_display": "09/12/2025 14:20 WIB",
    "date": "2025-12-09",
    "image_url": "https://img.idxchannel.com/media/439/images/idx/2025/01/24/ptro_petrosea.jpg",
    "category": "MARKET NEWS",
    "batch": 22,
    "source": "IDX Channel",
    "scraped_at": "2026-01-24T16:00:23.201085"
  },
  {
    "title": "Saham BUMI Milik Siapa Saja? Inilah Daftar Pemegangnya Saat Ini",
    "url": "https://www.idxchannel.com/market-news/saham-bumi-milik-siapa-saja-inilah-daftar-pemegangnya-saat-ini",
    "date_display": "09/12/2025 14:07 WIB",
    "date": "2025-12-09",
    "image_url": "https://img.idxchannel.com/media/439/images/idx/2025/12/09/Screenshot_2025-12-09_141317.png",
    "category": "MARKET NEWS",
    "batch": 22,
    "source": "IDX Channel",
    "scraped_at": "2026-01-24T16:00:23.201747"
  },
  {
    "title": "Reli Saham Grup Bakrie, Analis Soroti DEWA, BUMI, hingga VKTR",
    "url": "https://www.idxchannel.com/market-news/reli-saham-grup-bakrie-analis-soroti-dewa-bumi-hingga-vktr",
    "date_display": "09/12/2025 12:28 WIB",
    "date": "2025-12-09",
    "image_url": "https://img.idxchannel.com/media/439/images/idx/2025/11/22/Bumi_Resources_-_BUMI_-_22_Nov_25.jpg",
    "category": "MARKET NEWS",
    "batch": 22,
    "source": "IDX Channel",
    "scraped_at": "2026-01-24T16:00:23.202297"
  },
  {
    "title": "Geliat Tiga Saham Grup Bakrie, DEWA Tembus Level Rp500",
    "url": "https://www.idxchannel.com/market-news/geliat-tiga-saham-grup-bakrie-dewa-tembus-level-rp500",
    "date_display": "09/12/2025 11:15 WIB",
    "date": "2025-12-09",
    "image_url": "https://img.idxchannel.com/media/439/images/idx/2025/09/22/Darma_Henwa_-_22_Sept_25.jpg",
    "category": "MARKET NEWS",
    "batch": 22,
    "source": "IDX Channel",
    "scraped_at": "2026-01-24T16:00:23.202838"
  },
  {
    "title": "Kembali ATH, IHSG Dibuka Menguat ke 8.743",
    "url": "https://www.idxchannel.com/market-news/kembali-ath-ihsg-dibuka-menguat-ke-8743",
    "date_display": "09/12/2025 09:22 WIB",
    "date": "2025-12-09",
    "image_url": "https://img.idxchannel.com/media/439/images/idx/2025/12/03/IHSG_ATH.jpg",
    "category": "MARKET NEWS",
    "batch": 22,
    "source": "IDX Channel",
    "scraped_at": "2026-01-24T16:00:23.203377"
  },
  {
    "title": "IHSG Ditutup Menguat ke 8.710, Catat Rekor Baru",
    "url": "https://www.idxchannel.com/market-news/ihsg-ditutup-menguat-ke-8710-catat-rekor-baru",
    "date_display": "08/12/2025 16:17 WIB",
    "date": "2025-12-08",
    "image_url": "https://img.idxchannel.com/media/439/images/idx/2025/12/08/a12dd607-3a90-434e-bd51-fc3f9107eeb1.jpg",
    "category": "MARKET NEWS",
    "batch": 23,
    "source": "IDX Channel",
    "scraped_at": "2026-01-24T16:00:24.318105"
  },
  {
    "title": "Sektor Komoditas Dinilai Potensial di 2026, Begini Prospeknya",
    "url": "https://www.idxchannel.com/market-news/sektor-komoditas-dinilai-potensial-di-2026-begini-prospeknya",
    "date_display": "07/12/2025 05:05 WIB",
    "date": "2025-12-07",
    "image_url": "https://img.idxchannel.com/media/439/images/idx/komoditas_emas_batu_bara.jpg",
    "category": "MARKET NEWS",
    "batch": 23,
    "source": "IDX Channel",
    "scraped_at": "2026-01-24T16:00:24.318651"
  },
  {
    "title": "IHSG dalam Tren Positif, Saham Konglomerasi Diproyeksi Dorong Reli Lanjutan",
    "url": "https://www.idxchannel.com/market-news/ihsg-dalam-tren-positif-saham-konglomerasi-diproyeksi-dorong-reli-lanjutan",
    "date_display": "05/12/2025 06:22 WIB",
    "date": "2025-12-05",
    "image_url": "https://img.idxchannel.com/media/439/images/idx/2025/11/07/ihsg_hijau.jpg",
    "category": "MARKET NEWS",
    "batch": 23,
    "source": "IDX Channel",
    "scraped_at": "2026-01-24T16:00:24.319198"
  },
  {
    "title": "4 Proyek Panas Bumi PGEO Masuk Blue Book Bappenas 2025-2029",
    "url": "https://www.idxchannel.com/market-news/4-proyek-panas-bumi-pgeo-masuk-blue-book-bappenas-2025-2029",
    "date_display": "04/12/2025 15:42 WIB",
    "date": "2025-12-04",
    "image_url": "https://img.idxchannel.com/media/439/images/idx/2025/10/30/pgeo_panas_bumi.jpeg",
    "category": "MARKET NEWS",
    "batch": 23,
    "source": "IDX Channel",
    "scraped_at": "2026-01-24T16:00:24.319848"
  },
  {
    "title": "Sentimen Positif Dorong IHSG, COIN-SMGR Bisa Dicermati",
    "url": "https://www.idxchannel.com/market-news/sentimen-positif-dorong-ihsg-coin-smgr-bisa-dicermati",
    "date_display": "04/12/2025 07:15 WIB",
    "date": "2025-12-04",
    "image_url": "https://img.idxchannel.com/media/439/images/idx/2024/04/19/IHSG.jpg",
    "category": "MARKET NEWS",
    "batch": 23,
    "source": "IDX Channel",
    "scraped_at": "2026-01-24T16:00:24.320403"
  },
  {
    "title": "Chengdong Investment Kembali Lego 3,71 Miliar Saham BUMI, Kini Tersisa 6,99 Persen",
    "url": "https://www.idxchannel.com/market-news/chengdong-investment-kembali-lego-371-miliar-saham-bumi-kini-tersisa-699-persen",
    "date_display": "03/12/2025 20:30 WIB",
    "date": "2025-12-03",
    "image_url": "https://img.idxchannel.com/media/439/images/idx/2023/01/18/Kapan_waktu_yang_tepat_jual_saham.png",
    "category": "MARKET NEWS",
    "batch": 23,
    "source": "IDX Channel",
    "scraped_at": "2026-01-24T16:00:24.320948"
  },
  {
    "title": "Dian Swastatika (DSSA) Kebut Adopsi EBT dan Penguatan Infrastruktur Digital",
    "url": "https://www.idxchannel.com/market-news/dian-swastatika-dssa-kebut-adopsi-ebt-dan-penguatan-infrastruktur-digital",
    "date_display": "03/12/2025 17:07 WIB",
    "date": "2025-12-03",
    "image_url": "https://img.idxchannel.com/media/439/images/idx/2025/09/16/Sejarah_Emiten_DSSA.jpeg",
    "category": "MARKET NEWS",
    "batch": 24,
    "source": "IDX Channel",
    "scraped_at": "2026-01-24T16:00:25.440442"
  },
  {
    "title": "IHSG Sesi Pertama Bertahan di 8.635, Mayoritas Sektor Menguat",
    "url": "https://www.idxchannel.com/market-news/ihsg-sesi-pertama-bertahan-di-8635-mayoritas-sektor-menguat",
    "date_display": "03/12/2025 12:20 WIB",
    "date": "2025-12-03",
    "image_url": "https://img.idxchannel.com/media/439/images/idx/2025/12/03/IHSG_8630.jpg",
    "category": "MARKET NEWS",
    "batch": 24,
    "source": "IDX Channel",
    "scraped_at": "2026-01-24T16:00:25.441062"
  },
  {
    "title": "IHSG Diproyeksi Positif Ditopang Inflow Asing hingga Sentimen Bursa Global",
    "url": "https://www.idxchannel.com/market-news/ihsg-diproyeksi-positif-ditopang-inflow-asing-hingga-sentimen-bursa-global",
    "date_display": "03/12/2025 09:43 WIB",
    "date": "2025-12-03",
    "image_url": "https://img.idxchannel.com/media/439/images/idx/2025/12/01/Ciri-Ciri_Saham_Gorengan.jpeg",
    "category": "MARKET NEWS",
    "batch": 24,
    "source": "IDX Channel",
    "scraped_at": "2026-01-24T16:00:25.441536"
  },
  {
    "title": "CDIA Bangun Fasilitas Tangki Bitumen Kapasitas 12.000 Meter Kubik",
    "url": "https://www.idxchannel.com/market-news/cdia-bangun-fasilitas-tangki-bitumen-kapasitas-12000-meter-kubik",
    "date_display": "02/12/2025 15:11 WIB",
    "date": "2025-12-02",
    "image_url": "https://img.idxchannel.com/media/439/images/idx/2025/12/02/Redeco_Petrolin_Utama.jpg",
    "category": "MARKET NEWS",
    "batch": 24,
    "source": "IDX Channel",
    "scraped_at": "2026-01-24T16:00:25.442000"
  },
  {
    "title": "IHSG Diproyeksi Hijau, BRMS hingga TLKM Disorot Analis",
    "url": "https://www.idxchannel.com/market-news/ihsg-diproyeksi-hijau-brms-hingga-tlkm-disorot-analis",
    "date_display": "02/12/2025 06:55 WIB",
    "date": "2025-12-02",
    "image_url": "https://img.idxchannel.com/media/439/images/idx/2024/07/01/IHSG_1.jpg",
    "category": "MARKET NEWS",
    "batch": 24,
    "source": "IDX Channel",
    "scraped_at": "2026-01-24T16:00:25.444250"
  },
  {
    "title": "IHSG Hari Ini Berpotensi Lanjutkan Penguatan, Simak Analisa 4 Saham Berikut",
    "url": "https://www.idxchannel.com/market-news/ihsg-hari-ini-berpotensi-lanjutkan-penguatan-simak-analisa-4-saham-berikut",
    "date_display": "02/12/2025 06:00 WIB",
    "date": "2025-12-02",
    "image_url": "https://img.idxchannel.com/media/439/images/idx/2025/11/07/ihsg_hijau.jpg",
    "category": "MARKET NEWS",
    "batch": 24,
    "source": "IDX Channel",
    "scraped_at": "2026-01-24T16:00:25.444891"
  },
  {
    "title": "BUMI Siapkan Akuisisi Tambang Mineral Baru di 2026, Pendapatan Non-Batu Bara Ditargetkan Meningkat",
    "url": "https://www.idxchannel.com/market-news/bumi-siapkan-akuisisi-tambang-mineral-baru-di-2026-pendapatan-non-batu-bara-ditargetkan-meningkat",
    "date_display": "01/12/2025 19:14 WIB",
    "date": "2025-12-01",
    "image_url": "https://img.idxchannel.com/media/439/images/idx/2023/08/25/Bumi_Resources_Minerals_BRMS.jpg",
    "category": "MARKET NEWS",
    "batch": 25,
    "source": "IDX Channel",
    "scraped_at": "2026-01-24T16:00:26.545128"
  },
  {
    "title": "Energi Mega Persada (ENRG) Terbitkan Obligasi Berkelanjutan Tahap I, Bidik Dana Rp4 Triliun",
    "url": "https://www.idxchannel.com/market-news/energi-mega-persada-enrg-terbitkan-obligasi-berkelanjutan-tahap-i-bidik-dana-rp4-triliun",
    "date_display": "01/12/2025 18:10 WIB",
    "date": "2025-12-01",
    "image_url": "https://img.idxchannel.com/media/439/images/idx/2024/12/19/enrg.jpg",
    "category": "MARKET NEWS",
    "batch": 25,
    "source": "IDX Channel",
    "scraped_at": "2026-01-24T16:00:26.545674"
  },
  {
    "title": "Bumi Resources (BUMI) Targetkan Produksi Batu Bara hingga 78 Juta Ton di 2026",
    "url": "https://www.idxchannel.com/market-news/bumi-resources-bumi-targetkan-produksi-batu-bara-hingga-78-juta-ton-di-2026",
    "date_display": "01/12/2025 17:54 WIB",
    "date": "2025-12-01",
    "image_url": "https://img.idxchannel.com/media/439/images/idx/2025/08/02/bumi_resources_ist.jpg",
    "category": "MARKET NEWS",
    "batch": 25,
    "source": "IDX Channel",
    "scraped_at": "2026-01-24T16:00:26.546216"
  },
  {
    "title": "Saham ASLI Milik Siapa? Emiten General Contractor, Intip Informasi Kepemilikannya",
    "url": "https://www.idxchannel.com/market-news/saham-asli-milik-siapa-emiten-general-contractor-intip-informasi-kepemilikannya",
    "date_display": "01/12/2025 15:55 WIB",
    "date": "2025-12-01",
    "image_url": "https://img.idxchannel.com/media/439/images/idx/2025/12/01/ASLI__1___2_.jpg",
    "category": "MARKET NEWS",
    "batch": 25,
    "source": "IDX Channel",
    "scraped_at": "2026-01-24T16:00:26.546765"
  },
  {
    "title": "Net Buy Asing Susut, Pekan Ini Capai Rp992 Miliar",
    "url": "https://www.idxchannel.com/market-news/net-buy-asing-susut-pekan-ini-capai-rp992-miliar",
    "date_display": "30/11/2025 18:00 WIB",
    "date": "2025-11-30",
    "image_url": "https://img.idxchannel.com/media/439/images/idx/2023/03/18/cara_mengetahui_net_buy.png",
    "category": "MARKET NEWS",
    "batch": 25,
    "source": "IDX Channel",
    "scraped_at": "2026-01-24T16:00:26.547304"
  },
  {
    "title": "10 Saham Top Value di Perdagangan Terakhir November 2025, Intip Nilai Transaksinya",
    "url": "https://www.idxchannel.com/market-news/10-saham-top-value-di-perdagangan-terakhir-november-2025-intip-nilai-transaksinya",
    "date_display": "28/11/2025 16:46 WIB",
    "date": "2025-11-28",
    "image_url": "https://img.idxchannel.com/media/439/images/idx/2025/11/13/Pemegang_Saham_Mayoritas_MBTO.jpg",
    "category": "MARKET NEWS",
    "batch": 25,
    "source": "IDX Channel",
    "scraped_at": "2026-01-24T16:00:26.547845"
  },
  {
    "title": "Jeda Makan Siang, IHSG Parkir di Zona Merah usai Sentuh ATH 8.622",
    "url": "https://www.idxchannel.com/market-news/jeda-makan-siang-ihsg-parkir-di-zona-merah-usai-sentuh-ath-8622",
    "date_display": "27/11/2025 12:13 WIB",
    "date": "2025-11-27",
    "image_url": "https://img.idxchannel.com/media/439/images/idx/2025/02/13/IHSG_merah.jpg",
    "category": "MARKET NEWS",
    "batch": 26,
    "source": "IDX Channel",
    "scraped_at": "2026-01-24T16:00:27.655593"
  },
  {
    "title": "IHSG Hari Ini Berpotensi Melemah Terbatas, Intip Enam Saham Berpotensi Cuan",
    "url": "https://www.idxchannel.com/market-news/ihsg-hari-ini-berpotensi-melemah-terbatas-intip-enam-saham-berpotensi-cuan",
    "date_display": "27/11/2025 09:02 WIB",
    "date": "2025-11-27",
    "image_url": "https://img.idxchannel.com/media/439/images/idx/2024/04/19/IHSG_1.jpg",
    "category": "MARKET NEWS",
    "batch": 26,
    "source": "IDX Channel",
    "scraped_at": "2026-01-24T16:00:27.656918"
  },
  {
    "title": "IHSG Masuk Zona Super Strong Uptrend, Empat Saham Ini Bisa Dicermati",
    "url": "https://www.idxchannel.com/market-news/ihsg-masuk-zona-super-strong-uptrend-empat-saham-ini-bisa-dicermati",
    "date_display": "27/11/2025 06:03 WIB",
    "date": "2025-11-27",
    "image_url": "https://img.idxchannel.com/media/439/images/idx/2024/07/01/IHSG_1.jpg",
    "category": "MARKET NEWS",
    "batch": 26,
    "source": "IDX Channel",
    "scraped_at": "2026-01-24T16:00:27.657518"
  },
  {
    "title": "IHSG Cetak Rekor ATH Baru Lagi, Sore Ini Ditutup ke 8.602",
    "url": "https://www.idxchannel.com/market-news/ihsg-cetak-rekor-ath-baru-lagi-sore-ini-ditutup-ke-8602",
    "date_display": "26/11/2025 16:32 WIB",
    "date": "2025-11-26",
    "image_url": "https://img.idxchannel.com/media/439/images/idx/2023/12/08/saham_naik_-_hijau_-_freepik.jpg",
    "category": "MARKET NEWS",
    "batch": 26,
    "source": "IDX Channel",
    "scraped_at": "2026-01-24T16:00:27.658073"
  },
  {
    "title": "PURI Saham Apa? Emiten Properti & Real Estate, Inilah Proyek dan Pemiliknya",
    "url": "https://www.idxchannel.com/market-news/puri-saham-apa-emiten-properti-real-estate-inilah-proyek-dan-pemiliknya",
    "date_display": "26/11/2025 15:06 WIB",
    "date": "2025-11-26",
    "image_url": "https://img.idxchannel.com/media/439/images/idx/2025/11/26/Screenshot_2025-11-26_151017.png",
    "category": "MARKET NEWS",
    "batch": 26,
    "source": "IDX Channel",
    "scraped_at": "2026-01-24T16:00:27.658627"
  },
  {
    "title": "Saham Grup Bakrie Menggeliat Lagi, BUMI Pimpin Kenaikan",
    "url": "https://www.idxchannel.com/market-news/saham-grup-bakrie-menggeliat-lagi-bumi-pimpin-kenaikan",
    "date_display": "26/11/2025 11:47 WIB",
    "date": "2025-11-26",
    "image_url": "https://img.idxchannel.com/media/439/images/idx/2023/02/17/Batu_Bara-KPC-BUMI-Aldo-1.jpeg",
    "category": "MARKET NEWS",
    "batch": 26,
    "source": "IDX Channel",
    "scraped_at": "2026-01-24T16:00:27.659201"
  },
  {
    "title": "IHSG Berpotensi Rebound Terdorong Wall Street, Cermati AMMN, CDIA, hingga PTRO",
    "url": "https://www.idxchannel.com/market-news/ihsg-berpotensi-rebound-terdorong-wall-street-cermati-ammn-cdia-hingga-ptro",
    "date_display": "26/11/2025 08:55 WIB",
    "date": "2025-11-26",
    "image_url": "https://img.idxchannel.com/media/439/images/idx/2025/11/05/ihsg.jpg",
    "category": "MARKET NEWS",
    "batch": 27,
    "source": "IDX Channel",
    "scraped_at": "2026-01-24T16:00:28.790169"
  },
  {
    "title": "Saham BUMI Melaju Lagi, Analis Soroti Target Teknikal",
    "url": "https://www.idxchannel.com/market-news/saham-bumi-melaju-lagi-analis-soroti-target-teknikal",
    "date_display": "25/11/2025 10:22 WIB",
    "date": "2025-11-25",
    "image_url": "https://img.idxchannel.com/media/439/images/idx/2025/05/16/bumi_resources.jpeg",
    "category": "MARKET NEWS",
    "batch": 27,
    "source": "IDX Channel",
    "scraped_at": "2026-01-24T16:00:28.790718"
  },
  {
    "title": "Ring Bell, IHSG Terkena Profit Taking usai Sentuh ATH",
    "url": "https://www.idxchannel.com/market-news/ring-bell-ihsg-terkena-profit-taking-usai-sentuh-ath",
    "date_display": "25/11/2025 09:25 WIB",
    "date": "2025-11-25",
    "image_url": "https://img.idxchannel.com/media/439/images/idx/2025/02/13/IHSG_merah.jpg",
    "category": "MARKET NEWS",
    "batch": 27,
    "source": "IDX Channel",
    "scraped_at": "2026-01-24T16:00:28.791255"
  },
  {
    "title": "BRMS Targetkan Konstruksi Tambang Emas Palu Rampung Kuartal III-2027",
    "url": "https://www.idxchannel.com/market-news/brms-targetkan-konstruksi-tambang-emas-palu-rampung-kuartal-iii-2027",
    "date_display": "25/11/2025 05:00 WIB",
    "date": "2025-11-25",
    "image_url": "https://img.idxchannel.com/media/439/images/idx/2025/11/24/tambang_emas_Freepik.jpg",
    "category": "MARKET NEWS",
    "batch": 27,
    "source": "IDX Channel",
    "scraped_at": "2026-01-24T16:00:28.791794"
  },
  {
    "title": "BRMS Raih Pinjaman Sindikasi USD625 Juta, Percepat Pengembangan Proyek Emas-Tembaga",
    "url": "https://www.idxchannel.com/market-news/brms-raih-pinjaman-sindikasi-usd625-juta-percepat-pengembangan-proyek-emas-tembaga",
    "date_display": "24/11/2025 22:02 WIB",
    "date": "2025-11-24",
    "image_url": "https://img.idxchannel.com/media/439/images/idx/2022/08/26/Sejarah_Saham_BRMS.jpeg",
    "category": "MARKET NEWS",
    "batch": 27,
    "source": "IDX Channel",
    "scraped_at": "2026-01-24T16:00:28.792328"
  },
  {
    "title": "Resmi Masuk MSCI di Rebalancing November, Simak Proyeksi BREN dan BRMS",
    "url": "https://www.idxchannel.com/market-news/resmi-masuk-msci-di-rebalancing-november-simak-proyeksi-bren-dan-brms",
    "date_display": "24/11/2025 12:28 WIB",
    "date": "2025-11-24",
    "image_url": "https://img.idxchannel.com/media/439/images/idx/2024/03/28/saham_naik_-_freepik_-_9.jpg",
    "category": "MARKET NEWS",
    "batch": 27,
    "source": "IDX Channel",
    "scraped_at": "2026-01-24T16:00:28.792862"
  },
  {
    "title": "Rebalancing MSCI Hari Ini Angkat Saham BREN-BRMS Cs",
    "url": "https://www.idxchannel.com/market-news/rebalancing-msci-hari-ini-angkat-saham-bren-brms-cs",
    "date_display": "24/11/2025 10:20 WIB",
    "date": "2025-11-24",
    "image_url": "https://img.idxchannel.com/media/439/images/idx/2025/08/08/msci_ist.jpg",
    "category": "MARKET NEWS",
    "batch": 28,
    "source": "IDX Channel",
    "scraped_at": "2026-01-24T16:00:29.990923"
  },
  {
    "title": "MSCI Mulai Rebalancing Hari Ini, Inflow Siap Masuk ke Sederet Saham",
    "url": "https://www.idxchannel.com/market-news/msci-mulai-rebalancing-hari-ini-inflow-siap-masuk-ke-sederet-saham",
    "date_display": "24/11/2025 07:22 WIB",
    "date": "2025-11-24",
    "image_url": "https://img.idxchannel.com/media/439/images/idx/2025/04/14/aksi_beli_saham_naik_-_freepik.jpg",
    "category": "MARKET NEWS",
    "batch": 28,
    "source": "IDX Channel",
    "scraped_at": "2026-01-24T16:00:29.991480"
  },
  {
    "title": "Dua Direktur dan Satu Komisaris Mundur, Ini Susunan Manajemen Terbaru BUMI",
    "url": "https://www.idxchannel.com/market-news/dua-direktur-dan-satu-komisaris-mundur-ini-susunan-manajemen-terbaru-bumi",
    "date_display": "23/11/2025 07:00 WIB",
    "date": "2025-11-23",
    "image_url": "https://img.idxchannel.com/media/439/images/idx/2025/08/02/bumi_resources_ist.jpg",
    "category": "MARKET NEWS",
    "batch": 28,
    "source": "IDX Channel",
    "scraped_at": "2026-01-24T16:00:29.992020"
  },
  {
    "title": "Saham BUMI Jadi Sasaran Jual Asing Pekan Ini, Ada Apa?",
    "url": "https://www.idxchannel.com/market-news/saham-bumi-jadi-sasaran-jual-asing-pekan-ini-ada-apa",
    "date_display": "22/11/2025 12:10 WIB",
    "date": "2025-11-22",
    "image_url": "https://img.idxchannel.com/media/439/images/idx/2025/11/22/Bumi_Resources_-_BUMI_-_22_Nov_25.jpg",
    "category": "MARKET NEWS",
    "batch": 28,
    "source": "IDX Channel",
    "scraped_at": "2026-01-24T16:00:29.992552"
  },
  {
    "title": "Gelombang Akuisisi Dongkrak Saham ATAP, BOGA, SGRO, hingga STAR",
    "url": "https://www.idxchannel.com/market-news/gelombang-akuisisi-dongkrak-saham-atap-boga-sgro-hingga-star",
    "date_display": "22/11/2025 09:52 WIB",
    "date": "2025-11-22",
    "image_url": "https://img.idxchannel.com/media/439/images/idx/2025/11/22/deal_akuisisi_merger_-_handshake_-_Freepik_22_Nov_25.jpg",
    "category": "MARKET NEWS",
    "batch": 28,
    "source": "IDX Channel",
    "scraped_at": "2026-01-24T16:00:29.993088"
  },
  {
    "title": "Apa Bisnis SSIA? Simak Daftar Proyek Properti dan Pemegang Saham Mayoritasnya",
    "url": "https://www.idxchannel.com/market-news/apa-bisnis-ssia-simak-daftar-proyek-properti-dan-pemegang-saham-mayoritasnya",
    "date_display": "21/11/2025 18:18 WIB",
    "date": "2025-11-21",
    "image_url": "https://img.idxchannel.com/media/439/images/idx/2025/11/21/Gran_Melia_Booking_com.jpg",
    "category": "MARKET NEWS",
    "batch": 28,
    "source": "IDX Channel",
    "scraped_at": "2026-01-24T16:00:29.993621"
  },
  {
    "title": "SMDM Saham Apa? Diakuisisi Sinar Mas BSD, Intip Portofolio Proyeknya",
    "url": "https://www.idxchannel.com/market-news/smdm-saham-apa-diakuisisi-sinar-mas-bsd-intip-portofolio-proyeknya",
    "date_display": "21/11/2025 17:13 WIB",
    "date": "2025-11-21",
    "image_url": "https://img.idxchannel.com/media/439/images/idx/2025/11/21/Screenshot_2025-11-21_171709.png",
    "category": "MARKET NEWS",
    "batch": 29,
    "source": "IDX Channel",
    "scraped_at": "2026-01-24T16:00:31.103121"
  },
  {
    "title": "Bedah Arah Baru Energi Bersih, Analis Soroti Saham Ini",
    "url": "https://www.idxchannel.com/market-news/bedah-arah-baru-energi-bersih-analis-soroti-saham-ini",
    "date_display": "21/11/2025 13:00 WIB",
    "date": "2025-11-21",
    "image_url": "https://img.idxchannel.com/media/439/images/idx/2025/11/21/energi_terbarukan_-_solar_panel_-_Freepik_-_21_Nov_25.jpg",
    "category": "MARKET NEWS",
    "batch": 29,
    "source": "IDX Channel",
    "scraped_at": "2026-01-24T16:00:31.103675"
  },
  {
    "title": "Pendiri DATA Berencana Akuisisi 51 Persen Saham Trimitra Prawaraland (ATAP)",
    "url": "https://www.idxchannel.com/market-news/pendiri-data-berencana-akuisisi-51-persen-saham-trimitra-prawaraland-atap",
    "date_display": "20/11/2025 17:50 WIB",
    "date": "2025-11-20",
    "image_url": "https://img.idxchannel.com/media/439/images/idx/2025/11/20/trimitra_atap.jpg",
    "category": "MARKET NEWS",
    "batch": 29,
    "source": "IDX Channel",
    "scraped_at": "2026-01-24T16:00:31.104221"
  },
  {
    "title": "IHSG Hari Ini Berpotensi Lanjutkan Penguatan, Enam Saham Berikut Bisa Jadi Pilihan",
    "url": "https://www.idxchannel.com/market-news/ihsg-hari-ini-berpotensi-lanjutkan-penguatan-enam-saham-berikut-bisa-jadi-pilihan",
    "date_display": "20/11/2025 07:42 WIB",
    "date": "2025-11-20",
    "image_url": "https://img.idxchannel.com/media/439/images/idx/2025/11/14/IHSG_2.jpg",
    "category": "MARKET NEWS",
    "batch": 29,
    "source": "IDX Channel",
    "scraped_at": "2026-01-24T16:00:31.104762"
  },
  {
    "title": "IHSG Berpotensi Bullish, Cek Saham BUMI, RAJA, hingga RATU",
    "url": "https://www.idxchannel.com/market-news/ihsg-berpotensi-bullish-cek-saham-bumi-raja-hingga-ratu",
    "date_display": "20/11/2025 07:30 WIB",
    "date": "2025-11-20",
    "image_url": "https://img.idxchannel.com/media/439/images/idx/2025/11/07/ihsg_hijau.jpg",
    "category": "MARKET NEWS",
    "batch": 29,
    "source": "IDX Channel",
    "scraped_at": "2026-01-24T16:00:31.105299"
  },
  {
    "title": "Saham BUMI Melesat Jelang RUPSLB, Aksi Akumulasi Investor Ini Jadi Sorotan",
    "url": "https://www.idxchannel.com/market-news/saham-bumi-melesat-jelang-rupslb-aksi-akumulasi-investor-ini-jadi-sorotan",
    "date_display": "19/11/2025 11:13 WIB",
    "date": "2025-11-19",
    "image_url": "https://img.idxchannel.com/media/439/images/idx/2023/02/17/Tanjung_Bara_Port-Batu_Bara-KPC-Bumi-Aldo-1.jpeg",
    "category": "MARKET NEWS",
    "batch": 29,
    "source": "IDX Channel",
    "scraped_at": "2026-01-24T16:00:31.105835"
  },
  {
    "title": "IHSG Hari Ini Berpotensi Sideways, Investor Tunggu Keputusan BI Rate",
    "url": "https://www.idxchannel.com/market-news/ihsg-hari-ini-berpotensi-sideways-investor-tunggu-keputusan-bi-rate",
    "date_display": "19/11/2025 07:06 WIB",
    "date": "2025-11-19",
    "image_url": "https://img.idxchannel.com/media/439/images/idx/2025/11/14/IHSG_2.jpg",
    "category": "MARKET NEWS",
    "batch": 30,
    "source": "IDX Channel",
    "scraped_at": "2026-01-24T16:00:32.215311"
  },
  {
    "title": "Hasil Tambang Emas Poboya Dipasok ke Lima Pembeli Domestik, Ini Kata Manajemen BRMS",
    "url": "https://www.idxchannel.com/market-news/hasil-tambang-emas-poboya-dipasok-ke-lima-pembeli-domestik-ini-kata-manajemen-brms",
    "date_display": "18/11/2025 12:08 WIB",
    "date": "2025-11-18",
    "image_url": "https://img.idxchannel.com/media/439/images/idx/2025/01/11/brms.jpeg",
    "category": "MARKET NEWS",
    "batch": 30,
    "source": "IDX Channel",
    "scraped_at": "2026-01-24T16:00:32.215858"
  },
  {
    "title": "BRMS Pastikan Pajak Ekspor Emas Tak Pengaruhi Kinerja Pendapatan",
    "url": "https://www.idxchannel.com/market-news/brms-pastikan-pajak-ekspor-emas-tak-pengaruhi-kinerja-pendapatan",
    "date_display": "18/11/2025 11:56 WIB",
    "date": "2025-11-18",
    "image_url": "https://img.idxchannel.com/media/439/images/idx/2025/02/13/BRMS.jpeg",
    "category": "MARKET NEWS",
    "batch": 30,
    "source": "IDX Channel",
    "scraped_at": "2026-01-24T16:00:32.216403"
  },
  {
    "title": "Siapa Pemilik Saham APEX? Emiten Pengeboran Offshore, Simak Profil dan Pengendalinya",
    "url": "https://www.idxchannel.com/market-news/siapa-pemilik-saham-apex-emiten-pengeboran-offshore-simak-profil-dan-pengendalinya",
    "date_display": "18/11/2025 11:13 WIB",
    "date": "2025-11-18",
    "image_url": "https://img.idxchannel.com/media/439/images/idx/2025/11/18/Screenshot_2025-11-18_111653.png",
    "category": "MARKET NEWS",
    "batch": 30,
    "source": "IDX Channel",
    "scraped_at": "2026-01-24T16:00:32.216941"
  },
  {
    "title": "Bea Ekspor Emas hingga 15 Persen, Intip Emiten yang Paling Terdampak",
    "url": "https://www.idxchannel.com/market-news/bea-ekspor-emas-hingga-15-persen-intip-emiten-yang-paling-terdampak",
    "date_display": "18/11/2025 10:14 WIB",
    "date": "2025-11-18",
    "image_url": "https://img.idxchannel.com/media/439/images/idx/2025/10/22/emas_-_freepik_-_20_Okt_25.jpg",
    "category": "MARKET NEWS",
    "batch": 30,
    "source": "IDX Channel",
    "scraped_at": "2026-01-24T16:00:32.217480"
  },
  {
    "title": "Apa Bisnis BUMI? Simak Profil Usaha dan Daftar Konsesi Tambangnya di Indonesia",
    "url": "https://www.idxchannel.com/market-news/apa-bisnis-bumi-simak-profil-usaha-dan-daftar-konsesi-tambangnya-di-indonesia",
    "date_display": "17/11/2025 18:08 WIB",
    "date": "2025-11-17",
    "image_url": "https://img.idxchannel.com/media/439/images/idx/2025/05/16/bumi_resources.jpeg",
    "category": "MARKET NEWS",
    "batch": 30,
    "source": "IDX Channel",
    "scraped_at": "2026-01-24T16:00:32.218019"
  },
  {
    "title": "Siapa Pemilik Saham MEDC? Inilah Profil Usaha dan Daftar Pemegang Sahamnya",
    "url": "https://www.idxchannel.com/market-news/siapa-pemilik-saham-medc-inilah-profil-usaha-dan-daftar-pemegang-sahamnya",
    "date_display": "17/11/2025 17:25 WIB",
    "date": "2025-11-17",
    "image_url": "https://img.idxchannel.com/media/439/images/idx/2025/11/07/MedcoEnergi_MEDC_Gabung_OGMP_2_0.jpeg",
    "category": "MARKET NEWS",
    "batch": 31,
    "source": "IDX Channel",
    "scraped_at": "2026-01-24T16:00:33.334281"
  },
  {
    "title": "Deretan Saham Komoditas Layak Dicermati, Ini Daftarnya",
    "url": "https://www.idxchannel.com/market-news/deretan-saham-komoditas-layak-dicermati-ini-daftarnya",
    "date_display": "17/11/2025 12:15 WIB",
    "date": "2025-11-17",
    "image_url": "https://img.idxchannel.com/media/439/images/idx/2024/05/16/batu_bara_-_freepik_-_3-min__2_.jpg",
    "category": "MARKET NEWS",
    "batch": 31,
    "source": "IDX Channel",
    "scraped_at": "2026-01-24T16:00:33.334828"
  },
  {
    "title": "Saham Konglomerat Masih Jadi Pilihan, Cek yang Paling Menarik",
    "url": "https://www.idxchannel.com/market-news/saham-konglomerat-masih-jadi-pilihan-cek-yang-paling-menarik",
    "date_display": "17/11/2025 11:18 WIB",
    "date": "2025-11-17",
    "image_url": "https://img.idxchannel.com/media/439/images/idx/2023/11/18/saham_naik_asing_-_freepik.jpg",
    "category": "MARKET NEWS",
    "batch": 31,
    "source": "IDX Channel",
    "scraped_at": "2026-01-24T16:00:33.335372"
  },
  {
    "title": "IHSG Hari Ini Dibuka Menguat ke 8.414 Ditopang Sektor Properti dan Infrastruktur",
    "url": "https://www.idxchannel.com/market-news/ihsg-hari-ini-dibuka-menguat-ke-8414-ditopang-sektor-properti-dan-infrastruktur",
    "date_display": "17/11/2025 09:21 WIB",
    "date": "2025-11-17",
    "image_url": "https://img.idxchannel.com/media/439/images/idx/2025/11/15/IHSG_8_400.JPG",
    "category": "MARKET NEWS",
    "batch": 31,
    "source": "IDX Channel",
    "scraped_at": "2026-01-24T16:00:33.335910"
  },
  {
    "title": "BUMI Catat Pertumbuhan Kinerja, Analis Soroti Akuisisi Tambang Emas Australia",
    "url": "https://www.idxchannel.com/market-news/bumi-catat-pertumbuhan-kinerja-analis-soroti-akuisisi-tambang-emas-australia",
    "date_display": "16/11/2025 04:30 WIB",
    "date": "2025-11-16",
    "image_url": "https://img.idxchannel.com/media/439/images/idx/2025/04/22/bumi_resources.jpg",
    "category": "MARKET NEWS",
    "batch": 31,
    "source": "IDX Channel",
    "scraped_at": "2026-01-24T16:00:33.336448"
  },
  {
    "title": "Barito Pacific (BRPT) Serap Belanja Modal Rp8 Triliun hingga Kuartal III-2025",
    "url": "https://www.idxchannel.com/market-news/barito-pacific-brpt-serap-belanja-modal-rp8-triliun-hingga-kuartal-iii-2025",
    "date_display": "15/11/2025 18:00 WIB",
    "date": "2025-11-15",
    "image_url": "https://img.idxchannel.com/media/439/images/idx/2025/11/15/barito_brpt.jpg",
    "category": "MARKET NEWS",
    "batch": 31,
    "source": "IDX Channel",
    "scraped_at": "2026-01-24T16:00:33.336983"
  },
  {
    "title": "BUMI Caplok Jubilee Metals dan Laman Mining, Ini Profilnya",
    "url": "https://www.idxchannel.com/market-news/bumi-caplok-jubilee-metals-dan-laman-mining-ini-profilnya",
    "date_display": "15/11/2025 18:00 WIB",
    "date": "2025-11-15",
    "image_url": "https://img.idxchannel.com/media/439/images/idx/2025/11/15/bauksit_okz.jpg",
    "category": "MARKET NEWS",
    "batch": 32,
    "source": "IDX Channel",
    "scraped_at": "2026-01-24T16:00:34.437626"
  },
  {
    "title": "BUMI Terbitkan Obligasi Rp780 Miliar untuk Biayai Akuisisi Jubilee Metals dan Laman Mining",
